marketplace,customer_id,review_id,product_id,product_parent,product_title,product_category,star_rating,helpful_votes,total_votes,vine,verified_purchase,review_headline,review_body,review_date
US,44326783,R23L2N2ZX0QLWP,B00D7MOHDO,699648616,Samsung Universal Micro Home Travel Charger for Galaxy S3/S4/Note 2 - Non-Retail Packaging - White,Wireless,4,0,0,N,Y,Four Stars,Good product.,2015-08-31
US,38671592,R3VZOCC5YZIRAF,B00ZBKY938,493326907,AaBbDd iPhone6 Metal Protective Bumper Aluminum bumper case Hard Cover Case High Quality Protective Case Anti-shock Case Anti scratch Case Metal bumpers and PC case assembled (iPhone6 White),Wireless,5,1,1,N,Y,Decent Case for you iPhone 6/6 Plus,Overall I like this case. It keeps my phone safe from drops  but the bottom part of the case keeps falling off. It would be nice if there were a way for the two parts of the case to snap or click together to prevent this.,2015-08-31
US,26783560,R3YB9QRDLAA79,B00PG8TK1Q,933699814,Lenmar Maven iPhone 6 Protective Battery Case MFI Certified,Wireless,5,0,0,N,Y,Five Stars,Just as expected. Get a lot more time out of my phone now!,2015-08-31
US,129291,R23JQDBEWIGR0W,B00ZP8HY1K,221219998,SaveUpMore Hybrid Dual Layer Rubber Bumper Protective Case for Samsung Galaxy J1 Bundle with Screen Protector,Wireless,5,0,0,N,Y,Five Stars,Works great love it very much!,2015-08-31
US,11485516,R39VSRSFN69KAO,B00XAF0AIE,316365051,New OEM Samsung 3.5mm PREMIUM SOUND/ Stereo Earbud Headphones for Galaxy S6 S6 Edge S5 S4 Note Edge 4 3 2 EO-EG900BW (Bulk Packaging),Wireless,5,0,0,N,N,Five Stars,Great ear phones! Works well.,2015-08-31
US,3687810,R3BVFRTKS15LSC,B00OHZVN5U,563470521,Limefuel Lite Series,Wireless,2,3,3,N,Y,Do not buy. UPDATED,It was an excellent charger until both USB ports came apart and are so loose it won't hold a USB plug to even charge. I might take it apart to see what's wrong since my return period is over. I popped the case open to find 18650 batteries inside. I only did one corner but judging the size of say there's maybe 6-8 of the puppies in there. It may not work at a phone charger anymore but hey. Free flashlight batteries. I'll keep updating this till I fix it or junk it. UPDATE: I have taken it apart to find 8 18650 batteries. I also found why it wasn't charging. Weak soldering that broke and only connected when I held it a certain way that connected the USB port to the mother board. I will update when I get home again and try to resolder the ports.,2015-08-31
US,19097949,RVCOIFQWMEFCM,B00R0D6UPY,422434233,Akcord® Apple MFi Certified Lightning to USB Cable (3.3 Feet / 1 Meter) - FREE Bonus eBook Included - Flat Design Charge and Sync Data Cord for iPhone 6 / 6 Plus / 5S / 5C / 5  iPad Air / iPad Mini 3 / 2 / iPad Mini with Retina display / iPad 4th generation  iPod 5th generation and iPod nano 7th generation – 24-Month Warranty,Wireless,5,0,0,N,Y,Five Stars,Works well with 4th generation iPad!,2015-08-31
US,51031410,R35RDOYEVFS6I8,B00U6EZC5S,348338558,Galaxy S6 Glass Screen Protector  Tech Armor Premium Ballistic Glass Samsung Galaxy S6 Screen Protectors [1],Wireless,5,0,0,N,Y,A Perfect Installation is So Easy,I've used their screen protectors before but is is my first experience with the glass screen protector. It fits nicely and was so easy to install.  No bubbles of course!,2015-08-31
US,17901787,R3B5J5T23RNM73,B00QK0H2KK,510965496,Micro USB Cable  Eversame 5-Pack 6Ft 2M Nylon Braided Micro USB 2.0 Sync Charging Cord for Samsung Galaxy Note 5/S6 Edge Plus  HTC One M8  LG G3  Android Phones and more-Red Yellow Blue Green Orange,Wireless,5,0,0,N,Y,Five Stars,Cords work great have no complaints.,2015-08-31
US,32008493,R20Q5GPID4HTC8,B00PAJN32S,520855090,Anker Universal Cell Phone Car Mount Dashboard and Windshield Holder for iPhone  Samsung  LG  Nexus  HTC  Motorola  Sony and Other Smartphones,Wireless,4,0,0,N,Y,This phone mount is clean and looks like it belongs in the car,This phone mount is clean and looks like it belongs in the car. Not some ugly piece of plastic that serve no purpose. My only complaint is the suction cup. The mount tends to fall from the windshield often. This is can be frustrating when you're using your GPS,2015-08-31
US,51047324,R1MTBHCM4BXD82,B00P936188,856423969,Anker 60W 6-Port USB Wall Charger  PowerPort 6 for iPhone X/ 8/ 7 / 6s / Plus  iPad Pro / Air 2 / mini/ iPod  Galaxy S7 / S6 / Edge / Plus  Note 5 / 4  LG  Nexus  HTC and More,Wireless,5,0,0,N,Y,Small  compact  works.,Works for its intended purpose.,2015-08-31
US,9658148,R3GO91IH1V4GZQ,B00Q106EVW,530129385,Galaxy Note 4 case  FIBEST Elegant Bag Design Wallet Leather Case Card Slot Cover with Metal Chain Strap for Samsung Galaxy Note 4 (Black),Wireless,2,0,0,N,Y,Two Stars,Not at all what I wanted. The quality but less than desired.,2015-08-31
US,25758108,R1EYFLKTNF6QIW,B00Q88Q16K,703393882,Anker Quick Charge 2.0 18W USB Turbo USB Wall Charger for Samsung Galaxy S6 / S6 Edge / Edge+  Note 5  Note 4 / Edge  Nexus 6  HTC M9  Xperia Z3 / Z2 and More (Black),Wireless,5,2,3,N,N,At par with original charger,This would be probably my fourth Anker product and there is a reason for it. The charger is at par with latest smartphone chargers. I own a OnePlus One and did a charge test. There is absolutely no noticeable difference between as far as charge time is concerned. Tested the ampere rating with app as well  they both perform quite similar. Bought it off a sale day at $8 bucks.  Pros: - Super quick charging i.e. Qualcomm Quick Charge 2.0 with 2A output - 3ft long powerful cable included which is ideal for most uses - Sub $10 price point,2015-08-31
US,1241670,RXH7ORVVGKW3C,B00KPX88Q0,341190258,Wallet Cases for Samsung Galaxy S5 Active,Wireless,5,2,2,N,Y,Five Stars,I have the S5 apparently bought the wrong case =(,2015-08-31
US,16603604,R1W4JCN0WVLOYF,B00OS6L07Y,315387097,MPERO Collection Screen Protectors for Motorola Moto X (2nd Gen 2014),Wireless,1,3,3,N,Y,These come pre-impreganated with dust. Once installed  the ...,These come pre-impreganated with dust. Once installed  the cover shimmers rainbow colors. I opted to leave my screen unprotected rather than use these. If these were condoms  then I'd have dozens of children by now.,2015-08-31
US,10002604,R1266X3WFBK4D4,B00NWL33OO,522226920,Nexus 6 Screen Protector Yootech Google Nexus 6 Tempered Glass Screen Protector 0.3mm 9H Hardness Featuring Anti-Scratch ,Wireless,5,0,0,N,Y,Protects your screen from scratches while giving it that smooth ...,Protects your screen from scratches while giving it that smooth glass feeling. I'll never go back to plastic screen protectors.,2015-08-31
US,20341570,R210VX1BFYPU7K,B00UPQ9IZW,529992444,Galaxy S4 Screen Protector  Yooyo™ 0.33mm Tempered Glass Crystal Clear | Slim | Anti Finger Print | Scratch Proof and Light weight Screen Protector for Samsung Galaxy S4  I9500  Verizon I545  T-Mobile M919  AT&T I337  Sprint L720,Wireless,5,0,0,N,Y,Five Stars,Great quality. Very easy to install.,2015-08-31
US,49301204,RMYGDEB324ZTH,B00D82O68Y,705881130,Anker® 24W 2-Port Rapid USB Car Charger with PowerIQ Technology for iPhone  iPad Air 2  Samsung Galaxy  Nexus  HTC  Motorola  Nokia and More (Black),Wireless,5,0,0,N,Y,Low profile and works great.,Charges 2 5s's at the same time easily. Nice and low profile  was a lot smaller than most others I saw in the store.,2015-08-31
US,15043009,R2SOCLGSXXTI22,B00WQFPS8G,125212883,MXX Samsung Galaxy S6 Tempered Glass Screen Protector,Wireless,5,0,0,N,Y,Five Stars,Fit perfectly,2015-08-31
US,126323,R15UHD6WQVS789,B00WSKIJP8,126181056,iPod Touch 5 Waterproof Case KINGCOOL(TM) Waterproof Shockproof Dirt Proof Snow Proof Heavy Duty Full Body Armor Defender Protective Case Cover for Apple iPod Touch 5,Wireless,5,9,9,N,Y,Five Stars,These are the best! Super sturdy and truly waterproof. Tons better than my current case.,2015-08-31
US,50110558,R3FC6JH94LWGDI,B00PJD06PM,907317349,OEM LG 1.8 Charger MCS-04WD with 2.0 5FT Micro USB for LG G2 Google Nexus G Flax L9 F3,Wireless,4,0,0,N,Y,Four Stars,It works. Period.,2015-08-31
US,31578030,R3JILCXHSW89K3,B008GVL9YQ,873830995,iXCC ® 10ft (TEN FEET !) 2pcs [30 Pin Connector]White EXTRA LONG Extended Length USB SYNC Cable Charger Cord for iPhone3G  3Gs  4  4s  iPod 1 through 6  iPod Touch 1 through 4  iPad 1 through 3,Wireless,2,1,1,N,Y,Amazed... for a month,I am amazed. This cord is perfect. First  the length. I am able to use my device in bed  use it on the couch in any comfortable position  and best of all charge my device without any faulty wiring.   The cord (10 ft) I bought is beautiful. It is nearly identical to the shipped 30-pin cords that come with iDevices. The connection from the charging end to the port on my device is firm and fixated yet not so much that its a struggle to unplug. Storage is nice because the cord coils up into a nice circle  making a comfortable width of about a soda can.  The best part of this buy is that the price was around ten dollars (including shipping). TEN DOLLARS. The quality of this accessory is so akin to the stock cords that I can hardly believe it. I will absolutely be buying more.  UPDATE: It's been about one month. The cord has ceased to charge my device. I had to buy yet another 30-pin cord. I'm asking for a refund.,2015-08-31
US,35023284,R2626ZXTOWK1EH,B00JTV04QQ,921164324,Etech Crystal Clear Screen Protector Film for Apple iPad mini  iPad mini 2  iPad Mini 3 with Retina Display  3-Pack,Wireless,5,0,0,N,Y,Good value. Keeps screen protected. Quick delivery.,Nice value. Protects the screen well. Delivered quickly.,2015-08-31
US,28081079,R3M3ZU44CQI1UA,B00CPVC1P4,659901803,EasyAcc Power Bank Case for Anker PowerCore 10000mAh External Batteries Ultra-Compact High-speed Power Bank Travel Protective Case Carrying Pouch (Inner Size: 6.49 x 2.95 x 0.86 in) -- Black,Wireless,4,0,1,N,Y,Must have for your EasyAcc battery pack,Works nicely with the 15000mAh version and keeps it clean and protected. The case is a little bit longer which works out well as you can plug in the cable and zip it up with only the wire poking out. The mesh pocket is handy to hold the USB cables and user's manual. The zipper could be beefier  but then again  I haven't had any problems with it yet.,2015-08-31
US,11489592,RDEF9QEW65A2K,B00CPFPKAI,447434194,Vktech 10PCS Transparent Standard SD SDHC Memory Card Case Holder Box Storage New,Wireless,5,0,0,N,Y,Perfect!,Nice will work just fine!,2015-08-31
US,2221237,RLGNI5VO7Z5OV,B00ZTFNSDM,989469091,Galaxy Note 4 Case Samsung Galaxy Note4 Liquid Case UZZO Bling 3D Moving Flowing Sparkling Glitter Quicksand And Little Heart Hard Plastic Back Case Cover For Samsung Galaxy Note 4 (Glitter:Orange),Wireless,5,0,0,N,Y,Five Stars,Thx,2015-08-31
US,495847,R2TDI0RK2WUB9B,B00UH8KKA0,892704278,amFilm Galaxy S6 Screen Protector Tempered Glass (Front) and PET (Back) Screen Protector for Samsung Galaxy S6 (NOT S6 Edge) (1-Pack) [in Retail Packaging],Wireless,5,0,0,N,Y,Love it,I'm so satisfied with this product. When my screen protector was damaged  I emailed them and they sent a new one within a few days. So glad I ordered this product.,2015-08-31
US,41570531,R31MQTA7ONUN6A,B0060KKW3O,122932709,9 Cell 7800mAh Battery for Dell Inspiron 13R 14R 15R 17R Series  Replacement for Battery J1KND 9T48V 312-0233 965Y7 04YRJH4T7JN (Extended Capacity),Wireless,5,0,0,N,Y,Five Stars,working perfect,2015-08-31
US,41189747,RU7WQYCYW3BC3,B00PAE1CWG,712134002,5s Case  iPhone 5 Case - MOLLYCOOCLE Fashion Style Colorful Painted Hot Pink Love Pattern PC Hard Cover Case for iPhone 5&5s(Hot Pink Love),Wireless,3,1,1,N,Y,Hakuna Matata Case,The case I purchased was the &#34;Hakuna Matata&#34; saying one. I also have the same problem with the charging area not being able to fit the plug. Overall the skin is pretty durable protection (not if you drop it of course). But protects from scratches. It does leave the bottom open for dust and dirt to get into the speaker holes  so clean often.,2015-08-31
US,1400247,RR3YQIQHORMQ1,B00OY5T5SA,797467399,iPhone 6 Screen Protector  Tech Armor Privacy Edge to Edge Glass Apple iPhone 6S / iPhone 6 (4.7-inch) Screen Protectors (Black) [1],Wireless,4,0,0,N,Y,Four Stars,Not perfect but so good. Size is litter small to cover my phone but also can accept.,2015-08-31
US,163486,RPKDUANJ9QEQX,B00VSJE1MU,793349524,Selfie stick  Kiwii Selfie stick monopod  3-In-1 Self-portrait Monopod Extendable Battery Free Selfie Stick with built-in Remote Shutter w/ Adjustable Phone Holder for iPhone 6  iPhone 6 Plus  iPhone 5 5s 5c  Android  Wire,Wireless,1,0,0,N,Y,save ur money its cheap,Broke the 2nd day,2015-08-31
US,51548254,ROAYJ8ZNKKTXR,B00SNVC416,459153468,LABC - Cable & Ultra Protection Case - Apple Certified MFi Lightning Cable in Case -iPhone Lightning Cable Charging Apple USB Cable Data Sync Cable 8 Pin Cable for iPhone 5/5s/5c 6s 6s Plus iPad iPod 5G iPhone 6,Wireless,5,0,0,N,N,great deal!,I got promo code for leaving fair review. great deal!,2015-08-31
US,26253190,R3LW5H6L24F65F,B00YAH1AXK,900207733,QY8 V4.1 Wireless Bluetooth Headphones Sports Running Headphones with Microphone  Sweatproof QCY In-Ear Stereo Wireless Bluetooth Earbuds Headset Earphones (Black),Wireless,4,0,0,N,Y,Good quality and versatile.,These are good quality; I like the Bluetooth capability. I like how they can be used wirh music and phone calls.  Sometimes  though  they do fall out of my ears. That causes an inconvenience. I would recommend these for use.,2015-08-31
US,779255,R2RX7E0BB44HZP,B0045EFZUM,414473472,Uniden Public Safety Receiver (HOMEPATROL),Wireless,1,0,2,N,Y,One Star,does not pick up at all,2015-08-31
US,227197,R3VG8HP2767HWG,B00I13ETZU,962453087,ELENKER 2200mAh Extended Battery Case Back Up Power Bank for iPhone 5 / 5S Back Up (iOS 7 or above Compatible) + Lightning Charging Port + Kick Stand + Slim Fit Slider Design + Full Body Protection + On/Off Switch LED Battery Level Indicator  Compatible with AT&T  T-Mobile  Verizon  Sprint,Wireless,1,0,0,N,Y,Not a good device,I had this for only a month and the charging port just broke off inside my phone when i was taking my phone out of it. It has to be a defective device and now I can't return it. I expected this device to last longer.,2015-08-31
US,3703581,RHKUNA35YIQDW,B00KDLL3YS,501951090,UNU Enerpak Micro Battery,Wireless,4,1,1,N,N,Super Small Lightweight Charger,This is my review of the [[ASIN:B00KDLL3YS UNU Enerpak Micro Battery]]. I received this product in exchange for an honest and unbiased review. The packaging the product comes in is very simple and in the box you get a user guide and a 1 foot long micro-usb charging cable. The cable can also be used to sync your phone to your computer so that's a plus.<br /><br />Onto the build of the actual battery pack this thing is incredibly small and lightweight. I weighed it at only 2.3 oz! It measures only 3.5 inches long and 1.1 or .78 inches wide depending on which side your measuring. The battery has a plastic build which contributes to the lightweight design I guess. There is also can LED light to show if the battery is charged when charging it. So it's red when charging then changes to blue when fully charged. Now the specs say this has a 1 Amp input but in my testing it actually charged slower than that at about 0.7 Amps so charging took a little bit longer than other battery packs of this capacity at about 4 to 5 hours. The USB Port outputs at 1 Amp which did output 1 Amp when I tested it with my usb power monitor.<br /><br />One thing a lot of people don't realize is that portable batteries like these are never 100% efficient so you will never get the stated capacity. So you should always estimate you'll get about 70% of the total. Sometimes more or less depending on how efficient the battery is. I tested this battery using my PortaPow USB Power Monitor and using the battery to charge up my Nexus 5. I got a total of 1566 mAh which needs to be converted so the actual number is 2116 mAh. Since the stated capacity of this battery is 2800 mAh this gives us a 75% efficiency which is the average for these battery packs. Overall the Enerpak Micro Battery from Unu is a great product for you if you want the small and lightest battery if you can overlook the long charge times and that fact that you don't get different LED colors to show your charge level. Here is a link to my review on Youtube: https://www.youtube.com/watch?v=zIgL0_IFwB8ps://www.youtube.com/watch?v=zIgL0_IFwB8,2015-08-31
US,7412011,R1215D76DKIR9E,B00KR0QMAU,442907313,IKASEFU(TM) Girl's Cute Flower PU Leather Folio Case Protective Book Style Flip Cover Bling Case with Stand and Rhinestone for Apple iPad Mini with Retina Display/ iPad Mini 2(2013 Release) (Butterfly Fairy),Wireless,5,0,0,N,Y,Five Stars,Love it,2015-08-31
US,25531453,R2W3X6VTSVLFTQ,B0113LUY64,270646697,2.1A + 1A Dual Usb Car Charger For iPhone 6 6 Plus 5C/5S/5/4S/4  iPad 1/2/3/4  GALAXY S4 S3,Wireless,4,0,0,N,N,but after I put it back together and plugged it in I loved it. It seemed to charge my phone quicker ...,It came with the cover snapped off  but after I put it back together and plugged it in I loved it. It seemed to charge my phone quicker then my old one  and I love that I can charge my phone in one and my daughter's phone in the other. The red light lets you know without wondering that your phone or device is charging. I have charged not only my phone but my laptop as well as my tablet. It seems substantial and strong enough to stand up to my teenagers and all the electronics that &#34;must&#34; be charged while driving. I am glad I was able to have the chance to purchase this through the VIP review club  and would definitely buy again.,2015-08-31
US,22188396,RWZ01A9TP1MAE,B00TX5ORZC,644693358,Samsung Galaxy S6 G920F Smartphone (5.1 Zoll Touch-Display  64 GB Speicher  Android 5.0),Wireless,5,0,0,N,Y,Five Stars,This phone is amazing,2015-08-31
US,10139475,R3R4TR1INOL8UZ,B00NP3K8Y2,403264326,Samsung Galaxy Note 4 Case  Protective Cover,Wireless,5,0,0,N,Y,Five Stars,Very very very good quality and make the device looks much more premium.<br />It was just one issue that the package it was broken but the case it self it was ok,2015-08-31
US,51101127,RZRT9RB9UD2PY,B005VOFLY0,50385418,Insten Premium Black Car Audio Cassette Adapter Compatible with Huawei Google Nexus 6P; LG Google Nexus 5X; Samsung Galaxy S6/ Galaxy S6 Edge Apple iPhone 4/4S,Wireless,1,0,0,N,Y,One Star,The wiring on this product was defective,2015-08-31
US,28133862,ROHCYY1ZW2G0T,B001F0RPGG,49705334,Escort Passport Radar Detector,Wireless,5,0,0,N,Y,Great choice,Love it! This is a replacement for an older 7-8 year model that finally gave up. Works great with great distance detection  loud volume options and the GPS feature on alert tells you your current speed. The blue readout is great at night  but hard to see in bright sun unless it is on the Max setting. You cannot go wrong with this unit.,2015-08-31
US,1304987,R2GPIGXGXSQ07B,B00QQ8KFN2,746944313,Note 4 Case  E LV Galaxy Note 4 Case Cover - Clear Hybrid Protective Case Cover for Samsung Galaxy Note 4 with 1 Stylus  1 Screen Protector and 1 Microfiber Cleaning Cloth,Wireless,5,0,0,N,Y,Stylish case! Stunning! My girlfriend wants one too!,The case is so beautiful   it is stunning! It fits my Galaxy Note 4  very snug  perfect cutouts for all ports  absolutely gorgeous. I have a white Galaxy Note 4  so the case  looks exactly like in the picture....actually better. I think the picture does not do it justice. My phone looks better and more stylish with clear case and a little touch of fuschia. My girlfriend is so in love with this case  she wants one  too...I might order one as a gift for her  also clear and fuschia ( dark pink)  Update: I ordered another case for my friend and she is very happy with it. We both love our clear cases with just a hint of pink.,2015-08-31
US,32332179,R3FBND28XRZHT9,B0136NJTLS,46454569,Cricket Wireless Complete Starter Pack: Nano SIM Card with Standard & Micro Adapters,Wireless,5,12,15,N,N,Works great  love Cricket  but a caution about the nanoSIM adapters.,I Bought the previous version of this product but don't see a difference between the two. Works great with Cricket  but there is a caution.<br /><br />It includes a nanoSIM  with adapters for microSIM and miniSIM. I didn't know the difference  but the phone I got had an icon on the box that said not to use adapters. I googled and found out that the problem isn't electrical  it is mechanical in that the contacts that connect to the SIM card can catch on the plastic seams of the adapter if the SIM is removed and bend or break.<br /><br />This problem isn't a concern for me since I have no intention of ever removing the SIM  but it could become an issue if I change carriers (or Cricket requires a SIM change for some reason).<br /><br />So  depending on your phone  and if you ever want to remove the SIM  this may be a problem. You can google how to remove a nanoSIM in an adapter safely  which essentially is to use a thin plastic sheet (like screen protector film) to slip in between the SIM and contacts before removing the adapter in order to protect the contacts. There are YouTube videos showing the method (example:https://www.youtube.com/watch?v=bv8fA8j_8oQ).,2015-08-31
US,20442999,R2VQCGAF6WAFSJ,B005LUKCX4,359492357,Cosmos Black 4ft Long iPod / iPhone 2-in-1 Audio and Sync Cable. Apple Dock Connector to 3.5mm Audio AUX (Auxiliary) Connector AND USB Charge/sync Connector + COSMOS cable tie,Wireless,1,0,0,N,Y,junk,Does not charge your iPod while plugged in the car. Rendered it worthless for me.,2015-08-31
US,52432830,R16T901YOLM2L7,B00KVHEL8E,592617681,Pebble Steel Smart Watch for iPhone and Android Devices,Wireless,3,0,0,N,Y,Nicewatch  but apps are not that robust,Nice watch  but apps are not that robust.  Good watch and great to see texts and calls on my wrist before pulling my phone out of my pocket  but most other apps I have tried and then removed from the watch.  A few gave errors and developers did not resolve.,2015-08-31
US,49932421,R24LE0IDTE024K,B00F542XG0,922724283,Samsung Galaxy Note II SCH-I605 EB595675LA / EB595675LZ Battery for Verizon OEM Original Part,Wireless,1,0,0,N,Y,Total piece of *****,Bought this product because my battery wasn't holding charge as long and was taking longer to charge. Was told this was a new  original battery. Did as instructed in letting the battery go totally out and recharge.  Within a couple of weeks it wasn't holding a charge very well and at one point it was taking all into the evening after work  while I was asleep and had to have it plugged in at work all day into the evening and was only charged at 59%.  Don't waste your time or money.  Did return it since it was covered under Amazon's return policy.,2015-08-31
US,39466736,R2HDHUAW1SSPW0,B007250KN8,588066137,Samsung Stratosphere SCH-i405 4G LTE Android Black - Verizon,Wireless,5,0,0,N,Y,Five Stars,great,2015-08-31
US,2632964,R208LOUU47S29K,B00FA69PXC,562331438,Samsung Galaxy S4 Mini Case  Slim Fit Snap On Cover by Trek Chevron Grey Green Turquoise White Case,Wireless,2,0,0,N,Y,I love the design of this case,I love the design of this case  but that's about it. For one thing  it won't even stay on my phone  it keeps randomly popping out of place and it won't actually protect your phone at all  lots of the edges are still exposed.,2015-08-31
US,621733,R39386LTJGTTY2,B00FR795WA,189606096,HooToo 9-Port 60 Watts USB 3.0 Hub with 2 Smart Charging Ports and 7 Data Transfer Ports for iPhone  iPhone 6s  iPhone 6s Plus  iPad  PC and More,Wireless,5,0,0,N,Y,Five Stars,Exactly as described  thank you,2015-08-31
US,3953058,R1PE07G49WNPL1,B0113GKW9S,808004277,Galaxy Note Edge Case  E-Time(TM) Samsung Galaxy Note Edge Fashionable Premium Leather Protective Flip Cover and Card Holder Case Wallet Pouch (Free E-Time Brand Stylus Pen Included) (BLACK),Wireless,5,0,0,N,Y,Five Stars,Very good cover. Protects my phone well,2015-08-31
US,46880786,R3J1GRLN9VU8IT,B013AOOP6M,501664666,ITSKINS Cell Phone Case for Samsung Galaxy S6 Edge,Wireless,4,0,0,N,N,good quality,I'm pleased with this phone case. I was using a Pelican case that I bought at ATT when I got my phone. This one feels high quality. It does not have a rubber or silicone band or outer casing  which gives it a sleeker design. It also feels lighter than my other case  but I don't think we sacrificed protection. I have dropped my phone with this case on  without issues.I only give 4 stars instead of 5 because the case makes the buttons a little hard to push. I received this product at a promotional price in exchange for a review  but the words are my own.,2015-08-31
US,48493962,R2IQEV492IA3TN,B00SLHMPGQ,268479498,OoRange New Lightning Vehicle Car Charger For iPhone 6 iPhone Plus  5S  5  etc - iOS8 Works - USB Socket Rapidly Charges 2 Devices,Wireless,5,0,0,N,Y,Five Stars,this is great everything,2015-08-31
US,43528284,R237R0Y17VZSQ8,B009V894JU,114911174,S-Box Phone Case for iPhone 5/5S,Wireless,5,0,0,N,Y,Five Stars,This was very pretty I love the BLING. It still lasts,2015-08-31
US,18381315,RS2V87SMLNOM5,B010AENL88,833897994,iClever 24W Quick Charge Wall Charger,Wireless,5,1,1,N,N,Over 10% faster charging for non-turbo compatible devices. FAST!!,I've reviewing quite a few usb charging systems over the year and as far as pure speed this one topped them all. Since I have no quick charge 2.0 compatible devices I tested it on my OnePlus One smartphone and noticed an overall 10% increase of charge speeds over my usual high speed charger  and over 100% faster than a normal usb charger.<br /><br />Quick stats:<br />Turbo Charger from Iclever: 2000 mah<br />My speedy hootoo usb faster charger: 1900 mah<br />Normal usb charger: 1000 mah<br /><br />This is a personally recommended item.,2015-08-31
