marketplace,customer_id,review_id,product_id,product_parent,product_title,product_category,star_rating,helpful_votes,total_votes,vine,verified_purchase,review_headline,review_body,review_date
US,35810645,R2E1OX3AYAYDGQ,B00QN1TCDQ,211203788,iPhone 6 Plus Screen Protector  Maxboost [Tempered Glass] 0.2mm Ballistic Glass Screen Protector Work with iPhone 6 Plus and Protective Case,Wireless,5,0,0,N,Y,Don't hesitate to buy this screen protector.,Follow the simple easy instructions and your screen protector will be installed correctly.  I used 2 of the 3 sticky tabs to hold it in place.  The screen protector is not noticeable and it doesn't interfere with the touch screen.  I had NO bubbles to contend with.  It took about 2 minutes to put it on.  Highly recommend!  I also signed up for the awesome lifetime warranty.  I hope I don't need to use ti!,2015-08-31
US,45990800,RN4YK9T1GZGWZ,B00XU0F1K6,797177848,Lifeproof Waterproof Case for Apple iPhone 6 - Retail Packaging - Orange (Discontinued by Manufacturer),Wireless,3,0,0,N,Y,Had one for my 4s and it fit fine. Not sure it is not a knock off,Very difficult to get on. Had one for my 4s and it fit fine. Not sure it is not a knock off. Came in a clear plastic bag!,2015-08-31
US,35984404,R3IDKWTBPUAONV,B00Q5SVZ32,442666968,Galaxy Note Edge Case  Verus [Thor][Charcoal Black] - [Military Grade Drop Protection][Natural Grip] For Samsung Note Edge,Wireless,5,0,0,N,Y,Five Stars,Great case.,2015-08-31
US,14534220,R19VDCC7DREF1H,B00XO07NAI,908028958,Evocel Lumia 640 [Dual Layer Series] Hybrid Armor Protector Case For Microsoft Lumia 640 - Retail Packaging  Fire Engine Red (EVO-NK640-SA03),Wireless,5,0,0,N,Y,Five Stars,great product,2015-08-31
US,29361954,R38L0XB1733097,B00V7OR3JO,880062128,Samsung Galaxy S5 Case  Black Swivel Slim Belt Clip Holster Armor Protective Case  Defender Cover (SHELL HOLSTER COMBO) (BLACK HOLSTER SHELL COMBO),Wireless,5,0,0,N,Y,Five Stars,As expected.,2015-08-31
US,44518372,R3CBAREL320GCY,B00RGFT2QU,13503497,Honsky Universal SMALL Multi-angle Adjustable Foldable Portable Plastic Mini Smart Phone Stand Mobile Cell Phone Holder Cellphone Smartphone Mount Table Desk Stands Holders Mounts,Wireless,5,0,0,N,Y,Five Stars,Works very well!,2015-08-31
US,128615,R16PC3K87D71HW,B00OUKLIDE,927611838,Play X Store® New LCD Monitor Screen Cover Protector Bm-11 for Nikon D7000 Dslr Bm-11 Bm11 Digital SLR,Wireless,1,0,0,N,Y,One Star,item is scratch,2015-08-31
US,125201,R34AGUFS1QNW4R,B00WSEA3X0,241648618,HLS ® G11 Beats Sports Wireless Bluetooth Earphones Earbuds Headset  Bluetooth 4.0 Stereo Headphones Earphone for Iphone 6 6 Plus  5 5s 5c 4 4s ipad 4 3 2 ipad Air Mini ipod  and Other Android Cell Phones (Black),Wireless,5,0,0,N,Y,great product,I bought these for the wireless feature. They are better than I expected  the sound is excellent and when talking on the phone everyone can hear me fine. I would buy these again,2015-08-31
US,36256815,R1HR5Q2FXLMVZP,B00K64WR9C,807148689,ZILU Smart Battery 13000mAh Portable Charger External Battery Pack Backup Power Bank for Cellphones and Tablets - Retail Packaging,Wireless,1,2,3,N,Y,Don't leave unattended during charging,I returned this item since it overheated during the initial charging.  I had to use a towel to unplug it. At that time it still wasn't fully charged (not all lights lit.  It was a good thing I didn't just plug it in and leave it unattended.  That said  I would not have left a review if I hadn't gotten several emails from the company begging me to provide a favorable review.,2015-08-31
US,16472032,R141RYSQFQYOEP,B00PSV281K,624889169,Stalion Sports Running Exercise Gym Armband Case Cover for Apple iPhone 6 Plus / 6s Plus,Wireless,3,0,0,N,Y,This case is solidly built and all  but it ...,This case is solidly built and all  but it is just bulky and the volume buttons are being pressed in it constantly. Also the strap wraps the arm in an awkward way  where there is a space between your arm and the strap in the corners ... I guess it's build for someone with thick arm. It's just OK IMHO.,2015-08-31
US,13659860,R3OTEQAHC8CHDH,B0068ZRX7Y,504275146,Anker 1550mAh Li-ion Battery for HTC ThunderBolt  MyTouch 4G  Merge(PD42100) [Not compatible with MyTouch 4G Slide] [18-Month Warranty],Wireless,5,0,0,N,Y,It works good for now,It works for the htc tmobile my touch 4g  it works great,2015-08-31
US,35675398,R34FGUAA7W9CPM,B008ALV0V4,523647993,Aduro U-Grip Plus Windshield Car Mount - for Universal Smartphones & Multimedia devices  Fits Up to 5.5’ Screen  360° Rotation  Apple iPhone / iPod  Samsung Galaxy Note  Blackberry,Wireless,5,0,0,N,Y,shark skin really works!!!,This is a Great cell phone holder. first the most impressive. it actually HOLDS on to a textured dash. if you move it often all it takes is a little water to clean it and make it stick again. it has so few moving parts no gears or flimsy plastic pieces that eventually break with repeated use. it is slightly awkward to put a phone in one handed but can be done with a little practice. one con  its so short that if you keep your phone vertical and not near the edge of your dash getting a power cord in. well worth it.,2015-08-31
US,798297,R14VBEBN0MVCO0,B00WJ9NIFE,681293738,Touch Digitizer Screen+Cover Housing for Samsung Galaxy Core Duos GT-i8262~Blue ~ Mobile Phone Part,Wireless,5,0,0,N,Y,Five Stars,It was what I expected and as described by the seller,2015-08-31
US,46909180,R2BPGMVFBP12RF,B00UV3SY1S,614002545,Galaxy S6 Case  GMYLE Book Case Vintage for Galaxy S6 SM-G920X - PU Leather Stand Case Cover,Wireless,5,0,0,N,Y,Five Stars,Like it a lot.,2015-08-31
US,42150444,R1CXA6ZBTTBVXJ,B00IGISUTG,588881114,Samsung Galaxy S5 Glass Screen Protector  Tech Armor Premium Ballistic Glass [1-pack],Wireless,5,0,0,N,Y,Five Stars,It worked great while I had it I recently upgraded to a different phone,2015-08-31
US,171289,R215LHQHA2TLAD,B00QN1T6NM,490628928,iPhone 6 Screen Protector  Maxboost [ 3 Pack ] iPhone 6 Tempered Glass Screen Protectors 0.2mm Ballistic Glass For Apple iPhone 6 4.7 inch ONLY and Work with most Protective Case,Wireless,5,0,0,N,Y,Five Stars,Great it works perfect,2015-08-31
US,27885946,RU52D15B99ERO,B002YWZXYU,148129419,Rockford Fosgate Punch 500-Watt Multi Channel Amplifier,Wireless,5,0,0,N,Y,Five Stars,Great,2015-08-31
US,39437241,RJ8SC2VH46HA3,B00C1DIGRI,252151619,Blackberry Q10 - Unlocked,Wireless,5,0,0,N,Y,Five Stars,great item at a great proce...,2015-08-31
US,15034424,R1B8X9GBESQ2QI,B00B78MT44,769773715,Car Mount  iOttie Easy View Universal Car Mount Holder for iPhone 7 6s 5s 5c  Samsung Galaxy S6 Edge Plus S6 S5 S4 - Retail Packaging - Black,Wireless,5,0,0,N,Y,Awesome!,Awesome product...,2015-08-31
US,16532291,ROPLY1YO2ARDL,B00OXL1G9Q,746353105,Portable Battery  JETech 3 200mAh Portable External Power Bank Battery Charger Pack for iPhone 6/5/4  iPad  iPod  Samsung Devices  Smart Phones  Tablet PCs (Orange),Wireless,4,0,0,N,Y,But I can use the cord that came with the phone and it works fine.,It does work well with my iPhone 5c  however  because of the phone protector I have  the cord that came with it will not fit into my phone.  But I can use the cord that came with the phone and it works fine.,2015-08-31
US,50282148,RT31LF3ICWMNE,B00PH53YO2,994899191,Multi Charger  Gembonics High Quality 3 in 1 Adapter USB Charging Cable Connector - Lightning And Micro USB for iPhone 6  Plus 5C / 5S  iPad  iPod touch  Samsung Galaxy  Portabe Power Bank and more,Wireless,5,0,0,N,Y,Highly recommend this product.  It is exceptional.,Excellent product.  I am rarely so pleased with electronic cords  but this one is exceptional.,2015-08-31
US,40752649,R2LJSXM9AEBOCN,B00ZGD0DC6,736058970,FM Radio Wireless Bluetooth Shower Speaker Liger® Waterproof Wireless Bluetooth Shower Speaker plus FM Radio & Hands-free Speakerphone,Wireless,1,1,2,N,Y,One Star,Could not get the channels I wanted. Hard to tune.,2015-08-31
US,45280959,R1NO6IGQUZBWXJ,B00RWVECTU,62528406,Galaxy Mega 2 Case  Evocel® Dual Layer Armor Protector Case For Samsung Galaxy Mega 2 SM-G750 (AT&T 2014 Release) - Brilliant Blue,Wireless,1,0,1,N,Y,Don't waste your money if you have a Galaxy Mega 2 it won't fit,This case Sucks! !!! The hole for the sound is on the wrong side   the sound button keeps turning the phone down  the power button turns the phone off and then after it restarts a few times the phone goes in safe mode cause the buttons are in the wrong spot. I had to cut mine with a razor to get it to work.,2015-08-31
US,10115643,R18BXO6L6KANRX,B00CEZBKTO,973714789,Anker 2nd Gen Astro3 12800mAh External Battery for Smart Phones - Black,Wireless,4,0,0,N,Y,Love the battery pack,Love the battery pack. Anker is absolutely one of the best. It does not come with a charger itself  so you have to use the charged supplied with your phone or tablet. It also didn't come with a cable/adapter to fit the charger I have. Aside from that...no comlaints  just wish it came with these needed accessories.,2015-08-31
US,19358103,R2E9Y2YLWU2782,B00UV7R17M,794809032,LG G3 Waterproof Case  Easylife® 6.6ft Underwater Waterproof Shockproof Dirtproof Snowproof Durable Full Sealed Protective Cover and Case for LG G3 (Black),Wireless,3,1,2,N,Y,The case covers the proximity sensor  so when ending ...,The case covers the proximity sensor  so when ending a call  even with the phone away from your face  the screen is blanked.  A bluetooth or wired headphone connection will eliminate that.  But I always don't have one of those with me to use.  I wish I could find a non-rooting way to disable the prox sensor.,2015-08-31
US,48393831,RY0GHL18K3EJ5,B00SB6SP0C,522938712,AUSDOM Lightweght wire Over-Ear HD stereo headset Soft leather ear cups with In-line Mic,Wireless,1,2,3,N,Y,One Star,These stopped working just 2 days after I received them. Very displeased.,2015-08-31
US,20668273,R2CQX58DQN6GPG,B00Q4R5QS4,584973930,CorpCase iPhone SE / 5 / 5S / 5SE Case - Pepproni Pizza/ Hybrid ULTRA Protective iphone 5/5S/5SE Case With Great Style - Features Unique 2-in-1 Hybrid protection with TPU+Plastic,Wireless,2,0,0,N,Y,Two Stars,The pizza decal is bubbling and the pink part broke off on day 1.,2015-08-31
US,52963580,R98YY0GA3618X,B00P936188,856423969,Anker 60W 6-Port USB Wall Charger  PowerPort 6 for iPhone X/ 8/ 7 / 6s / Plus  iPad Pro / Air 2 / mini/ iPod  Galaxy S7 / S6 / Edge / Plus  Note 5 / 4  LG  Nexus  HTC and More,Wireless,5,0,0,N,Y,Works great!,Solved my recharging issues.  Works great!,2015-08-31
US,26023397,R8A3GFECDXGWY,B00CL82HIW,616763143,Ocoou Power Bank,Wireless,5,0,0,N,N,Great small charger,Nice size and does charge  just not my Samsung S,2015-08-31
US,39781137,R3CBFIASG3YQW,B00SGMIGFK,695329120,Bike Phone Mount Bicycle Holder  GVDV Universal 360 Degrees Rotating Cradle Clamp for iPhone 7 6 6(+) 6S 6S plus 5S  Samsung Galaxy S5 S6 S7 Note 4/5  Nexus  HTC  LG  and most Phone Device,Wireless,5,0,0,N,Y,Good quality,Works well on my indoor cycle,2015-08-31
US,15794557,RFNVV3VISDTPA,B00ITILPZ4,186343224,Poweradd Pilot 2GS 10 000mAh External Battery Power Bank 3.4A with Smart Charge for iPhone  iPad  Samsung Galaxy Note  Gopro and More - Red (Apple Adapters Not Included),Wireless,5,0,0,N,N,Latest a cross county flight,Life saver was on a cross country flight 3+ hours and forgot to charge my iPhone before take off.  I was able to plug this in a 5% and it brought it to a full charge and kept it charged until we landed. Holds it internal charge for a good time as well my flight was on a Friday and I charged it the Friday before and was still fully charged.<br /><br />Highly recommend this goes on all my trips with me now. Will be picking up a second one to keep in my backpack for work.,2015-08-31
US,106538,RGVAFAEENF9F7,B00BF6HWF4,15889089,Rockford Fosgate R14X2 Prime 4-Inch Full Range Coaxial Speaker - Set of 2,Wireless,4,0,1,N,Y,Four Stars,They're gooby,2015-08-31
US,11209955,RAJSD9F2LR8R9,B00OM91NVK,6035699,iPhone 6 Case  Caseology [Envoy Series] Premium Leather Bumper Cover [Carbon Fiber White] [Leather Bound] for Apple iPhone 6 (2014) & iPhone 6S (2015) - Carbon Fiber White,Wireless,3,0,0,N,Y,Consider other options,well the case does a good job protecting the phone as its raised on the front side. However  the &#34;carbon fiber&#34; fabric on the back easily starts to tear off. Also  it slips in your hand a bit. I'm now looking for a rubber case because of that and the poor quality of the back.,2015-08-31
US,35092259,ROIE5V17E6Z6H,B00O9HKPNM,987503158,"Gearonic GEARONIC TM Luxury Rhinestones Wallet Plaid PU Leather Magnetic Flip Case Cover for Apple iPhone 6 Plus 5.5"" - Black - Carrying Case - Non-Retail Packaging - Black",Wireless,3,0,0,N,Y,Three Stars,Already starting to fall apart!!!!!!,2015-08-31
US,38324661,R32TWERYE2VUTX,B00FONBG1A,730605630,"Black Box G1W Original Dashboard Dash Cam - Full HD 1080P H.264 2.7"" LCD Car DVR Camera Video Recorder with G-Sensor Night Vision Motion Detection WDR 140° Wide Angle 4X Zoom - NT96650 + AR0330",Wireless,1,0,0,N,Y,One Star,Only held battery charge for 40 minutes,2015-08-31
US,3296693,R27EW97RV3K41L,B00F3IX27W,636593067,Apple iPhone 5c - Unlocked,Wireless,5,0,0,N,Y,Five Stars,Works great!,2015-08-31
US,15468039,R2YETIP5KF7K0U,B00GHHM3TG,923998614,VicTsing Dual USB Ports Car Charger Mount with Cigarette Lighter Charger DC Port  360 Degree Rotating Adjustable Mount for iPhone 6S 6 5S 5C 5 4S 4 Sony HTC  Other Smartphones,Wireless,5,0,0,N,Y,Its good,Good Item fits well and is a solid piece,2015-08-31
US,34962480,R11LU42K7JRGE4,B00JRGOKQ8,889017363,iOttie Easy One Touch 2 Car Mount Universal Phone Holder for iPhone X 8/8s 7 7 Plus 6s Plus 6s 6 SE Samsung Galaxy S8 Plus S8 Edge S7 S6 Note 8 5,Wireless,5,1,1,N,Y,Fantastic value  great for using your phone as a ...,Fantastic value  great for using your phone as a GPS or watching movies on your lunch break.  The suction cup has had to be restuck once in the four months that I have owned it  and that was during the hot hot heat of the summer.,2015-08-31
US,14907525,R2OYVHT2MHR22P,B00M06YFQW,336142201,iPhone 6s Plus Case,Wireless,5,0,0,N,N,Best IPhone 6 Pluse case I have ever had  period! I Highly recommend this,This is the best case that I have ever had for my IPhone period.<br /><br />The features I like:<br />* The kick stand is a really cool feature  great for watching you tube videos.<br />* The outer edge is made from a rubber like material  making it non slip.<br />* the clip on cover has a velour material that covers the screen further protecting it from scratches.<br />* Lightweight<br />* low profile  easily fits in my front pocket even with the snap on cover.<br /><br />If you want to protect your phone then you need this case. Just get a third party screen protector and you will be all set.<br /><br />The only thing that I don't like is the kickstand is a little hard to deploy when you first get it. As you use it more it gets a little easier to extend.,2015-08-31
US,126328,R18FN61SXOE4AP,B00GDFAL5U,428518782,Donatech 3ft Micro Charge Data Cable + Wall Charger Set Competible with Galaxy Note 4   Note Edge  S3  S4  S6  S6 Edge Note 2 (Black),Wireless,5,0,0,N,Y,Five Stars,it charges fast,2015-08-31
US,15029326,R2W02IOH3LHQ02,B00XKZJ5T4,673106572,(4 Pack) [Apple MFi Certified] iPhone 6 Cord Lightning Cable Charging Connect...,Wireless,5,0,0,N,Y,Five Stars,works well with my phone,2015-08-31
US,41392372,R5EIP0Y7L4BE,B00OHRYFGC,770066065,Bluetooth Headset Headphones BHS-930 by phaiser™ [Best HD Stereo Music] *PREMIUM BASS* with LifeState™ Technology + BONUS **FREE Ion PRO-K Energy Bracelet** - Sweatproof Neckband,Wireless,1,0,0,N,Y,One Star,Not what I exspected,2015-08-31
US,51645972,R3C63QJGW45APV,B00VHSYBRC,193002798,"Screen Protector Glass for iPad Air / Air 2 / Pro  InaRock 0.26mm Tempered Glass Screen Protector for iPad Air / iPad Air 2 / New Apple iPad Air / iPad Pro 9.7""",Wireless,5,0,0,N,Y,Five Stars,good,2015-08-31
US,17348415,R2RT8JSEA6Q2SN,B00XT0PV70,87691247,J2cc 3 in 1 Swiss Knife Shape Multifunctional USB Portable Cable Set Micro Usb 30 Pin 8 Pin with LED Light - Black,Wireless,4,0,0,N,Y,Four Stars,So so. Almost a 3 star but it's small and has most of the connections I need.,2015-08-31
US,26928696,R3TENASXL1UV3,B00K8CS8VS,618914681,White - No Contract Sprint Prepaid,Wireless,5,0,0,N,Y,Best phone I've ever owned,Best phone I've ever owned. Not the fastest processor ever  not the best looking screen ever  not the best camera ever  but darn does it get good battery life. I can regularly go 48hrs on a single charge. If I start a day at 100%  even using lots of data and navigating with the GPS  I still have 40%+ by the end of the day. It's great. I'll gladly give up some of the fancy features to not ever be tied down to a phone charger again.,2015-08-31
US,14613612,R3APIIDOXYG691,B00YKN3LTK,439111127,I-CARER Genuine Real Leather Vintage Series Back Case Cover Stand for Apple iPhone 5/5S,Wireless,5,0,0,N,Y,Five Stars,Looks really nice and it also protects my apple.,2015-08-31
US,19809095,RGCERAFK3QWGZ,B00PE5V4BU,601329651,Wireless Bluetooth Headset * Backed By Our 100% Money Back Guarantee * Best Sound Quality With Premium High Bass Speakers * Comfortable Hands Free Headphones with Microphone,Wireless,5,0,0,N,Y,Five Stars,Terrific!,2015-08-31
US,21782151,R31624HNQR58EA,B00HUGVN3U,196578385,Terrapin Hybrid Rubberized Back Cover Hard Case for Sony Xperia Z1 Compact (Solid Black),Wireless,3,0,0,N,Y,Three Stars,This case broke within a week.,2015-08-31
US,32922567,R1V27IZ5XYPZ4U,B00P7NT452,664127090,Hilda Bird I6 blue FBA Series,Wireless,1,1,4,N,Y,Broke in 20 days :-/,Order the product on August 11th. The wrist-let strap just broke. Not satisfied with the quality the design and functionality are great though. Definitely prefer function over fashion.,2015-08-31
US,156637,R2I71NFMRN0ATM,B00MVRK9EC,935919267,Galaxy S4 Case  S4 Case ULAK Shockproof Rugged Rubber Hybrid Hard Case Cover with Belt Clip Holster Kickstand for Galaxy S4 S IV i9500,Wireless,1,0,0,N,Y,Ordered this product in purple came on time but the ...,Ordered this product in purple came on time but the color purple was not as the picture it was more raspberry  returned  it!!!,2015-08-31
US,50614635,R1G8A3CB2ULPLQ,B00XKCYE3E,251408641,Samsung Galaxy S6 & Galaxy Edge 6 Micro USB Original Samsung Data Sync Charging Cable 4FT (2 pack),Wireless,5,0,0,N,Y,Five Stars,Good cables,2015-08-31
US,17540572,RMDLDVCZNM94P,B00KP7KKN0,303574473,USB Wall Charger  Magic-T Bundle of 4 Universal USB AC/DC 1.0A AMP Travel/ Home Wall Charger Power Adapter for iPhone 6 6 Plus  5S 4S Samsung Galaxy S7  External Batteries and More,Wireless,2,0,0,N,Y,Two Stars,One of the pieces was not working at all. I won't buy them again.,2015-08-31
US,12792030,RX549KC3F8FHO,B00VGG1PEC,61609592,Iphone 6 Case Cover - Slim Fit Tpu Protector Shock Absorbent Case (liverpool Football Club ),Wireless,2,0,0,N,Y,Not very good,Item was not as picture shown the dimensions are off,2015-08-31
US,10702080,R31JQTJE8ZFUHS,B00LB8A5SC,351616081,Itunes 25$,Wireless,4,0,1,N,Y,Four Stars,Yes it did,2015-08-31
US,34069835,R1N73AYI1DBQ6R,B00I608BJ8,136209680,SCOSCHE MAGDMB MagicMount Universal Mount for Mobile Devices,Wireless,5,0,0,N,Y,Love the convenience of the magnet mount.,Excellent product. Holds my HTC phone well in both convertible and SUV. No problems with heat or vibration  phone and mount stays in place.,2015-08-31
US,33558526,R2GQ32OFGMVW9S,B00XWUU7NK,750750404,Samsung Galaxy S6 Edge Hard Back Case  EpicGadget(TM) Galaxy S6 Edge Case Glitter Bling Crystal Rhinestone Case Cover For Galaxy S6 Edge + HD Clear Galaxy S6 Edge Screen Protector (US Seller!!),Wireless,5,0,1,N,Y,These covers are so pretty and affordable you can get several,CAN YOU SAY &#34;BLING&#34;?  These covers are so pretty and affordable you can get several!!,2015-08-31
US,1949406,R1YD09MIB8OGSZ,B00PG3TSWW,920536791,DOUBLE Magnetic Dash Mount Kit for Cell Phones. 2 Dash Balls and 2 Strong Neodymium Magnets (2 Magnets + 2 Balls),Wireless,5,0,0,N,Y,Five Stars,excellent product!,2015-08-31
US,52839924,REY8G902IJDCY,B00BOZBY7I,597176438,"Arduino 2.8"" TFT Touch Shield V2.0",Wireless,5,0,0,N,Y,works great,Worked great for me.  Used the suggested library and displayed bmp files from the sd card.  Have not yet tried displaying text.,2015-08-31
US,13920104,R3S468ZIVLSR5B,B00ZWZ1G7E,834380475,iDeaUSA Bluetooth Headphones Apt-x  Wireless Headphones  Sport Headphones  Earbuds with Mic  Noise Cancelling Headphones  Sweatproof  Up to 6 Hours Play time with Carrying Case,Wireless,1,2,17,N,N,Looks like all the reviews EXCEPT the low rated ones are ...,Looks like all the reviews EXCEPT the low rated ones are from users the received them for free  hell give me a pair for free and I will review them to. I sure ain't gona buy them...,2015-08-31
US,17698862,R2H5SO5M31CD4H,B007UKVO3U,773879572,Motorola MT350R FRS Weatherproof Two-Way,Wireless,5,0,0,N,Y,Great for Camping / Outdoors,Use this during a week in the sierra's at a Summer Camp for a couple of adults who had to try and keep 11 boys organized. Worked great. The rechargeable battery last almost 4 days before having to charge or change to batteries. Like the option to use rechargeable or regular batteries.,2015-08-31
US,26719015,R2INO06KP48Q8J,B009UNH0CY,835915908,Plantronics Voyager Legend Eartip Kit - Non-Retail Packaging - Medium - Black,Wireless,5,0,0,N,Y,Five Stars,Perfect replacement thank you,2015-08-31
US,818596,R3BYR0SWGPT8IC,B00N7E7Y4Q,864719723,Naruto Angel Wings w/ Kakashi Sharingan Pendant Necklace,Wireless,5,0,0,N,Y,Five Stars,beautiful,2015-08-31
US,51101127,R1WBVONY51JPG6,B00WAGY5S0,811965828,CsyncDirect 3-Feet 8-Pin Lightning to USB Cable for iphone 6 / 6 Plus / 5s / 5c / 5   ipod 7  ipad Mini / Mini 2/ Mini 3  ipad 4 / ipad Air / ipad Air 2 (Pack of 3),Wireless,1,0,1,N,Y,One Star,The cables are poorly constructed and fell apart on first use,2015-08-31
US,11869696,R8RO7NSD27QY5,B00I4OFUCM,116558898,Alphabet English letter dust plug ear cap for cell phone accessories iPhone Samsung and all 3.5mm audio port,Wireless,5,0,0,N,Y,Five Stars,Very Pretty! :),2015-08-31
US,4276719,RMOI6LQG3B0QL,B00USJPDGY,979249870,Cellet Clear Case with New Mexico Flag for Galaxy S5 [Non - Retail Packaged],Wireless,1,0,0,N,Y,Was very upset  I ordered the New Mexico cover ...,Was very upset  I ordered the New Mexico cover and in stead I got the Minnesota cover. Have no other complaints  on any other orders.,2015-08-31
US,51702129,R1XH14KN0G2N5T,B00U5M3BDQ,955358041,iPhone 6s Screen Protector  JETech 2-Pack Premium Tempered Glass Screen Protector Film for Apple iPhone 6 and iPhone 6s 4.7,Wireless,5,0,0,N,Y,Five Stars,Easiest screen protector I have ever installed. No bubbles from the start.<br /><br />Update:<br />After less than one week  protector is chipping and has cracks from bottom corner in to the button. Never seen this before.,2015-08-31
US,36768569,R61Y8N4V1NXUV,B00LIWB34Q,991550245,T-Mobile Nokia Lumia 635 - No Contract Phone - White,Wireless,4,0,1,N,Y,The phone itself is great. The windows operating system is good but doesn't ...,The phone itself is great. The windows operating system is good but doesn't have all the apps you might find on android or apple. Most of the popular apps are there  but my schools app isn't available on it.,2015-08-31
US,29005785,R33U9DES26JRUO,B00WHRG24M,311381552,Galaxy S6 Case  iRonsnow(TM) Ultra Thin Clear Art Pattern Crystal Gel TPU Rubber Flexible Slim Skin Soft Case for Samsung Galaxy S6-Retail Package(Design 16),Wireless,2,0,0,N,Y,I love the look and how easy it was to put ...,I love the look and how easy it was to put on and take off of my phone. I have had this style of case previously. However this one seems SO flimsy that I don't feel like it is protective at all against drops. So I'm using a different one.,2015-08-31
US,12546647,R24CW4VZ727M84,B00IG05402,234204146,ICCKER Art Nylon Hair Paint Brush Tools Set. (Blue 10 type of the tip) …,Wireless,5,0,0,N,Y,Five Stars,Works really well. I have my Samsung S6 in a otterbox defender case and it charges with no problem.,2015-08-31
US,42970788,R2IGYCWHNEN8NX,B00H3T481I,347601962,Lifeproof iPhone 5s - Nuud Series - Black/Smoke,Wireless,1,0,0,N,Y,One Star,The product arrived broken,2015-08-31
US,31726343,R1DY76JHU7GX77,B011DM2JVG,584394177,LUNATIK EPIK Polycarbonate Case and Silicone Strap for Apple Watch  White/White,Wireless,5,0,1,N,Y,Five Stars,Good Quality product.,2015-08-31
US,42961863,R8AUB8JLR32YA,B00NQDGZZC,915411250,Modern Portable® jHub Ultra - Huge limited time Sale - Ultra Portable USB Power Bank charger. Amazing Value  Supreme Quality  Luxurious Style  Unbeatable Price (Black),Wireless,1,0,0,N,Y,not for iphones it charges it but I need to ...,not for iphones  it charges it but I need to still attach my I Phone charger  cord,2015-08-31
US,39753204,R2BJ9EUAMBLUKW,B00V7OR3JO,880062128,Samsung Galaxy S5 Case  Black Swivel Slim Belt Clip Holster Armor Protective Case  Defender Cover (SHELL HOLSTER COMBO) (BLACK HOLSTER SHELL COMBO),Wireless,5,0,0,N,Y,Five Stars,exactly what we needed  received in a timely fashion.,2015-08-31
US,11896525,R2F48TK1TNRH7R,B003M5QW5C,388950322,Fashionable Perfect Fit Polymer Protector Skin Cover Cell Phone Case with Screen Protector for Sanyo SCP-2700 Sprint - ORANGE,Wireless,5,0,0,N,Y,Easy to apply,works well and does the job. Screen protector works well  too. Easy to apply. I have basic experience in applying screen protectors.,2015-08-31
US,128419,R2S986QEY4BMXT,B00S84LIM4,453489319,"Phone Cases Hello Kitty Perfume with Diamond Bottle Style 3 Colors Handbag TPU Cover for Iphone 6 Plus Case（5.5"" Pink)",Wireless,5,0,0,N,Y,Five Stars,This is the best cases ever,2015-08-31
US,32813839,ROKJ11NAHU54I,B0082MHY3E,748283494,5inch Screen Waterproof GPS SatNav Motorcycle M8 Extended Handlebar Mount (sku 14298),Wireless,4,0,0,N,Y,Four Stars,It is what I was looking for with the flexibility and waterproof.,2015-08-31
