marketplace,customer_id,review_id,product_id,product_parent,product_title,product_category,star_rating,helpful_votes,total_votes,vine,verified_purchase,review_headline,review_body,review_date
US,32922567,R5SUFJSLRTC1Y,B00V0EC1OS,34989698,iPhone 6S Case iPhone 6 Case FEIKESI iphone 6/6S Flower Rubber TPU Gel Silicone Soft Case Cover Skin Protective For Apple iPhone 6/6S (4.7-inch),Wireless,4,0,0,N,Y,Four Stars,Super cute. Serves its purpose. very feminine and dainty.,2015-08-31
US,2930167,R3Q1R6NC8XYZ5E,B00JUBKN7K,579578581,Moto G Case (1st Gen & 1st Gen with 4G LTE)  Rock Me Wireless (TM) 3 items Bundle - Screen Protector  24K Gold Plating Electromagnetic Waves Blocking Sticker and Heavy Duty Armor Protective Kick Stand Case for Motorola Moto G 1st Generation.,Wireless,5,1,1,N,Y,I absolutely love it. I've had it about 6 myhs now ...,I bought this case for my phone. I absolutely love it. I've had it about 6 myhs now and all the lil bling diamonds are all still in tact!!  💜,2015-08-31
US,7679400,R199DFPAW3W09P,B00KSHDD1I,250338415,Limitless Stereo Headset for Samsung S5/Note 3 with Extra Set of Ear-Gels,Wireless,1,0,0,N,Y,and poor,They didnt work  and poor packaging,2015-08-31
US,28088591,RLDCVB08CU1OS,B00NH131LY,912157090,AmazonBasics Apple Certified Lightning to USB Cable - 6 Feet (1.8 Meters) - Black,Wireless,5,0,0,N,Y,Five Stars,Great length and works!,2015-08-31
US,47053187,R2S3MDVJ3NVMLP,B00TJ3DWIG,814864210,Ringke FUSION for Samsung Galaxy S6 Edge,Wireless,5,0,0,N,Y,and the case has a small dirty dent; but the phone is still in perfect ...,This fits over the Galaxy S6 Edge perfectly  without the added frustration of trying to stuff in an inner rubber bumper. Dropped it several feet while bike riding  and the case has a small dirty dent; but the phone is still in perfect condition. I haven't had the time to make my own backings  but the benefit of being able to change it whenever I want is awesome. While not a game changer; I just wish the website had a digital template to work off of instead of a flimsy paper stencil.,2015-08-31
US,22404700,R2G0LPOFSJP4OY,B00SZEFGAW,654620704,BLU Studio X  Unlocked Cell Phone,Wireless,4,0,0,N,Y,Fantastic phone for a low price!,A great phone considering the price! Battery life is somewhat limited  but overall performance is excellent. The upgrade to Lollipop sent flawlessly and the phone has no other real issues.,2015-08-31
US,16921517,R1IDPFCO4U6G7Z,B00T7DP966,721161022,Hallomall Nfc-enabled Bluetooth 4.0 Headphones with MIC Compatible with Iphone 6  6plus  5s  5c  4s  4  Ipad 2 3 4  Android  Samsung Galaxy  Smart Phones and Other Bluetooth Devices,Wireless,1,0,0,N,Y,I really like these headsets,I really like these headsets  the fit well  and sound really good  the problem is that both pairs I ordered had the same problem  after a bout two weeks of use  they stopped taking a charge resulting in about five minutes of use when powering them on. Too bad.,2015-08-31
US,52737028,R1161NLS6JTXU1,B00KGSW734,795574309,iCarez [Tempered Glass] Screen Protector for LG G3 Easy Install with Lifetime Replacement Warranty [1-Pack 0.3mm 2.5D 9H] - Retail Packaging,Wireless,5,1,1,N,Y,Pretty easy!,First day and so far I'm loving this.  I watched the video  read the directions and had no problem installing it.  The screen looks clear and perfect.,2015-08-31
US,208762,RXZS6HXEKXJ42,B00WRMU4WS,508264256,E LV Ultra Slim Case Premium Semi-transparent Super Lightweight / Exact Fit / Absolutely NO Bulkiness Soft Case for Apple Watch 38mm with 1 Microfiber Cleaning Cloth,Wireless,5,1,1,N,Y,Its stylish but thin,The rubber case is thin but you always get what you pay for. If you want your watch just to look cute with minimal protection against scratches then get this one but if you're going to drop your watch then i'd say get a little more hardcore case. I love it though  happy with my purchase! might get a different color!,2015-08-31
US,40266813,RJQWVO0QV2WQ4,B00USN9L0E,105913119,Synthetic Leather Galaxy S6 Sleeve - Thin,Wireless,5,0,0,N,N,Exactly as described,Quality looks good and prompt postage. You can't argue based on the good price.<br />Would be happy to recommend to others.,2015-08-31
US,51748675,R34J2HYILFN676,B011EW5NKE,439892931,High Capacity Portable Backup Battery Charger - Smartphone Battery Pack - Works perfect with iPhone 6 6Plus 5S 5C 5 4S iPad 3 4 Mini Air Samsung Galaxy S5 S5 Edge S4 S3 Note 4 Note 3 & More,Wireless,5,0,0,N,N,Small  compact  quick charging,I am notorious for losing my charger and having a dead or dying phone.  It can be especially frustrating when I need to make an important phone call or have to leave the house and I have an uncharged phone in the case of an emergency.  Having this backup battery charger can be so convenient!  It is so easy to use.  I plugged it up via usb to my laptop right out of the package to make sure that it was fully charged and then I just tossed it right into my purse.  I always know where it is and when I need to charge my phone with it I can just plug it up the the included cord and drop it right back into my purse.  It does a great job of quickly charging up my phone.  I like the red color!  The charger features a stip of 4 blue lights that light up both when the unit is being charged and when the unit is charging my device.  There is a really neat feature about this power bank that is unlike others I have used  it has a little  but bright  flashlight on it!  Just click the power button twice and it turns on.  I thought that was pretty neat and unique.  Overall  I am happy with the product and its performance.  I received this product complimentary in exchange for my honest and unbiased review.,2015-08-31
US,47644488,R3MBNS7CQYAI94,B00VJ0I3KE,435731882,iXCC Dual USB 4.8Amp 24W Universal High Capacity Car Charger for iphone 6s/6s plus  Samsung Galaxy S6/S6 Edge/Note5  Other Smartphone and Tablet(Black),Wireless,5,1,1,N,Y,Note 4 perfect,It charges almost as fast as the Samsung fast chargers. Very good product!,2015-08-31
US,52224646,RHULTY1F8J4DZ,B008FRUR9E,11833875,Nolan Tx 3.5 mm (White) Generic Bluetooth Wireless Stereo Music Audio Transmitter Adapter for iPod  Zune  Zen  Sony Walkman  Sansa  Mp3 Players  Portable Music Audio Player  Notebook  Tablet  PSP  Nintendo 3DS  Car Stereo  TV  Blue Ray DVD without Cord Dangle Hassle,Wireless,4,0,0,N,Y,Almost perfect.,Works great with my iPad Mini. Would give it a 5 star except the dang thing doesn't stay put on the top on the mini. Not a major problem  a piece of Double stick foam tape and a rubber band solved the problem. I like it and I use it and would buy again for this price.<br />For the design engineers reading this ... if you had put a small &#34;dummy&#34; tab that fit into the contact slot on the top next to where this plugs in ... it would be perfect and not move about.,2015-08-31
US,13521869,R20QIVBCBOV67,B00KHGMMLC,109300889,DiGiYes® Qi Cylindric Wireless Charger Charging Pad Charging Station for Nexus4 Nexus5 HTC 8X Nokia Lumia 920 820 Note2 Note3 S3 S4 S5,Wireless,3,0,0,N,Y,Three Stars,It's a good charger  anything larger than a Nexus 5 slides off of it.,2015-08-31
US,11869696,R2NS56U13YBVFB,B00IFUBC5E,940771992,Crystal Elephant Anti Dust Plug Stopper / Ear Cap / Cell Phone Charms for Smartphone  iPad with 3.5mm Earphone Jack Phones - Silver,Wireless,5,0,0,N,Y,Five Stars,Soooooo Cute,2015-08-31
US,49595837,R44ESZM5OAP2L,B00YEY0ZYO,478689821,Samsung Galaxy S6 Case Utang TPU+PU Leather Case Skin Gel Protective Cover Case for Samsung Galaxy S6,Wireless,5,0,0,N,Y,Great product.,So far i love this case.  Not bulky  protects phone from my clumsiness  and the case fits the phone perfectly.  It's not flashy.  Just right for me.  Delivery of the product was prompt.  No issues.  Quality good.,2015-08-31
US,11601890,RMPXM07H3SWVY,B006ZRZ9NA,642796346,Hot Pink Soft TPU Gel Grip Skin Case Cover for AT&T Samsung Galaxy S2 Skyrocket,Wireless,5,0,0,N,Y,Five Stars,Love this case. It has been one of the best cases I've had!!!,2015-08-31
US,225010,R2Y97CC31YT18Q,B00NLU01OG,789814867,EVERMARKET(TM) Premium Privacy Anti-spy Screen Protector Flim for Apple iPhone 6 (4.7 inch) - 1 Pack,Wireless,1,0,0,N,Y,One Star,very bad quality,2015-08-31
US,29799081,R3N9ZG6FITT1GA,B00IYWQQ4U,742794888,Spigen Ultra Hybrid Galaxy S5 Case with Air Cushion Technology and Hybrid Drop Protection for Samsung Galaxy S5 2014 - Mint,Wireless,4,0,0,N,Y,The only thing I don't care for is how dirty the part around the edge (mint green part) looks,This case has done it's job  as I have dropped my phone multiple times and no harm has been done. The only thing I don't care for is how dirty the part around the edge (mint green part) looks. I've tried cleaning it with cleaning products and it appears to be permanently stained.,2015-08-31
US,399812,RPWKKGEOCZIB0,B001D0LMG2,339869318,PYLE All Weather 5-Inch Trumpet Speaker,Wireless,5,1,1,N,Y,love how loud it is even with out amp,love how loud it is even with out amp... hooked to cb and scared the hell out of everyone i yelled at .... small so its easy to put anywhere on truck..... id buy more if needed,2015-08-31
US,2217729,R3TH7II0KO4NL,B00W4J6C02,32941112,10ft Lightning Cable (1st Gen),Wireless,5,0,0,N,Y,Five Stars,Its great...,2015-08-31
US,42897885,R3NQCG3RI6MFZT,B00VUBG89A,312394313,Amoner(TM) Durable-Series 3 Pack Classic White Extra long 8 pin Reversible USB Charge and Sync Data Cable 6 Feet(2 Meters)- Fits iPhone 6 6 plus  iPhone 5s 5c 5  iPad Air mini mini 2  iPad 4th generation  iPod 5th generation  and iPod nano 7th generation. Premium quality cords for home  office or travel -100% Satisfaction. No Annoying Error Messages. (Compatible with iOS8). Risk free warranty - on,Wireless,3,0,0,N,Y,... was highly advertised that it doesn't give you any annoying error messages and guess what it does,It was highly advertised that it doesn't give you any annoying error messages and guess what it does.  The length of the cords are great.,2015-08-31
US,19148806,R2Z0NJBYVH0ZY2,B000281X6U,456483529,Metra Dash Kit For Chry/Dodge/Jeep 98-Up,Wireless,4,0,0,N,Y,Four Stars,thank you,2015-08-31
US,52224646,R13FLTYGBMPS86,B00LQA2B8M,643731866,Andoer Mini 3.5mm Bluetooth Audio Transmitter,Wireless,1,0,0,N,Y,Whoops,I could not get it to work  Returned for full credit and purchased another pproduct.,2015-08-31
US,17902309,R8HX24LDYIZ5P,B008GVL9YQ,873830995,iXCC ® 10ft (TEN FEET !) 2pcs [30 Pin Connector]White EXTRA LONG Extended Length USB SYNC Cable Charger Cord for iPhone3G  3Gs  4  4s  iPod 1 through 6  iPod Touch 1 through 4  iPad 1 through 3,Wireless,1,0,0,N,Y,Buyer beware,Poor quality only lasted three weeks,2015-08-31
US,47743240,R205CFQDI6QYPJ,B00HB1O1DS,585766532,LG Google Nexus 5 G2 D820 LCD Touch Screen Digitizer Assembly and Frame,Wireless,1,0,1,N,Y,Poor quality  would like a refund or a new ...,Poor quality  would like a refund or a new one sent to me  till the nexus 5 2015 is available,2015-08-31
US,515002,R3A6GDXAK6UNRF,B005RZUH9W,611656030,Blue Tiger Pro Bluetooth Headset W/Mic,Wireless,2,0,0,N,Y,Two Stars,Doesn't hold a charge sometimes hard to hear,2015-08-31
US,45521675,R3NBG7X97H35NT,B00GDFAL5U,428518782,Donatech 3ft Micro Charge Data Cable + Wall Charger Set Competible with Galaxy Note 4   Note Edge  S3  S4  S6  S6 Edge Note 2 (Black),Wireless,5,0,0,N,Y,Can't go wrong with an OEM charger. In this ...,Can't go wrong with an OEM charger.  In this case  I purchased it as a spare charger for my new Samsung S5,2015-08-31
US,9966931,R270VROLIKU1TY,B00NQG2XNC,569858302,Genuine Samsung Note 4 Battery Kit,Wireless,5,0,0,N,Y,Great value and OEM product.,Battery and charger are great. There is no issues with it. I like how fast the charger is. It is well worth the money and the battery is oem. Overall   great value.,2015-08-31
US,4410792,R12LIINNEOWDAP,B00KOJZSQ8,456601445,Napama Iphone 4 4s Case Waterproof Dirtproof SnowProof Protection Cover,Wireless,1,0,0,N,Y,One Star,Don't work got my phone wet when it feel in the water.,2015-08-31
US,106681,R2VUA274I50K37,B00Q3CNYSO,729701113,"Unifix-Back Rear Main Camera Replacement Part for iPhone 6 4.7"" (All Carriers) + Tool Kit",Wireless,5,1,1,N,Y,He was able to fix it and works better than his original camera,Bought this part for my friend who has an issue with his camera. He was able to fix it and works better than his original camera.,2015-08-31
US,10630509,R3GDMGKLVT64ST,B00HUB9POE,755595707,Samsung Galaxy Note 3 S-View Wallet Cover Folio Case,Wireless,5,0,0,N,Y,Cool cover. I really like how it fits the ...,Cool cover. I really like how it fits the phone. You take the original back case off of the phone and then this one snaps on.  Only problem is that I am worrked it may break along the seam. Other than that  it is good.,2015-08-31
US,49793962,R345S9LTDJL0XB,B00A44JSFK,763757627,[NFC/Google Wallet Capable] Anker 2200mAh Li-ion Battery for Samsung Galaxy S3  I9300 (EB-L1G6LLU)  Galaxy S3 Neo  I535 (Verizon)  T999 (T-Mobile)  I747 (AT&T)  L710 (Sprint) [18-Month Warranty],Wireless,5,0,0,N,Y,Five Stars,Works great.,2015-08-31
US,26946546,RZ1SLOVQ4Q4N4,B011EVQBG0,914696683,Thync Calm and Energy Wearable  Limited Edition,Wireless,3,0,6,N,Y,I am unable to use it sine I do not ...,I am unable to use it sine I do not have a iPhone. So  I will be returning it shortly.,2015-08-31
US,27825950,RKHXR2IN67OQW,B00SKII7S6,304294242,iPhone 4 iPhone 4 case iPhone 4S case iPhone 4S case cover Flipcase Crystal Diamond Bling Hybrid Cover Case for iPhone 4/4S #21,Wireless,5,0,0,N,Y,Five Stars,great product!,2015-08-31
US,107509,R21ZG511BYWPQZ,B0107I8QVY,822011539,iPhone 6S Plus Case - iHarbort Protective iPhone 6 6S Plus Case Bumper Cover With Shock-Absorption Bumper and Anti-Scratch Clear Back With Screen Protector,Wireless,5,1,1,N,Y,Best case ever!,Came extremely quick! I love this case!! Buy this!!,2015-08-31
US,1150971,R354TU5G1BQ8AS,B00Q2ZW6A4,545754648,Orzly® - OnePlus One FUSION BUMPER CASES - PARENT,Wireless,5,0,0,N,Y,Five Stars,Product arrived on time and I'm very happy with the quality of the case fits securely on my One+1,2015-08-31
US,1495545,R147NC34T5OPEY,B00LLIVRRU,451388276,LG Tone Pro HBS-750 Wireless Bluetooth Stereo Headset - Red,Wireless,5,0,0,N,Y,Came on time.,Awsome,2015-08-31
US,24029407,R1638TA4LLG2QZ,B00P1ZPPMM,412774928,"LG G3 Case  ULAK [3 in 1 Shield] Shock Absorbing Case with Hybrid 3in1 Cover Soft silicone + Hard PC Material Design Case for LG G3 (5.5"" inch) 2014 Release (Blue/Green Wave)",Wireless,2,0,0,N,Y,Average,It's a nice design  nice colors  but it does add a significant amount of bulk. And it doesn't feel like the front and back pieces lock securely. It feels like if I were to drop my phone the case would fall apart.<br />I wouldn't buy this product again.,2015-08-31
US,36268469,R2O1G6UIKQ2JEU,B00OOM2DTQ,96460363,iPhone 6 & 7 Charger Cable - Certified Lightning to USB Charging Cord Connector Durable & Fast - Zeus Guarantee,Wireless,5,0,0,N,Y,Five Stars,Great product! Arrived early and exactly as advertised!,2015-08-31
US,2268481,R10G8CN6HJYJMT,B00LYZWQHA,698448377,Touch 4 Case  New Design 3d Bling Pu Leather Wallet with Credit Card Slot Flip Diamond Case Cover for Ipod Touch 4 4g + Gift Free Stylus (Random Color) + One Free Unique Butterfly Anti Dust Earphone Jack Plug (Transparent Diamond),Wireless,5,1,1,N,N,Love it!,Bought this for my daughter. Love it!,2015-08-31
US,789248,R30KW1UIYF6P8V,B00BT02O40,133309514,GreatShield iSlide Slim-Fit PolyCarbonate Hard Case for Samsung Galaxy S4 S IV,Wireless,4,1,1,N,Y,And the best part is its made out of a good material,True to color. And the best part is its made out of a good material. It's very durable. I always drop my phone  so this case helps me many times so I didn't have to get a new phone.,2015-08-31
US,2781350,RFTSONFI2XLPS,B013H3FZN8,867966051,Galaxy Note 5 Screen Protector  Premium HD Samsung Galaxy Note 5 Tempered Glass Screen Protector - Anti-scratch/ Shatterproof/ Anti-fingerprint for Galaxy Note 5,Wireless,1,4,4,N,Y,One Star,Does not fit the screen fully really disappointed,2015-08-31
US,13598642,RU5TZUYLI8IIY,B00P936188,856423969,Anker 60W 6-Port USB Wall Charger  PowerPort 6 for iPhone X/ 8/ 7 / 6s / Plus  iPad Pro / Air 2 / mini/ iPod  Galaxy S7 / S6 / Edge / Plus  Note 5 / 4  LG  Nexus  HTC and More,Wireless,5,0,0,N,Y,they're awesome. I travel with one,Have bought several of these now  they're awesome. I travel with one  use another in the car when several of us are traveling (car has a AC plugin)  have one at my desk  nightstand  and now in my living room.,2015-08-31
US,31616271,R101942B6V5J71,B0084X1W2K,154058769,New 1650mAh Battery for Samsung SGH-i897 SGH-i917 D700,Wireless,3,0,0,N,Y,Its' OK,Delivery was quick; however  I almost sent it back because it would not charge at all.  I used every charger/cord combo I could find in our house (believe me that is a lot)  and just before I gave up  it took the charge and has performed well since. I looked at user reviews for cheaper units  and decided to pay more for this one to get a better product with the Samsung name  model  etc  so I was a little disappointed at first. I did find it odd that the manufacturing date of 2010.08.13 was older than the one that came in my phone 2010.10.27  but now that it works  I guess I'm OK with it.,2015-08-31
US,10656775,R2J63HZEZ29XK2,B00M3QA9AU,465985658,iPhone 6s Plus Case  JETech Apple iPhone 6/6s Plus Case Shock-Absorption Bumper and Anti-Scratch Clear Back for iPhone 6s 6 Plus 5.5 Inch,Wireless,5,0,0,N,Y,Very pleased,Really  really happy with this case  especially for the price paid. It slips on easily and stays on snugly  while still giving my iPhone that sleek feel. Love it!,2015-08-31
US,38343410,R3FTBNU2N3EUBI,B00A7YK8PQ,451263087,Delton Cell Phone Car Charger for Samsung Galaxy Express i437 - Retail Packaging - Black,Wireless,5,0,0,N,Y,Five Stars,Great price and works.,2015-08-31
US,26677859,R62IWG4ZXHCYH,B0002BEUZ8,530036192,Metra Speaker Harness for Select GM Vehicles,Wireless,3,0,0,N,Y,Does not fit 1995 Blazer,Does not fit a 1995 Blazer 2 door. Both the Amazon car checker and Crutchfield showed this was correct. The correct one for a 1995 Blazer 2 door is Metra 72-4500  they fit the door speakers and the rear quarter panel 6 x 9 speakers. I thought maybe they would fit the dash speakers  they do not fit there either. FYI.,2015-08-31
US,38625972,R1LMP5ANAVE2U0,B00VHXCM0U,12020618,Vehicle Car GPS Tracker TK103B With Remote Control GSM Alarm SD Card Slot Anti-theft Realtime Tracker Gps103b for GSM GPRS GPS System Tracking Device,Wireless,1,0,0,N,Y,the gps103b is not working as an alarm. it ...,the gps103b is not working as an alarm. it is responding to sms request but not  to key fob or any input from sensors.,2015-08-31
US,2648374,R351729SS3I2KA,B00I9RBXIE,776897938,Body Glove Motorola Moto G XT1028 Dimensions Satin TPU Case - Retail Packaging - Black,Wireless,4,0,0,N,Y,Four Stars,Fits great  looks cool and slim.Haven't dropped phone yet to see how well it protects.,2015-08-31
US,38085972,R3T5NKLGYE1LUI,B0084Y47SK,759977365,RAVPower 3rd Gen Mini 3200mAh Portable Charger Lipstick-Sized External Battery Pack Power Bank Charger  iSmart Broad Compatibility  Fast Charging (Ultra Bright Flashlight with High/Low/Strobe Modes  5V/1A Output) for iPhone 6 6 plus  5S  5C  5  4S  4  iPod(Lightning Cable not Provided); Samsung Galaxy S5  S4  S3  S2  Note 2; Nexus 5  Nexus 4  HTC Sensation  One X V One X V S  EVO 4G  Thunderbolt,Wireless,5,0,0,N,Y,Five Stars,very good performance and noce price,2015-08-31
US,40259379,R3Q4GPVQIHHJUJ,B00NLJ3NPG,906226161,ZAGG Case Friendly InvisibleShield Original for iPhone 6 Plus,Wireless,2,0,0,N,N,I bought my glass screen protector  amd it is ...,I bought my glass screen protector  amd it is really disappointing. I don't do things that are particularly hard on phones  just normal adult use and my first one cracked within weeks. I got a replacement for the $5.99 shipping charge  and within weeks  it is cracked in multiple places again. The phone is never without a case either for protection from falls and such. The only conclusion I can draw is the protector itself is flawed in some way,2015-08-31
US,38278794,R25Q5U4QR9AN4,B00NWCKZLC,582037920,Galaxy S3 Case  S3 Case - ULAK [ Shock Resistant Series ] Hybrid Rubber Case Cover for Samsung Galaxy S3 III i9300 3in1 Hard Plastic +Soft Silicone (Wave-Black Silicone),Wireless,5,0,0,N,Y,Would Recommend !,Love this case I am even gonna look and see if they h ave any other styles  seems very durable as I very rarely drop my phone but the other day I stood up to greet someone forgetting my phone was on my lap and it fell on to concrete  everything A-Okay !!!!!  I would recommend this case for the simple fact I have been very happy with it and it survived the fall.,2015-08-31
US,2442339,R32KQJOCQI068P,B00QEUE0K6,133906788,iPhone 6  5c  5s  6 Plus  iPad Air  iPad Mini Cables and Chargers - USB to 8 Pin Data Sync - Designed for iOS8,Wireless,3,0,0,N,Y,I ordered 10 foot cables and these cables are only ...,I ordered 10 foot cables and these cables are only 9'9&#34;  should not be advertised as 10 foot,2015-08-31
US,11698926,R2V8TVEGGRKPOZ,B00I4BI9VE,882159302,WwWSuppliers Vintage American Country Red White & Blue USA War Flag Patriotic Print PU Leather Slim Wallet Case for Apple iPhoen 4 4G 4S Credit Card Flip Stand Phone Cover + Free Screen Protector and Stylus,Wireless,4,0,0,N,Y,Four Stars,Love the design. I'm hard on my phone and case fell apart.,2015-08-31
US,2164150,RUQ37FOWA9H5X,B00UMYB6UM,200324383,NO.1 Gtwo G2 1.54 inch Waterproof TFT Screen Smartwatch with Plastic Band for Smartphone  Bluetooth 4.0 / 2.0MP Camera / Heart Rate Sensor / Pedometer / Remote-control,Wireless,5,0,0,N,Y,Five Stars,Very nice looking watch,2015-08-31
US,30368672,R30WUNNCVO63HZ,B007SLDF7O,260696984,BW 7 inch High Resolution 800*480 TFT Color LCD Car Rear View Camera Monitor Support Rotating The Screen and 2 AV Inputs,Wireless,2,0,0,N,Y,Appeared Refurbished & Kept Turning Itself Off,The unit I received appeared to be refurbished  as there was no plastic film on the screen and the screen had some minor mars and scratches.  I could have lived with that; however the unit kept randomly turning itself off.  I checked all the connections  and they were tight.  So I am returning it for a replacement  which I hope will function properly.,2015-08-31
US,53084107,R2IBYNDYCOUAVW,B00SLNWCFO,613503427,Cottagecutz Mini Die-Frog 1.2x1.5,Wireless,4,0,0,N,N,A cute little two-piece die,I make and sell greeting cards to benefit our local library  and this Cottage Cutz two-piece mini frog die looks cute on my favorite anniversary card.  It would also work well on children's birthday cards.<br /><br />I used 80 lb. card stock to cut this die on my Sizzix Grand Calibur machine <br /><br />Please see customer image for an example of an A7 (5&#34; x 7&#34;) anniversary card that I made with this die.  The castle die is made by Quick Kutz and the cat tails are cut from another Cottage Cutz die  &#34;Mallard Ducks w/ Cats-tail.&#34;,2015-08-31
US,131526,R21POWW7Q631OK,B00M0YWKPM,685107474,iPhone 6s Plus Case,Wireless,4,0,0,N,Y,Four Stars,Great wallet case. Nice n simple,2015-08-31
US,14925080,R2O9ZJAOLLZ2AE,B00LF5H5M0,856973636,ULAK Galaxy Note 3 Case Slim Hybrid Dual Layer Hard Plastic Shell+ Silicone Shockproof Holster Combo Case for Samsung Galaxy Note 3 N9000 with Kickstand and Belt Clip,Wireless,5,0,0,N,Y,Five Stars,I really like my new case it's durable  comfortable to hold  and I like the stands!!!,2015-08-31
US,44774710,R3J0J5VA9JA2MH,B00SVH91R2,218509076,iGotTech iPhone 6 Plus and 6s Plus Tempered Glass Screen Protector (5.5 Inch ONLY)  Edge to Edge Ballistic Glass  Cell Phone Touchscreen Accuracy,Wireless,5,0,0,N,Y,Cars can drive over your without a scratch!,If you're in doubt to purchase this  don't be! Order it!  I had my iPhone 6+ mounted on my motorcycle - it happened to pop out of the holder it was in  while I was moving.  I guess it was the vibration.  Irregardless  it landed on concrete in the middle of a busy intersection. After turning around to go retrieve it  I watched it being driven over by 4 cars.  There is not one scratch on my phone.  The screen did not break/crack.  I was so relieved when I got it back - words cannot describe.,2015-08-31
US,127413,RLAH5SU3TBR08,B00WY7NP9K,784975887,Galaxy Note Edge Case Samsung Galaxy Note Edge Case  Combo Rugged Shell Cover Holster with Built-in Kickstand and Holster Locking Belt Clip Black + Circle(TM) Stylus Touch Screen Pen,Wireless,5,0,0,N,Y,Was just what my husband needed  he just broke ...,Was just what my husband needed  he just broke the screen on his phone so this is a life saver.,2015-08-31
US,1225113,R3JYHEEC24GVEE,B00PGF3IYE,613786861,Moto X2nd Case,Wireless,1,0,0,N,N,One Star,Ordered 2 of these. Both Stylist are bent,2015-08-31
US,11760707,R1WWB39UMU0M5L,B00V54CLNO,877297447,Aduro U-Grip Plus Universal Bike Mount - for Motorcycle  Handlebar  Roll Bar  for all Android Smartphones  iPhone 6 6s 7 Plus 5 5s 5c and GPS Holder,Wireless,5,0,0,N,Y,Aduro U- grip plus holder,Love this! I Have been using this holder for my IPhone 6 while riding my bike for the past 2 months or so. I ride on paved streets and crushed gravel bike paths and it works great..my phone stays in place solidly and is easy to use. I definitely recommend this product!,2015-08-31
US,2977654,R3S72LOC1HVSH1,B00OM40K1Y,216741539,Samsung Genuine Fast Charge USB-C 15W Wall Charger - Black- Galaxy Note8  Galaxy S8  and Galaxy S8+ Inbox Replacement - Retail Packaging,Wireless,5,0,0,N,Y,Great Charger,i bought this charger for note 4  i am fully satisfied with this charger  its same like original one which one come with the phone  charge so fast like original one  and phone show that on screen its adaptive fast charger  nothing difference then original one. highly recommended.,2015-08-31
