B0007KK256,[0.4215],[5],[[nice]],"[[nice, 0.4215, 5]]"
B000KNNKVS,"[0.3252, 0.0, -0.6197]","[1, 1, 1]","[[piece, st, nothing, help, domen, nothing, waste, money, gimmick], [work, didnt, anything, waste, money], [work]]","[[piece st nothing help domen nothing waste money gimmick, 0.3252, 1], [work didnt anything waste money, 0.0, 1], [work, -0.6197, 1]]"
B000P0ZX7K,[0.6249],[5],"[[work, great]]","[[work great, 0.6249, 5]]"
B001IB2120,"[0.0, -0.3664, 0.4754, 0.8519]","[5, 3, 5, 5]","[[buy, march, apply, hold, phone, mount, slip, movement, didnt, want, love, itbr, br, summer, hit, jersey, heatwave, jersey, summer, arent, le, month, summer, keep, use, product, id, buy, time, year, sucksbr, br, say, went, pad, come, marking, leave, dash, greatbr, br, live, mild, climate, cant, beat, wherever, get, heat, weary, buy, bulk], [aaa, order], [work, great, buy, recommend, anyone]]","[[buy march apply hold phone mount slip movement didnt want love itbr br summer hit jersey heatwave jersey summer arent le month summer keep use product id buy time year sucksbr br say went pad come marking leave dash greatbr br live mild climate cant beat wherever get heat weary buy bulk, 0.0, 5], [aaa order, -0.3664, 3], [work great buy recommend anyone, 0.4754, 5], [, 0.8519, 5]]"
B001OD2OAQ,"[0.0, 0.4404]","[1, 4]","[[product], [cheap, product, work, month, purchasewaste, money]]","[[product, 0.0, 1], [cheap product work month purchasewaste money, 0.4404, 4]]"
B001RJU4TA,"[0.7269, 0.8802, -0.3171]","[3, 3, 2]","[[unit, price, week, lead, start, flicker, burn, dont, think, anyway, replace], [fm, transmitter, clear, use, head, phone, there, volume, install], [install, instruction, tell, ground, wire, red, yellow, wire, order, backwards, list, wire, non, existant, get, instal, youtube, video, screen, clear, sound, ok, fm, radio, station, deal, nothing, worth, star, look, use, pay, amazon, price, list, use, open, product, make, perfect, condition, scratch, work, give, star, recommend]]","[[unit price week lead start flicker burn dont think anyway replace, 0.7269, 3], [fm transmitter clear use head phone there volume install, 0.8802, 3], [install instruction tell ground wire red yellow wire order backwards list wire non existant get instal youtube video screen clear sound ok fm radio station deal nothing worth star look use pay amazon price list use open product make perfect condition scratch work give star recommend, -0.3171, 2]]"
B00280QJFU,[0.6597],[5],"[[buy, piece, day, phone, price]]","[[buy piece day phone price, 0.6597, 5]]"
B002U5UD8C,[-0.3182],[5],"[[installation, trouble, buy, part, include]]","[[installation trouble buy part include, -0.3182, 5]]"
B003K9BKAW,[0.6369],[5],[[expect]],"[[expect, 0.6369, 5]]"
B003TR58KS,"[0.7579, 0.807]","[4, 5]","[[product, please], [value, handy]]","[[product please, 0.7579, 4], [value handy, 0.807, 5]]"
B0047NFISK,[0.7964],[4],"[[fit, wish, dragonfly]]","[[fit wish dragonfly, 0.7964, 4]]"
B004BBHYBM,[0.8342],[5],"[[mount, gps, havent, problem, month, product]]","[[mount gps havent problem month product, 0.8342, 5]]"
B004DVE2U6,[0.7906],[3],"[[face, plate, cover, fit]]","[[face plate cover fit, 0.7906, 3]]"
B004GPE4DY,[-0.2755],[1],"[[didnt, fit, phone, thing, sit, threw]]","[[didnt fit phone thing sit threw, -0.2755, 1]]"
B004TAO71U,[0.6802],[5],"[[sound, nice, doesnt, hit, think]]","[[sound nice doesnt hit think, 0.6802, 5]]"
B004ZN752Y,[0.0],[4],"[[alternative, less, price, buy, product, verizon, store]]","[[alternative less price buy product verizon store, 0.0, 4]]"
B0057QYF2G,"[-0.6733, 0.8242, 0.5719]","[3, 5, 5]","[[doesnt, sirius, onyx, radio, power, connector, jam, mount, plate, mount, work, modification, fyi, trouble, side, tape, come, loose, textured, trying, mount, try, side, tape, primer, see, work], [purchase, boyfriend, work, truck, say, work, perfect], [nice, xm, fall, place, car, work]]","[[doesnt sirius onyx radio power connector jam mount plate mount work modification fyi trouble side tape come loose textured trying mount try side tape primer see work, -0.6733, 3], [purchase boyfriend work truck say work perfect, 0.8242, 5], [nice xm fall place car work, 0.5719, 5]]"
B005CRPU74,"[0.0, 0.4404, 0.7906, -0.6249, 0.7906, 0.0]","[5, 1, 5, 1, 5, 3]","[[camera, use], [phone, need, battery, power, work, thanks], [work, thanks], [worst], [wont, hold, charge], [awesome, thanks]]","[[camera use, 0.0, 5], [phone need battery power work thanks, 0.4404, 1], [work thanks, 0.7906, 5], [worst, -0.6249, 1], [wont hold charge, 0.7906, 5], [awesome thanks, 0.0, 3]]"
B005EVCW9W,[-0.4215],[2],[[break]],"[[break, -0.4215, 2]]"
B005HN1UJ0,"[0.296, 0.2732, 0.4754, 0.9474, 0.5777, 0.0]","[4, 5, 2, 5, 5, 5]","[[wife, us, shes, please], [want, gps, computer, get, accurate, distance, precise, measurement, front, wheel, past, work, finebr, br, expect, wait, minute, computer, find, gps, satellite, start, ride, satellite, find, want, computer, work, spoil, iphone, make, wait, locates, satellite, need, hire, product, designer, apple, improve, user, interfacebr, br, annoyance, battery, dy, overnight, forget, turn, digital, camera, use, energy, idle, battery, cateye, computer, last, year, turn, garmin, make, product, well], [simple, use, reliable, price], [edge, work, issue, time, get, find, gps, case, power, get, work, issue, work, tell, mileage, estimation, ], [say, need, dont, need, anymore, feature], [bike, computer, terrific, price, newer, model, come, need, speed, time, distance, work, champ, need, gps, direction, color, bw, screen, bright, daylightbr, br, case, anyone, interest, work, zone, sporttracks, software, supply, gps]]","[[wife us shes please, 0.296, 4], [want gps computer get accurate distance precise measurement front wheel past work finebr br expect wait minute computer find gps satellite start ride satellite find want computer work spoil iphone make wait locates satellite need hire product designer apple improve user interfacebr br annoyance battery dy overnight forget turn digital camera use energy idle battery cateye computer last year turn garmin make product well, 0.2732, 5], [simple use reliable price, 0.4754, 2], [edge work issue time get find gps case power get work issue work tell mileage estimation , 0.9474, 5], [say need dont need anymore feature, 0.5777, 5], [bike computer terrific price newer model come need speed time distance work champ need gps direction color bw screen bright daylightbr br case anyone interest work zone sporttracks software supply gps, 0.0, 5]]"
B0076YVKJS,"[0.8685, -0.8074]","[5, 3]","[[there, warn, lose, charge, itll, turn, warn, there, charge, leave], [excellent, truck, driver, family, arrive, sooner, expect, packaging, microphone, earpiece, clear]]","[[there warn lose charge itll turn warn there charge leave, 0.8685, 5], [excellent truck driver family arrive sooner expect packaging microphone earpiece clear, -0.8074, 3]]"
B007B5V952,[0.7684],[5],"[[eh, kind, bling]]","[[eh kind bling, 0.7684, 5]]"
B007E5HLW4,[0.1814],[3],"[[get, pay, reason, display, become, take, get, keep, case, cover, dont, hit, make]]","[[get pay reason display become take get keep case cover dont hit make, 0.1814, 3]]"
B007K3TIBW,[0.5994],[5],"[[wife, love]]","[[wife love, 0.5994, 5]]"
B007NTTHLE,[0.5806],[3],"[[case, cheap, feel, look, clip, work, advertise, guess, dont, hate]]","[[case cheap feel look clip work advertise guess dont hate, 0.5806, 3]]"
B007P7JF52,[0.5729],[4],"[[nice, phone, get, update, sort, vital, get, micro, sd]]","[[nice phone get update sort vital get micro sd, 0.5729, 4]]"
B007PKDU6E,[0.7717],[5],"[[item, arrive, look, fit, phone]]","[[item arrive look fit phone, 0.7717, 5]]"
B008200LHW,"[0.7579, 0.7906, 0.8499]","[5, 5, 5]","[[work, great, m, street, trip, work, receiver, come, street, trip], [use, product, apple, navx, software, work, driver, make, work, find, install], [excellent, product, satisfy]]","[[work great m street trip work receiver come street trip, 0.7579, 5], [use product apple navx software work driver make work find install, 0.7906, 5], [excellent product satisfy, 0.8499, 5]]"
B008PNJDFW,[-0.6808],[1],"[[tab, break, become, useless]]","[[tab break become useless, -0.6808, 1]]"
B008U4VOW6,[0.4404],[5],[[install]],"[[install, 0.4404, 5]]"
B0092LXQRM,[0.8062],[5],"[[taotronics, order, make, tank, look, great, please]]","[[taotronics order make tank look great please, 0.8062, 5]]"
B009AJWR1M,[-0.1027],[2],[[broke]],"[[broke, -0.1027, 2]]"
B009RFUX7Y,[-0.2057],[2],"[[order, got, hot, pink, husband, suction, cup, work]]","[[order got hot pink husband suction cup work, -0.2057, 2]]"
B009W94704,[0.4019],[3],[[thing]],"[[thing, 0.4019, 3]]"
B00A3OYPQS,[0.9472],[5],"[[amaze, want, caseit, clear, see, color, ipod, raise, screen, side, cover, button, edge, protect, ipod, bump, piece, snaptogether, product, love, feel, snapons, earphone, jack, charger, plug, bit, harder, press, power, button, top, ipod, case, raise, order, protect, button, little, button, protect, satisfy, product]]","[[amaze want caseit clear see color ipod raise screen side cover button edge protect ipod bump piece snaptogether product love feel snapons earphone jack charger plug bit harder press power button top ipod case raise order protect button little button protect satisfy product, 0.9472, 5]]"
B00A70YZNQ,[0.926],[4],"[[job, use, issue, house, key, fall, adjust, run, go, run, get, rash, sweat, salt, grind, switch, flipbelt, preference, feel, arm, guess, perfect, go, walk, activity, didnt, sweat]]","[[job use issue house key fall adjust run go run get rash sweat salt grind switch flipbelt preference feel arm guess perfect go walk activity didnt sweat, 0.926, 4]]"
B00APLOM62,"[0.6369, 0.6249, -0.1531, -0.8674, -0.238, 0.0516, 0.0]","[5, 5, 1, 1, 2, 5, 1]","[[week, use, twice, broke, good, thing, price, money], [charger, problem, delivery, equipment], [order, time, work, daybr, br, sorry, company, sorry, productbr, br, joyce, christopherbr, imarkentgmailcom], [samsung, oem, cable, work], [month, connection, wire, separate, plug], [cord, brought, didnt, week, disappoint], [charger, arrive, time, work]]","[[week use twice broke good thing price money, 0.6369, 5], [charger problem delivery equipment, 0.6249, 5], [order time work daybr br sorry company sorry productbr br joyce christopherbr imarkentgmailcom, -0.1531, 1], [samsung oem cable work, -0.8674, 1], [month connection wire separate plug, -0.238, 2], [cord brought didnt week disappoint, 0.0516, 5], [charger arrive time work, 0.0, 1]]"
B00AQUCPFC,[0.0],[5],"[[product, exceed, expectation]]","[[product exceed expectation, 0.0, 5]]"
B00AQUO5RI,"[0.8979, 0.9306, 0.3716, 0.9601, 0.9531, 0.9446]","[5, 5, 3, 4, 5, 5]","[[speaker, work, window, audio, quality, good, microphone, high, quality, headphone, speakerphone, microphone, give, bit, speakinginacavern, sound, analog, headset, jack, work, switch, communication], [read, review, issue, echo, experience, issue, use, device, client, hotel, cant, go, get, volume, range, great, use], [gush, gadget, design, excellent, design, call, side, conversation, control, feature, touch, minus, volume, control, light, come, show, level, press, mute, red, light, come, show, mute, press, battery, button, light, give, display, battery, call, green, indicator, light, show, plug, laptop, become, speaker, skype, compact, easy, carry, do], [product, didnt, work, need], [review, week, use, see, action, know, surprise, device, person, get, number, call, min, headset, bind, desk, provides, freedom, move, exercise, take, care, thing, desk, case, require, miss, stuff, handy, tool, come, cover, carry, travel], [sound, work, phone, laptop, tablet, love]]","[[speaker work window audio quality good microphone high quality headphone speakerphone microphone give bit speakinginacavern sound analog headset jack work switch communication, 0.8979, 5], [read review issue echo experience issue use device client hotel cant go get volume range great use, 0.9306, 5], [gush gadget design excellent design call side conversation control feature touch minus volume control light come show level press mute red light come show mute press battery button light give display battery call green indicator light show plug laptop become speaker skype compact easy carry do, 0.3716, 3], [product didnt work need, 0.9601, 4], [review week use see action know surprise device person get number call min headset bind desk provides freedom move exercise take care thing desk case require miss stuff handy tool come cover carry travel, 0.9531, 5], [sound work phone laptop tablet love, 0.9446, 5]]"
B00B1HVI4I,"[0.6866, -0.2263]","[4, 2]","[[charger, work, working, week, buy, thing], [purchase, replace, charger, work, iphone, good, luck, use, phone, say, work, device, star]]","[[charger work working week buy thing, 0.6866, 4], [purchase replace charger work iphone good luck use phone say work device star, -0.2263, 2]]"
B00BYESXBE,[0.8225],[5],"[[excellent, item, super, fast, shipping]]","[[excellent item super fast shipping, 0.8225, 5]]"
B00BYRJXGA,"[-0.34, -0.0516]","[2, 5]","[[work, fine, problem, thanks], [give, rating, adjust, output, voltage, turn, pot, screw]]","[[work fine problem thanks, -0.34, 2], [give rating adjust output voltage turn pot screw, -0.0516, 5]]"
B00BZDK3XK,[0.8777],[5],"[[own, charge, iphone, time, charge, love, charge, ipad, recommend]]","[[own charge iphone time charge love charge ipad recommend, 0.8777, 5]]"
B00CJG7MFY,"[0.4754, 0.51, -0.2732, 0.2732]","[5, 4, 1, 4]","[[say, hour, talk, time, standby, hour, talk, say, battery, ], [nice, product, time], [love, itembut, broke, month, return, return, time, limit, past], [crack]]","[[say hour talk time standby hour talk say battery , 0.4754, 5], [nice product time, 0.51, 4], [love itembut broke month return return time limit past, -0.2732, 1], [crack, 0.2732, 4]]"
B00D1AGXVG,[-0.4767],[1],"[[screen, break, took, wrapper]]","[[screen break took wrapper, -0.4767, 1]]"
B00DA06Z3I,"[0.7461, 0.2023]","[4, 5]","[[sound, dock, style, idevice, connector, stop, use, didnt, work, device, connector, anymore, find, bluetooth, adapter, work, range, sound, bit, bass, heavy, clear, complaint, seem, way, wake, adapter, unplug, plug, thats, issue], [feel, fine, look]]","[[sound dock style idevice connector stop use didnt work device connector anymore find bluetooth adapter work range sound bit bass heavy clear complaint seem way wake adapter unplug plug thats issue, 0.7461, 4], [feel fine look, 0.2023, 5]]"
B00DEDL9WI,"[0.7287, 0.6213, 0.7906]","[5, 5, 5]","[[product, install, fast, shipping], [battery, keep, chargeat, alli, order, husband, watch, video, replace, husband, replace, battery, phone, work, change, battery, lot, partsbe, watch, video]]","[[product install fast shipping, 0.7287, 5], [battery keep chargeat alli order husband watch video replace husband replace battery phone work change battery lot partsbe watch video, 0.6213, 5], [, 0.7906, 5]]"
B00DJAVLG0,[0.705],[5],"[[use, replace, base, radio, challenger, fit, expect, minor, notch, trim, radio, instal, use, utility, knife, easy]]","[[use replace base radio challenger fit expect minor notch trim radio instal use utility knife easy, 0.705, 5]]"
B00DNLKM06,"[0.6369, 0.0]","[5, 3]","[[sticker, glue]]","[[sticker glue, 0.6369, 5], [, 0.0, 3]]"
B00DV2CKCU,[0.0],[2],"[[think, get, round, black, ihome, charge, bank, picturedi, receive, charging, bank, doesnt]]","[[think get round black ihome charge bank picturedi receive charging bank doesnt, 0.0, 2]]"
B00DVKOSHM,[0.6124],[4],"[[loud, regular, jam, box]]","[[loud regular jam box, 0.6124, 4]]"
B00DZTJKYU,"[0.9412, 0.4588, -0.8422, 0.9713, -0.4118, 0.9168]","[5, 5, 1, 4, 2, 4]","[[look, good, dont, know, im, listen, music, thats, work, leave, headphone, think, broke, return], [amaze, sound, great, jam, noice, cancelation, great, recommend], [sound, phone, conversation, headset, talk, headset, people, tell, voice, clear, noise, purchase, talk, phone, listen, walking, lg, return, noise, talk, headset, well, lg, purpose, extend, durability], [headphone, excellent, purchase, sound, quality, excellent, bought, work, rest, neck, ear, piece, fit, come, ear, bud, want, pair, phone, smart, watch, nice, work, headphone, wire, get, waybr, br, issue, situps, option, clip, shirt, portion, deal, fight, wire, recommend, friend], [sound, great, bass], [worst, thing, buy, life, device, lose, communication, xperia, zl, receive, help, sony, solve, issue, call, writing, time, directlybr, br, recommend, star, there]]","[[look good dont know im listen music thats work leave headphone think broke return, 0.9412, 5], [amaze sound great jam noice cancelation great recommend, 0.4588, 5], [sound phone conversation headset talk headset people tell voice clear noise purchase talk phone listen walking lg return noise talk headset well lg purpose extend durability, -0.8422, 1], [headphone excellent purchase sound quality excellent bought work rest neck ear piece fit come ear bud want pair phone smart watch nice work headphone wire get waybr br issue situps option clip shirt portion deal fight wire recommend friend, 0.9713, 4], [sound great bass, -0.4118, 2], [worst thing buy life device lose communication xperia zl receive help sony solve issue call writing time directlybr br recommend star there, 0.9168, 4]]"
B00E1UWA4O,"[-0.4404, 0.6271, 0.5719, 0.4767, -0.2023, 0.0, 0.0, 0.0, -0.3919, 0.8141, -0.1779, 0.6486, 0.3182, 0.8805, 0.6794, 0.0, 0.4019, 0.4404, 0.2023, 0.6369]","[5, 4, 2, 1, 5, 5, 3, 1, 5, 5, 5, 5, 5, 5, 5, 4, 5, 5, 3, 5]","[[far], [charge, fast, usb, port, sturdy, majority, car, charger, purchase, love, usb, port, problem, believe, wont], [work], [work, phone], [super, fast, charge, use, buy, charger, ebay, dollar, piece, go, extra, cost, charge, dead, hour, cheap, one, keep, charge, give, phone], [charge, ipads, time, charge, car, charger, ive, lot, work, car, try, find, improvement, thing], [charge, fast, stream, music, use, map, program, get, phone, charge], [prefer, longer, market, cigarette, lighter, motorcylebr, fit, receptacle, keep, phone, run, gps, tune, go, keep, sena, smh, charge, put, buy, need], [version, dont, buy, get, anker, powerdrive, better, build, quality, better, product, output, half, cost, httpamzntopxzrybr, br, detailsbr, order, brother, portapow, charge, brother, complain, couldnt, charge, phone, truck, time, plug, usb, andor, phone, blue, light, go, wouldnt, work, think, truck, week, thing, happen, car], [fyi, universal, think, work, mazda, cx], [say, work, advertise], [product, advertise, mount, stick, car, lighter, socket, inch, nice, get, product, dimension, sell, page, dimension, package], [charge, phone, phone, charge, drain, navigate], [try, socalled, charger, job, others, try, rate, discharge, usb, rout, car, dock, charge, nexus, screen, spotify], [love, charge, ipads, iphones, galaxy, note, product, etc, charge, usb, warranty, support, awesome], [work, fine, take, time, wiggle, order, connect, shift, position, doesnt, connect, sure, car, scosche], [product, seem, work, price], [super, fast, apple, product, operate, system, use, worry, overcharge, io, allow, overcharge, love, yes], [wont, charge, phone]]","[[far, -0.4404, 5], [charge fast usb port sturdy majority car charger purchase love usb port problem believe wont, 0.6271, 4], [work, 0.5719, 2], [work phone, 0.4767, 1], [super fast charge use buy charger ebay dollar piece go extra cost charge dead hour cheap one keep charge give phone, -0.2023, 5], [charge ipads time charge car charger ive lot work car try find improvement thing, 0.0, 5], [charge fast stream music use map program get phone charge, 0.0, 3], [prefer longer market cigarette lighter motorcylebr fit receptacle keep phone run gps tune go keep sena smh charge put buy need, 0.0, 1], [version dont buy get anker powerdrive better build quality better product output half cost httpamzntopxzrybr br detailsbr order brother portapow charge brother complain couldnt charge phone truck time plug usb andor phone blue light go wouldnt work think truck week thing happen car, -0.3919, 5], [fyi universal think work mazda cx, 0.8141, 5], [say work advertise, -0.1779, 5], [product advertise mount stick car lighter socket inch nice get product dimension sell page dimension package, 0.6486, 5], [charge phone phone charge drain navigate, 0.3182, 5], [try socalled charger job others try rate discharge usb rout car dock charge nexus screen spotify, 0.8805, 5], [love charge ipads iphones galaxy note product etc charge usb warranty support awesome, 0.6794, 5], [work fine take time wiggle order connect shift position doesnt connect sure car scosche, 0.0, 4], [product seem work price, 0.4019, 5], [super fast apple product operate system use worry overcharge io allow overcharge love yes, 0.4404, 5], [wont charge phone, 0.2023, 3], [, 0.6369, 5]]"
B00ESLW2LC,[-0.571],[2],"[[bluetooth, headset, find, hear, player]]","[[bluetooth headset find hear player, -0.571, 2]]"
B00EWU24US,"[-0.1761, 0.0, 0.6124, 0.7408, 0.6369, -0.979, -0.6708]","[1, 1, 1, 4, 5, 1, 1]","[[order, work, disappoint, recommend, anyone], [work, ipad, air, know, apple, put, chip, buy, product, disappoint, cause, need, longer, cable, wish, add, iphone, etc, page, order], [ok, cant, determine, start, use, itbr], [take, get, get, wasnt, pack, ft, charger, say], [length, move, charging, phone], [charge, phone, way, slow, ], [waste, money, broke, withing, hour]]","[[order work disappoint recommend anyone, -0.1761, 1], [work ipad air know apple put chip buy product disappoint cause need longer cable wish add iphone etc page order, 0.0, 1], [ok cant determine start use itbr, 0.6124, 1], [take get get wasnt pack ft charger say, 0.7408, 4], [length move charging phone, 0.6369, 5], [charge phone way slow , -0.979, 1], [waste money broke withing hour, -0.6708, 1]]"
B00EYWEH2C,[-0.3818],[1],"[[piece, crap]]","[[piece crap, -0.3818, 1]]"
B00F7B1TAM,[0.6249],[5],[[product]],"[[product, 0.6249, 5]]"
B00F9VROO0,[0.4215],[5],[[nice]],"[[nice, 0.4215, 5]]"
B00FERO8ES,"[-0.5439, 0.836]","[4, 5]","[[battery, doesnt, charge, think, problem, phone, find, tomorrow, get, factory, reset, make, sure, phone, battery, wall, charger, idea, dont, wear, mini, micro, usb, charge, plug, book, wear, tear, phone, worry, ask, plug, unplug, ], [excellent, product, ive, use, thats, didnt, make, review, cause, testing, say, work, charm, delivery, precise]]","[[battery doesnt charge think problem phone find tomorrow get factory reset make sure phone battery wall charger idea dont wear mini micro usb charge plug book wear tear phone worry ask plug unplug , -0.5439, 4], [excellent product ive use thats didnt make review cause testing say work charm delivery precise, 0.836, 5]]"
B00FYVF7XA,[-0.2023],[3],"[[expect, duracel, give, phone, charge, charge]]","[[expect duracel give phone charge charge, -0.2023, 3]]"
B00FZ6XZNI,[0.5368],[5],"[[quality, doesnt, scratch]]","[[quality doesnt scratch, 0.5368, 5]]"
B00G2QF0JW,[-0.0516],[3],"[[picture, texture, color, worn, spot, happen, case]]","[[picture texture color worn spot happen case, -0.0516, 3]]"
