B00005T39Y,"[0.6925, 0.0, 0.296, -0.2952, 0.7269, -0.2023]","[2, 5, 2, 1, 5, 2]","[[disappoint, product, thought, change, car, cassette, get, land, use, instead, suggest, anyone], [work, okay, week, cord, start, generate, noise, wiggling, cord, mm, end, alleviate, noise, background, expect, well, product, sony], [], [make, sound, lot, noise, brand, work, fine, year, didnt, work, box], [school, factory, system, acura, tl, quick, dirty, way, add, ipod, connectivity, super, simple, sound], [work, reason, tape, player, want, switch, side, b, tape, play, side, useless]]","[[disappoint product thought change car cassette get land use instead suggest anyone, 0.6925, 2], [work okay week cord start generate noise wiggling cord mm end alleviate noise background expect well product sony, 0.0, 5], [, 0.296, 2], [make sound lot noise brand work fine year didnt work box, -0.2952, 1], [school factory system acura tl quick dirty way add ipod connectivity super simple sound, 0.7269, 5], [work reason tape player want switch side b tape play side useless, -0.2023, 2]]"
B000N5T0T4,"[0.6249, 0.5719, 0.6597, 0.0]","[5, 5, 5, 1]","[[husband, us, amp, love], [amp], [use, power, self, contain, speaker, use, high, jeep], [amp, blow, circuit, week, use]]","[[husband us amp love, 0.6249, 5], [amp, 0.5719, 5], [use power self contain speaker use high jeep, 0.6597, 5], [amp blow circuit week use, 0.0, 1]]"
B001UO0RKS,[-0.296],[5],[[issue]],"[[issue, -0.296, 5]]"
B001UO651S,"[0.7351, -0.4118]","[5, 2]","[[excellent, thank], [screen, protect, broke, fast]]","[[excellent thank, 0.7351, 5], [screen protect broke fast, -0.4118, 2]]"
B00277EMQ2,[0.0],[1],"[[iphone, part]]","[[iphone part, 0.0, 1]]"
B003SWORNI,[0.2023],[4],"[[expect, work, fine]]","[[expect work fine, 0.2023, 4]]"
B004CYF366,"[0.0, -0.0]","[5, 1]","[[u, want, stolen, face, dont, detach], [lot, money]]","[[u want stolen face dont detach, 0.0, 5], [lot money, -0.0, 1]]"
B004E9SZP0,"[0.0, 0.4585]","[1, 1]","[[work, receive], [advertise, say, work, headset, doesnt, broke, x]]","[[work receive, 0.0, 1], [advertise say work headset doesnt broke x, 0.4585, 1]]"
B004K57Q8A,[0.7876],[5],"[[buy, lot, speaker, day, say, speaker, kicker, price, look, wrangler]]","[[buy lot speaker day say speaker kicker price look wrangler, 0.7876, 5]]"
B004S50ZNA,[0.6486],[4],"[[amp, flaw, part, screw, door, make, metal, break, side, price, amp]]","[[amp flaw part screw door make metal break side price amp, 0.6486, 4]]"
B004S510CK,[-0.5423],[2],"[[sound, quality]]","[[sound quality, -0.5423, 2]]"
B004V9GSKC,"[0.6369, 0.7964]","[5, 5]","[[get, love], [sub, great, p, p, hit, way, harder, people, tell, way, sub, recommend, everyone]]","[[get love, 0.6369, 5], [sub great p p hit way harder people tell way sub recommend everyone, 0.7964, 5]]"
B004X71HXU,"[0.7574, 0.6249]","[5, 5]","[[use, work, fit], [charger, come, include, adapter, make, charge, use, data, usb, cord]]","[[use work fit, 0.7574, 5], [charger come include adapter make charge use data usb cord, 0.6249, 5]]"
B00508I446,"[-0.4019, 0.6249, 0.0772, 0.0]","[1, 5, 1, 1]","[[charger, use, defect], [fit, charge, allphones, keep, flash, something, wrongit, waste, money], [packaging, doesnt, work]]","[[charger use defect, -0.4019, 1], [fit charge allphones keep flash something wrongit waste money, 0.6249, 5], [packaging doesnt work, 0.0772, 1], [, 0.0, 1]]"
B00530RYCE,[0.0],[2],"[[camera, hole, volume, button]]","[[camera hole volume button, 0.0, 2]]"
B0055T53GC,[-0.7096],[2],"[[case, phone, phone, work, pay, postage, front, get, phojne, take, stick, case, son, need, phone, knowing, phone, mail, happens]]","[[case phone phone work pay postage front get phojne take stick case son need phone knowing phone mail happens, -0.7096, 2]]"
B0055XYXJ6,[0.7845],[5],"[[case, fit, phone, perfectlyquick, shipping, good, price, get, red, silicone, case, wife, love, slick, feel, get, silicone]]","[[case fit phone perfectlyquick shipping good price get red silicone case wife love slick feel get silicone, 0.7845, 5]]"
B005A34PLW,[0.0],[1],"[[buy, thing, dont, waist, money]]","[[buy thing dont waist money, 0.0, 1]]"
B005GP4FKU,[0.0],[5],[[job]],"[[job, 0.0, 5]]"
B005JZTICM,[0.7162],[4],"[[work, hide, cord, foot, short, buy, extension, outlet, problem, unit, know, bought, think]]","[[work hide cord foot short buy extension outlet problem unit know bought think, 0.7162, 4]]"
B005LQ9324,[0.5719],[5],[[perfect]],"[[perfect, 0.5719, 5]]"
B0070031RC,[0.3612],[4],"[[excellent, product, complaint, product, bulkiness]]","[[excellent product complaint product bulkiness, 0.3612, 4]]"
B007652FLY,[0.6369],[4],"[[seems, sterdy, thing, wish, longer, arm, note, edge]]","[[seems sterdy thing wish longer arm note edge, 0.6369, 4]]"
B008JEXIHQ,[0.863],[5],"[[wait, get, dress, use, cute, word, buy, thank, judie]]","[[wait get dress use cute word buy thank judie, 0.863, 5]]"
B008N8QWV2,[0.6249],[5],"[[awesome, cover]]","[[awesome cover, 0.6249, 5]]"
B008S3WTSW,[-0.1796],[5],"[[efficient, service, part, need, complains]]","[[efficient service part need complains, -0.1796, 5]]"
B008YNEFN8,[0.8399],[5],"[[fit, glove, customer, happy]]","[[fit glove customer happy, 0.8399, 5]]"
B0091D0EBC,[0.6249],[5],[[work]],"[[work, 0.6249, 5]]"
B009B5C88W,[0.9042],[5],"[[casewanted, fun, color, sleek, design, perfect]]","[[casewanted fun color sleek design perfect, 0.9042, 5]]"
B009L4NY8Q,[-0.4538],[5],"[[arrvd, time, gift, dau, doesnt, want, ill, return, dont, honda, ipod]]","[[arrvd time gift dau doesnt want ill return dont honda ipod, -0.4538, 5]]"
B009R01BTI,[0.6249],[5],"[[ac, outlet]]","[[ac outlet, 0.6249, 5]]"
B009TBTING,"[0.0, 0.4404]","[5, 5]","[[need, order]]","[[need order, 0.0, 5], [, 0.4404, 5]]"
B009UNZC6K,[0.8481],[5],"[[service, product]]","[[service product, 0.8481, 5]]"
B00A1O1WPW,"[0.6249, 0.3612]","[5, 5]","[[receive, fit, work, promise, business, seller]]","[[receive fit work promise business seller, 0.6249, 5], [, 0.3612, 5]]"
B00AAA8U0W,[0.5704],[3],"[[get, case, sooner, dont, see, layer, get, rubber, case, thats, thats, rd, layer]]","[[get case sooner dont see layer get rubber case thats thats rd layer, 0.5704, 3]]"
B00AFXUUV6,[0.4404],[3],"[[keep, case, phone]]","[[keep case phone, 0.4404, 3]]"
B00AH58J3S,[0.743],[5],"[[tablet, get, scratch, screen, panic, protector, save, get]]","[[tablet get scratch screen panic protector save get, 0.743, 5]]"
B00AOW8ILC,[0.6656],[4],"[[case, wont, go, use, nexus]]","[[case wont go use nexus, 0.6656, 4]]"
B00B1O15C6,"[-0.5423, 0.8481, 0.3089]","[1, 4, 3]","[[use, purchase, sim, japanbr, use, problem], [window, phone], [phone, great, battery, life]]","[[use purchase sim japanbr use problem, -0.5423, 1], [window phone, 0.8481, 4], [phone great battery life, 0.3089, 3]]"
B00B42K5BM,[0.0],[1],[[work]],"[[work, 0.0, 1]]"
B00BF8JVTC,[0.8062],[5],"[[work, great, thanks]]","[[work great thanks, 0.8062, 5]]"
B00BIET83W,[0.6369],[5],[[armband]],"[[armband, 0.6369, 5]]"
B00BLG5CQY,[-0.9655],[3],"[[product, look, nice, provide, protection, boast, drop, grass, foot, phone, broke, repair, guy, shock, say, wasnt, see, break, spite, otterbox, claim, pink, cute, try, something, think, drop, phone, day]]","[[product look nice provide protection boast drop grass foot phone broke repair guy shock say wasnt see break spite otterbox claim pink cute try something think drop phone day, -0.9655, 3]]"
B00BN5I8MS,[0.5478],[5],"[[handy, hold, phone, vent, dont, look, take, time, create, bend, work]]","[[handy hold phone vent dont look take time create bend work, 0.5478, 5]]"
B00BUDL3B6,"[0.4404, 0.0]","[4, 5]",[[want]],"[[want, 0.4404, 4], [, 0.0, 5]]"
B00BZQAVIO,[0.9134],[5],"[[fit, great, pearl, male, thing, stun, wife, phone]]","[[fit great pearl male thing stun wife phone, 0.9134, 5]]"
B00CFTIW22,[0.4404],[5],[[stuff]],"[[stuff, 0.4404, 5]]"
B00CPFPKAI,"[0.5574, 0.7706, 0.6124]","[5, 3, 5]","[[arrive, feeling, memory, card, fit], [nice, work, fine], [get, take, ship, china, yes, ship, china, piece, stay, close, tape, toss, camera, bag, price, cheap, id, prefer, type, ship, card, find, werent, crazy, pricedbr, aware, secure, pop]]","[[arrive feeling memory card fit, 0.5574, 5], [nice work fine, 0.7706, 3], [get take ship china yes ship china piece stay close tape toss camera bag price cheap id prefer type ship card find werent crazy pricedbr aware secure pop, 0.6124, 5]]"
B00CR6V7PW,[0.7964],[5],"[[microfiber, clean, cloth, hope, cheaper, buy]]","[[microfiber clean cloth hope cheaper buy, 0.7964, 5]]"
B00D1BGMSY,[0.8949],[5],"[[rubberize, case, work, hole, line, phone, soft, hard, shell, case, case, work, fine, snap, one, change, color, money]]","[[rubberize case work hole line phone soft hard shell case case work fine snap one change color money, 0.8949, 5]]"
B00D8YYOI4,"[0.6124, -0.5812]","[5, 1]","[[product, service], [worth, money, poor, intermittent, connection, phone, bberry, level, quality]]","[[product service, 0.6124, 5], [worth money poor intermittent connection phone bberry level quality, -0.5812, 1]]"
B00DEQ0OX0,[-0.6715],[1],"[[case, fit, phone, lie]]","[[case fit phone lie, -0.6715, 1]]"
B00DQ7W14C,[0.4716],[2],"[[speaker, sound, however, delicate, drop, inch, speaker, connection, break]]","[[speaker sound however delicate drop inch speaker connection break, 0.4716, 2]]"
B00DSKE9WE,[-0.2924],[1],"[[hear, come, clear]]","[[hear come clear, -0.2924, 1]]"
B00E3UF71U,[0.4758],[5],"[[work, department, tell, couldnt, find, connector, find, stuff, amazon]]","[[work department tell couldnt find connector find stuff amazon, 0.4758, 5]]"
B00E7Z06LC,[0.6369],[5],"[[thing, take]]","[[thing take, 0.6369, 5]]"
B00E9OXJ2Y,"[0.4173, 0.7841, 0.0, 0.0]","[4, 3, 1, 1]","[[disconnect, phone, reset], [work, fact, battery], [product, arrive, describe, nifty, get, recharge, range, leave, key, downstairs, go, upstairs, get, message, say, lose, connection, figure, ft, indoors, besides, product, work, advertise, increase, range, beep, time, im, home, great], [dozen, time, junk]]","[[disconnect phone reset, 0.4173, 4], [work fact battery, 0.7841, 3], [product arrive describe nifty get recharge range leave key downstairs go upstairs get message say lose connection figure ft indoors besides product work advertise increase range beep time im home great, 0.0, 1], [dozen time junk, 0.0, 1]]"
B00EHDK0LK,"[-0.2023, 0.6249]","[2, 5]","[[work, great, havent, amy, issue], [open, bottom, port, make, charge, recharge]]","[[work great havent amy issue, -0.2023, 2], [open bottom port make charge recharge, 0.6249, 5]]"
B00EO0MDNO,[0.0],[5],[[expect]],"[[expect, 0.0, 5]]"
B00EVIVHJU,"[-0.6369, 0.4404]","[5, 5]","[[see, lot, fish, give, info], [disappointment, find, bottom, lake, pend, oreille, ft, fish]]","[[see lot fish give info, -0.6369, 5], [disappointment find bottom lake pend oreille ft fish, 0.4404, 5]]"
B00EYVTK84,[-0.4495],[3],"[[broke, day]]","[[broke day, -0.4495, 3]]"
B00FBYY5KG,[0.9731],[5],"[[super, handy, love, plot, gps, route, online, iphone, app, feature, wish, didnt, need, hrm, strap, deal, im, main, workout, need, gps, distance, wish, incorporate, hrm, watch, somehow, fitbits, wouldnt, pedometer, option, love, garmin]]","[[super handy love plot gps route online iphone app feature wish didnt need hrm strap deal im main workout need gps distance wish incorporate hrm watch somehow fitbits wouldnt pedometer option love garmin, 0.9731, 5]]"
B00FC2HLIK,[0.4215],[4],[[like]],"[[like, 0.4215, 4]]"
B00FCYN4U2,[0.9349],[5],"[[phone, case, own, nd, hug, phone, case, drop, wonderful]]","[[phone case own nd hug phone case drop wonderful, 0.9349, 5]]"
B00FFM4LYY,"[0.6249, 0.0, 0.5495]","[1, 4, 2]","[[powerbank, take, hour, charge, last, less, hour, mine, month, wont, charge, anymore, stop, work, know, shouldnt, expect, something, cost, buck, expect, work, sorry, dont, waste, money], [excelent], [didnt, work, use, battery, power, bank, heat, point, think, burn, hand, touch, figure, worth, try]]","[[powerbank take hour charge last less hour mine month wont charge anymore stop work know shouldnt expect something cost buck expect work sorry dont waste money, 0.6249, 1], [excelent, 0.0, 4], [didnt work use battery power bank heat point think burn hand touch figure worth try, 0.5495, 2]]"
B00FGCUMDM,[0.0],[5],"[[ship, fast, product, expect, suppose, cell, phone, drop]]","[[ship fast product expect suppose cell phone drop, 0.0, 5]]"
B00G00KLCQ,"[-0.1301, 0.0]","[1, 5]","[[quality, sound, noise, cancel], [cant, hear, anything, music]]","[[quality sound noise cancel, -0.1301, 1], [cant hear anything music, 0.0, 5]]"
B00G1FG7SM,"[0.9648, 0.0, 0.7783, -0.7268]","[5, 5, 4, 1]","[[replacement, part, perfect, fit, color, match, repair, done, glue, loca, replacement, glass, result, result, look, act, product], [get, screan, mom, phone, put, shatter, wasnt, drop, im, happy], [item, describe, didnt, need, tool, im, sure, others, find, take, longer, get, item, send, country, take, account], [kool]]","[[replacement part perfect fit color match repair done glue loca replacement glass result result look act product, 0.9648, 5], [get screan mom phone put shatter wasnt drop im happy, 0.0, 5], [item describe didnt need tool im sure others find take longer get item send country take account, 0.7783, 4], [kool, -0.7268, 1]]"
B00GN5K650,"[0.0, -0.3252]","[5, 1]","[[], [pioneer, watt, amp, pioneer, sub, buy, sub, contacting, seller, return, item, maravingmail]]","[[, 0.0, 5], [pioneer watt amp pioneer sub buy sub contacting seller return item maravingmail, -0.3252, 1]]"
B00GNQ10VS,"[0.4404, 0.8481, 0.3329, 0.4404, 0.4019, 0.5574, -0.8176, 0.5719, 0.4754, 0.7967, 0.5621, 0.1474, 0.4404]","[5, 5, 4, 5, 5, 5, 5, 5, 5, 5, 5, 5, 5]","[[yes], [product, great, experience], [work, issue], [use, android, way, suck, lot, battery, excellent, add, pound, phone, limit, functionality, play, game, android, battery, suppose, tokeeps, pump, juice, day, use, gps, keep, screen, charge, unit, power, leave, charger, period, reach, dont, bulk, understand, sacrifice, battery, life], [hold, charge, day, google, edition], [goodbr, thing, awesome, battery, day, use, use, worry, phone, die, use, phone, day, charge, br, br, badbr, thing, heavy, thick, brag, thin, phone], [amaze, battery, life, battery, phonebr, expect, double, phone, thickness, weightbr, happy, purchase, keep, charge, use, know, wont, charger, extend, period, time, use, slipping, pocket, toolbelt], [battery, longe], [battery, cover, mophie, battery, case, struggle, make, day, time, battery, go, day, youre, easy, phone, usage, make, brick, size, phone, everyone, work], [everything, perfect], [battery, awesome, run, time, listening, amazon, music, day, work, hour, day, charge, day, try, run, condition, im, get, upset, take, forever, run, downbr, br, phone, pound, battery, weight, worry, go, battery, ill, go, answer, thing, hit, face, lighter, oem, battery]]","[[yes, 0.4404, 5], [product great experience, 0.8481, 5], [work issue, 0.3329, 4], [use android way suck lot battery excellent add pound phone limit functionality play game android battery suppose tokeeps pump juice day use gps keep screen charge unit power leave charger period reach dont bulk understand sacrifice battery life, 0.4404, 5], [hold charge day google edition, 0.4019, 5], [goodbr thing awesome battery day use use worry phone die use phone day charge br br badbr thing heavy thick brag thin phone, 0.5574, 5], [amaze battery life battery phonebr expect double phone thickness weightbr happy purchase keep charge use know wont charger extend period time use slipping pocket toolbelt, -0.8176, 5], [battery longe, 0.5719, 5], [battery cover mophie battery case struggle make day time battery go day youre easy phone usage make brick size phone everyone work, 0.4754, 5], [everything perfect, 0.7967, 5], [battery awesome run time listening amazon music day work hour day charge day try run condition im get upset take forever run downbr br phone pound battery weight worry go battery ill go answer thing hit face lighter oem battery, 0.5621, 5], [, 0.1474, 5], [, 0.4404, 5]]"
B00GSY9KDU,[-0.7579],[1],"[[suck, as]]","[[suck as, -0.7579, 1]]"
B00GT0JH72,[-0.2071],[4],"[[case, doesnt, fit, come, make, slide, screen]]","[[case doesnt fit come make slide screen, -0.2071, 4]]"
B00H2ZU72W,"[-0.6634, 0.4404]","[3, 5]","[[price], [dont, love, slot, misalign, hole, make, difficult, get, plug, worth, return, buuut, frustrate]]","[[price, -0.6634, 3], [dont love slot misalign hole make difficult get plug worth return buuut frustrate, 0.4404, 5]]"
B00H3B94VA,[-0.4215],[1],"[[camo, design, start, peel, week, receive, item, otherwise, sturdy, longer, design]]","[[camo design start peel week receive item otherwise sturdy longer design, -0.4215, 1]]"
B00H7WN9G6,[0.0],[1],[[workreturned]],"[[workreturned, 0.0, 1]]"
B00H8KIH1O,"[0.7964, 0.6249, 0.875]","[5, 5, 5]","[[product, work, customer, service, battery, life, suck, product, great], [work, good, love, use, shower, ], [awesome, receive, time]]","[[product work customer service battery life suck product great, 0.7964, 5], [work good love use shower , 0.6249, 5], [awesome receive time, 0.875, 5]]"
B00HVE1IH2,"[0.4754, 0.9432, 0.6908, 0.296]","[4, 4, 5, 5]","[[poduct, seem, quality, doesnt, lay, way, phone, leave, air, pocket, uper, hand, cornerbr, screen, super, clear], [defense, yearolds], [nice, iwll, buy], [ok]]","[[poduct seem quality doesnt lay way phone leave air pocket uper hand cornerbr screen super clear, 0.4754, 4], [defense yearolds, 0.9432, 4], [nice iwll buy, 0.6908, 5], [ok, 0.296, 5]]"
B00HX0RTTU,"[0.9493, 0.8685, 0.5719]","[5, 5, 5]","[[dont, get, loud, feature, option, make, sync, pair, headphones, buy, dont, work, pair, easy, option, make, adult, year, recommend], [impress, quality, headphone, try, theyre, tell, quality, sound, happy, year], [perfect, son, plane, ride]]","[[dont get loud feature option make sync pair headphones buy dont work pair easy option make adult year recommend, 0.9493, 5], [impress quality headphone try theyre tell quality sound happy year, 0.8685, 5], [perfect son plane ride, 0.5719, 5]]"
B00IT5PEZO,"[0.6249, 0.1027, -0.1854]","[5, 4, 2]","[[glass, work, week, stop, respond, touch, glass, replace, unit, see, complaint, touch, problem, tape, doesnt, hold, favor, get, back, tape, glass, unit, work, work, fine, price, feel, worth, chance, second, glass, unit, complaint, replace, glass, daughter, seem, lot, buying, ipad, mini], [buy, customer, complain, home, button, doesnt, work, act, amazon, kind, send, replacement, doesnt, work, try, take, broke, felt, replacement, buy, charm, glue, tape, doesnt, work, end, use, silicon, glue, keep, place], [work]]","[[glass work week stop respond touch glass replace unit see complaint touch problem tape doesnt hold favor get back tape glass unit work work fine price feel worth chance second glass unit complaint replace glass daughter seem lot buying ipad mini, 0.6249, 5], [buy customer complain home button doesnt work act amazon kind send replacement doesnt work try take broke felt replacement buy charm glue tape doesnt work end use silicon glue keep place, 0.1027, 4], [work, -0.1854, 2]]"
B00J4EXWT4,[0.6369],[5],"[[receive, love, color, protection]]","[[receive love color protection, 0.6369, 5]]"
B00J7H01Z6,[0.6369],[5],"[[quad, lock, line]]","[[quad lock line, 0.6369, 5]]"
