B00SXRXUE0,"[0.8898, 0.0, 0.9678, 0.9186, 0.8909, 0.6249, 0.6811]","[5, 5, 4, 5, 5, 5, 4]","[[], [product, return, belkin, velcro, streamline, design], [product, great, price, work, promise, provides, secure, placement, iphone, boot, recommend, runner, walker, everywherebr, br, find, iphone, enjoy, wearing, gym, iphone, product, work, gym, dont, mind, size, iphone], [product, issue, iphone, doesnt, fit, case, feel, phone, doesnt, fit, snug, deal, recommend, product], [fit, iphone, color, screen, protector, fine, bit, smaller, whole, surface, cover, touch, screen, nice, bargain], [amaze, customer, service, product, damage, ship, ship, replacement, arrive, band, work, perfect, gym, run, park], [product, arm, band, spot, fit, giving, make, usage, limit, mobility, attention, detail, key, slot, help, bunch, thing, run, recommend, anyone, seek, armband]]","[[, 0.8898, 5], [product return belkin velcro streamline design, 0.0, 5], [product great price work promise provides secure placement iphone boot recommend runner walker everywherebr br find iphone enjoy wearing gym iphone product work gym dont mind size iphone, 0.9678, 4], [product issue iphone doesnt fit case feel phone doesnt fit snug deal recommend product, 0.9186, 5], [fit iphone color screen protector fine bit smaller whole surface cover touch screen nice bargain, 0.8909, 5], [amaze customer service product damage ship ship replacement arrive band work perfect gym run park, 0.6249, 5], [product arm band spot fit giving make usage limit mobility attention detail key slot help bunch thing run recommend anyone seek armband, 0.6811, 4]]"
B00SZ46U1Q,[0.6249],[5],"[[ship, time, product]]","[[ship time product, 0.6249, 5]]"
B00T2UPLEE,"[0.1027, 0.9321, 0.8754]","[3, 4, 5]","[[product, exception, ear, piece, fall, time, use, plastic, ear, thing, come, kind, pop, sound, quality, great, user, device], [ear, piece, awesome, sound, recommend], [unit, fine, end, everyone, talk, use, report, hear, echo]]","[[product exception ear piece fall time use plastic ear thing come kind pop sound quality great user device, 0.1027, 3], [ear piece awesome sound recommend, 0.9321, 4], [unit fine end everyone talk use report hear echo, 0.8754, 5]]"
B00T5MHAOS,[0.4927],[5],"[[surprise, quality, price, father, pay, twice, brand, look, feel, inner, velcro, hidden, closure, make, secure, kid, fear, fall]]","[[surprise quality price father pay twice brand look feel inner velcro hidden closure make secure kid fear fall, 0.4927, 5]]"
B00T8L59EO,[-0.0772],[4],"[[work, need, usb, cable, attach, computer, power, brick, include, charge, port, fail, device, save, phone, swap, deplete, battery, morning, charge, device, keep, phone, run, indicator, change, red, battery, charge, battery, charge, device, show, instal, phone]]","[[work need usb cable attach computer power brick include charge port fail device save phone swap deplete battery morning charge device keep phone run indicator change red battery charge battery charge device show instal phone, -0.0772, 4]]"
B00T98A766,"[0.88, 0.6249]","[5, 5]","[[using, replace, charger, desk, usb, charger, get, bit, warm, tablet, charge, oncebut, dar, good, compact, size, way, stand, lead, indicate, know, give, warm, get, update, problem, far], [quick, charge, component]]","[[using replace charger desk usb charger get bit warm tablet charge oncebut dar good compact size way stand lead indicate know give warm get update problem far, 0.88, 5], [quick charge component, 0.6249, 5]]"
B00THJUVP4,[-0.2924],[1],"[[iphone, description, order]]","[[iphone description order, -0.2924, 1]]"
B00U8B6X3Y,[0.8176],[4],"[[nice, bluetooth, speaker, problem, speaker, otherwise, good, sound, fair, volume]]","[[nice bluetooth speaker problem speaker otherwise good sound fair volume, 0.8176, 4]]"
B00U8IL7W4,[0.0],[1],"[[work, cord]]","[[work cord, 0.0, 1]]"
B00UCJ0IBU,"[0.9939, 0.6369, 0.6249, 0.0, 0.8999, -0.5423, 0.25]","[5, 5, 5, 2, 5, 5, 5]","[[thing, im, use, update, lollipop], [son, love, phone, use, great, graphic], [phone, awesome, allot, phone, own, nokia, k, zoom, cause, camera, phone, feature, love, phone, well, video, phone, produce, buy, phone, camera, please, specs, game, android, market, body, phone, nice, back, plate, swap, battery, metal, frame, awesome, negative, phone, memory, card, slot, stabilization, wish, see, video, quality, click, link, youtube, channelbr, br, httpswwwyoutubecomplaylistlistplnwwmkptowfeuovrsktwcunbhxqc], [describe, look, light], [steal, cheap, phone, chock, bell, whistle, ship, phone, describe, work, network], [phone, price]]","[[thing im use update lollipop, 0.9939, 5], [son love phone use great graphic, 0.6369, 5], [phone awesome allot phone own nokia k zoom cause camera phone feature love phone well video phone produce buy phone camera please specs game android market body phone nice back plate swap battery metal frame awesome negative phone memory card slot stabilization wish see video quality click link youtube channelbr br httpswwwyoutubecomplaylistlistplnwwmkptowfeuovrsktwcunbhxqc, 0.6249, 5], [describe look light, 0.0, 2], [steal cheap phone chock bell whistle ship phone describe work network, 0.8999, 5], [phone price, -0.5423, 5], [, 0.25, 5]]"
B00UE9O0WQ,"[0.5335, 0.6249, 0.6249, 0.9164, 0.7269, 0.6908, -0.5106, 0.966, 0.9097]","[5, 5, 5, 5, 5, 4, 4, 5, 5]","[[wireless, coil, nexus, phone, charger, work, purchase, charger, nexus, upgrade, nexus, phablet, think, purchase, wireless, charger, nope, wireless, charger, work, nexus, coil, make, happy], [think, go, amount, surprise, foremost, charge, usb, method, samsung, cable, try, truck, charge, slide, unitbr, br, recommend, unit], [work, awesome, get], [samsung, activebr, work, look, well, make, get, home, phone, couldnt, fit, better, perfect], [product], [charge, amaze, couple, time, came, lose, night, didnt, realize, woke, dead, phone, thats, fault, fault, qi, charger, find, price, wish, work, otterbox, case], [wireless, charge, stand, work, fine, charge, charger, fast, charge, however, reason, complaint, coil, whine, phone, charge, issue, put, charge, stand, sleeping, coil, whine, apparent, coil, whine, affect, performance, way, end, recommend, put, bedroom], [galaxy, edge, thing, work, case, phone, complaint, oem, charger], [kill, overnight, charge, disappoint, beta, charge, pick, phone, go, make, wonder, charging, need, plug, awhile, st, dunno, work, charge, thru, case, bluetooth, charge, capability, note, etcold, phone, didnt, bt, charge, production]]","[[wireless coil nexus phone charger work purchase charger nexus upgrade nexus phablet think purchase wireless charger nope wireless charger work nexus coil make happy, 0.5335, 5], [think go amount surprise foremost charge usb method samsung cable try truck charge slide unitbr br recommend unit, 0.6249, 5], [work awesome get, 0.6249, 5], [samsung activebr work look well make get home phone couldnt fit better perfect, 0.9164, 5], [product, 0.7269, 5], [charge amaze couple time came lose night didnt realize woke dead phone thats fault fault qi charger find price wish work otterbox case, 0.6908, 4], [wireless charge stand work fine charge charger fast charge however reason complaint coil whine phone charge issue put charge stand sleeping coil whine apparent coil whine affect performance way end recommend put bedroom, -0.5106, 4], [galaxy edge thing work case phone complaint oem charger, 0.966, 5], [kill overnight charge disappoint beta charge pick phone go make wonder charging need plug awhile st dunno work charge thru case bluetooth charge capability note etcold phone didnt bt charge production, 0.9097, 5]]"
B00UH8KK5U,"[0.3612, 0.7906]","[4, 5]","[[film, cant, tell, apply], [item, fit, design, state, install, simple, come, screen]]","[[film cant tell apply, 0.3612, 4], [item fit design state install simple come screen, 0.7906, 5]]"
