B00WEL2O0C,"[-0.3785, 0.0, -0.2023, -0.3412, -0.4215, 0.5876, -0.4588, -0.1815, 0.128, 0.0, -0.8225, 0.8258, 0.0, -0.4767, 0.8159, -0.794, -0.25, -0.2411, -0.2263, 0.2263, 0.3724, -0.4767, -0.284, -0.0837, -0.5256]","[2, 1, 2, 2, 1, 1, 1, 2, 1, 1, 1, 4, 2, 1, 1, 1, 1, 1, 3, 5, 1, 1, 1, 1, 1]","[[none, charger, work, disappoint], [cable, stop, work, week, receive], [yes, however, month, use, stop, work, keep, get, error, tell, device, support], [week, use, cord, end, piece, break, phone, short, work, look, quality, nice, braid, reality, worthless], [cord, work, hope, pack, random, fail, love, travel, bc, plug, arent, hotel, bed], [purchaseafter, week, problem, charge, phone, say, phone, support, devicedont, buy], [didnt, cheap, dont, expect], [review, cord, phone, tip, short], [last, week, product], [support, apple, work, dont, buy], [think, length, great, house, differentiate, bright, color, confuses, iphones, ipad, household, charger, walk, coating, seem, weeks, start, get, device, message, phone, stop, charge, coating, start, unravel, part, issue, darn, thing, charge, phone], [work, week, stop, connect], [nice, charger, charge], [cord, darn, cheap, get, pay, return, broke, plug, phone, less, day, yikes], [phone, glitch, plug, use], [work, day, iphone, work, dont], [try, wire, work, work, day], [waste, money, itll, week, top], [chord, didnt, week, quality], [break, dont, buy, unsatisfied], [broke, less, week], [phone, charger, make, drain, battery, taking, phone, charger, metal, piece, broke, cord, get, stuck, phone, disappoint], [use, couple, week, end, go, device, stay, hot, doesnt, charge, device], [order, power, cord, think, theyd, great, college, dorm, loft, bed, use, home, leave, working, say, fine, use, others, week, cord, stop, work, cheap], [take, month, show, cord, didnt, work, box, working, day, use, waste, time, money, well, buy, one, addition, phone, case, charger, work, remove, otter, box, time, charge, phone, star, review, fake]]","[[none charger work disappoint, -0.3785, 2], [cable stop work week receive, 0.0, 1], [yes however month use stop work keep get error tell device support, -0.2023, 2], [week use cord end piece break phone short work look quality nice braid reality worthless, -0.3412, 2], [cord work hope pack random fail love travel bc plug arent hotel bed, -0.4215, 1], [purchaseafter week problem charge phone say phone support devicedont buy, 0.5876, 1], [didnt cheap dont expect, -0.4588, 1], [review cord phone tip short, -0.1815, 2], [last week product, 0.128, 1], [support apple work dont buy, 0.0, 1], [think length great house differentiate bright color confuses iphones ipad household charger walk coating seem weeks start get device message phone stop charge coating start unravel part issue darn thing charge phone, -0.8225, 1], [work week stop connect, 0.8258, 4], [nice charger charge, 0.0, 2], [cord darn cheap get pay return broke plug phone less day yikes, -0.4767, 1], [phone glitch plug use, 0.8159, 1], [work day iphone work dont, -0.794, 1], [try wire work work day, -0.25, 1], [waste money itll week top, -0.2411, 1], [chord didnt week quality, -0.2263, 3], [break dont buy unsatisfied, 0.2263, 5], [broke less week, 0.3724, 1], [phone charger make drain battery taking phone charger metal piece broke cord get stuck phone disappoint, -0.4767, 1], [use couple week end go device stay hot doesnt charge device, -0.284, 1], [order power cord think theyd great college dorm loft bed use home leave working say fine use others week cord stop work cheap, -0.0837, 1], [take month show cord didnt work box working day use waste time money well buy one addition phone case charger work remove otter box time charge phone star review fake, -0.5256, 1]]"
B00WKXOCMM,"[0.6908, 0.6801, 0.6486, 0.9652]","[4, 5, 4, 5]","[[case, nice, fit, glove], [nice, fit], [excellent, great, quality, protect, feel, volume, power, button, perfect, recommend], [nice, color, good, quality, look, say]]","[[case nice fit glove, 0.6908, 4], [nice fit, 0.6801, 5], [excellent great quality protect feel volume power button perfect recommend, 0.6486, 4], [nice color good quality look say, 0.9652, 5]]"
B00WLVGPVY,[0.6249],[5],[[awesome]],"[[awesome, 0.6249, 5]]"
B00WU3W43G,"[0.1536, 0.7783]","[5, 5]","[[update, theyve, improve, magnet, quality, make, complaint, invalid, travel, dock, keep, bag, whenever, rent, car, downside, forget, car, rent, lot, lose, buy, firm, stick, wireless, charge, coil, inside, phone, eliminate, need, metal, pad, attachedbr, br, review, great, vibration, road, make, phone, slide, mount, change, angle, rotation, dont, case, phone, piece, phone, strength, case, good, use, okay, backup, use, vehicle, dont, recommend, primary, solutionbr, br, edit, company, contact, supply, phone, mount, springing, clamp, design, want, appreciate, try, rectify, problem, brand, product, avoid, phone, mount, good, customer, service], [work, fine, phone, tilt, side, bit, phone, case, heavy, fall, otherwise, work, fine]]","[[update theyve improve magnet quality make complaint invalid travel dock keep bag whenever rent car downside forget car rent lot lose buy firm stick wireless charge coil inside phone eliminate need metal pad attachedbr br review great vibration road make phone slide mount change angle rotation dont case phone piece phone strength case good use okay backup use vehicle dont recommend primary solutionbr br edit company contact supply phone mount springing clamp design want appreciate try rectify problem brand product avoid phone mount good customer service, 0.1536, 5], [work fine phone tilt side bit phone case heavy fall otherwise work fine, 0.7783, 5]]"
B00WXFSEDU,"[0.7501, 0.8553, 0.7294, 0.7425, 0.0, 0.34, 0.6369, 0.9664, 0.886, 0.4927, 0.8882, 0.9261, 0.8591, 0.6249, 0.659, 0.915, 0.7906, 0.8481, 0.8882, 0.6115, 0.8519, 0.8481, 0.9169, 0.7717, 0.8553, 0.5994, 0.8221, 0.9545, 0.9072]","[4, 4, 5, 5, 5, 4, 5, 5, 5, 5, 5, 5, 5, 5, 5, 5, 5, 5, 5, 4, 5, 4, 5, 5, 5, 5, 5, 5, 5]","[[purchase, use, weekend, kayak, trip, river, excellent, recommend, anyone, want, use, phone, spending, time, water, keep, phone, safe, dry, submerge], [bag, well, price], [find, case, part, great, buy, issue, fid, fog, upbsome, hot, humidg, climate, submerge, periods, water, felt, test, hand, paper, towel, case, water, longer, period, remain, please, product, people, ask], [case, seem, locking, seal, drop, water, kayak, thing, believe, work, fine], [case, say, use, time, outdoors, garden, boat, operate, iphone, case, take, make, phone, call, isnt, water, resistant, youre, wear, headphone, headphone, cord, keep, close, seal, tight, reservation, lanyard, iphone, doesnt, fall, pocket, bend, phone, swing, lanyard, get, way, tuck, phone, belt, pin, lanyard, shirt, keep, phone, swing, lanyard, recommend, product, people, spend, lot, time], [pink, true, picture, person, bright, hot, pink, oh, work, protect, phone, laughlin, come], [construct, feature, color, true, photo, visibility, beach, gulf, island, seashore, come], [work, percent], [get, happy, take, lot, picture, pool], [case, work, arrive, use, time], [sister, love, case, buy], [work, advertise, product], [service], [handy, case, vacation, didnt, worry, phone, get, wet, water, rid, take, ocean, pool, photo, sound, quality, video, great, wellbr, testing, easy, use, time], [work], [work, afraid, iphone, take, chance, cruise, use, everyday, pic, phone, item, aim, safe, dry], [use, weter, country, usa, williamsburgva, work, champ, wore, slide, wave, pool, water, water, leak, lock, tab, seem, make, cheap, material, see, break, repeat, use, didnt, issue, condensation, end, day, thats, expect, lot, temperature, change, water, air, overall, great, product, price], [bag, seem, price, sure, job, occasion, use, trip, year], [awesome, product, life, saver, beach, goer, carribean, vacation], [product, great, price, happy, ], [use, trip, river, raft, job, color, picture], [case, fit, note, removing, case, problem, use, power, button, side, touchscreen, work, take, lake, past, weekend, photo, video, clear, use, camera, case, im, excite, take, cruise, couple, week, wish, come, purple, make, deciding, factor, neck, strap, release, clip, nice, wrist, strap, interchange, overall, recommend], [buy, go, snorkel, havent, try, try, test, awesome, use, im, fit, samsung, galaxy, case, pouch, make, love], [waterproof, case, want, risk, put, phone, water, anything, say, case, protect, phone, use, water, havent, get, use, lot, meantime, cant, complain], [work, promise, like, buy, present], [give, star, sink, test, pass, fly, color, use, item, intend, vacation], [case, work, arrive, use, vendor, ive, use, time], [awesome, case, great, price, everyone, pool, make, take, picture, phone, didnt, case, ]]","[[purchase use weekend kayak trip river excellent recommend anyone want use phone spending time water keep phone safe dry submerge, 0.7501, 4], [bag well price, 0.8553, 4], [find case part great buy issue fid fog upbsome hot humidg climate submerge periods water felt test hand paper towel case water longer period remain please product people ask, 0.7294, 5], [case seem locking seal drop water kayak thing believe work fine, 0.7425, 5], [case say use time outdoors garden boat operate iphone case take make phone call isnt water resistant youre wear headphone headphone cord keep close seal tight reservation lanyard iphone doesnt fall pocket bend phone swing lanyard get way tuck phone belt pin lanyard shirt keep phone swing lanyard recommend product people spend lot time, 0.0, 5], [pink true picture person bright hot pink oh work protect phone laughlin come, 0.34, 4], [construct feature color true photo visibility beach gulf island seashore come, 0.6369, 5], [work percent, 0.9664, 5], [get happy take lot picture pool, 0.886, 5], [case work arrive use time, 0.4927, 5], [sister love case buy, 0.8882, 5], [work advertise product, 0.9261, 5], [service, 0.8591, 5], [handy case vacation didnt worry phone get wet water rid take ocean pool photo sound quality video great wellbr testing easy use time, 0.6249, 5], [work, 0.659, 5], [work afraid iphone take chance cruise use everyday pic phone item aim safe dry, 0.915, 5], [use weter country usa williamsburgva work champ wore slide wave pool water water leak lock tab seem make cheap material see break repeat use didnt issue condensation end day thats expect lot temperature change water air overall great product price, 0.7906, 5], [bag seem price sure job occasion use trip year, 0.8481, 5], [awesome product life saver beach goer carribean vacation, 0.8882, 5], [product great price happy , 0.6115, 4], [use trip river raft job color picture, 0.8519, 5], [case fit note removing case problem use power button side touchscreen work take lake past weekend photo video clear use camera case im excite take cruise couple week wish come purple make deciding factor neck strap release clip nice wrist strap interchange overall recommend, 0.8481, 4], [buy go snorkel havent try try test awesome use im fit samsung galaxy case pouch make love, 0.9169, 5], [waterproof case want risk put phone water anything say case protect phone use water havent get use lot meantime cant complain, 0.7717, 5], [work promise like buy present, 0.8553, 5], [give star sink test pass fly color use item intend vacation, 0.5994, 5], [case work arrive use vendor ive use time, 0.8221, 5], [awesome case great price everyone pool make take picture phone didnt case , 0.9545, 5], [, 0.9072, 5]]"
B00WXU2F1C,[0.5256],[5],"[[impress, look, quality, order]]","[[impress look quality order, 0.5256, 5]]"
B00WZIPPZ0,[-0.4287],[1],"[[garbage, dont, buy, lose, screw, day, waste, money]]","[[garbage dont buy lose screw day waste money, -0.4287, 1]]"
B00X7OKYXO,[0.6908],[4],"[[graphic, couldve, well, tho, ]]","[[graphic couldve well tho , 0.6908, 4]]"
B00XC6X7L8,[0.0],[5],"[[power, iphone, iphone, ipad, road, trip, wno, issue, none, issue]]","[[power iphone iphone ipad road trip wno issue none issue, 0.0, 5]]"
B00XHBY7DK,[0.228],[5],"[[buy, case, mother, feature, greatest]]","[[buy case mother feature greatest, 0.228, 5]]"
B00XIZ511M,"[-0.4588, 0.8316]","[3, 5]","[[buy, case, son, love, look], [case, make, screen, protector, follow, instruction, get, bubble, remove, screen, saver, use, end, spending, screen, protector, att, store]]","[[buy case son love look, -0.4588, 3], [case make screen protector follow instruction get bubble remove screen saver use end spending screen protector att store, 0.8316, 5]]"
B00XOIF1K4,"[0.6705, 0.6249]","[5, 4]","[[excellent, quality, feel, sturdy, use, basis, recommend, aaa], [universal, device]]","[[excellent quality feel sturdy use basis recommend aaa, 0.6705, 5], [universal device, 0.6249, 4]]"
B00XVTV00Q,"[0.37, 0.8978, 0.3612, 0.6249, 0.6369]","[3, 4, 3, 5, 5]","[[item, wish, magnetics, speaker, louder, battery, life, product, self, solid], [make, sound, im, talk, bucket, im, talk, someone], [bass, headphone, skip, feel, cheap, connect, phone, direction, print, piece, paper, fine, need], [tooth, connection]]","[[item wish magnetics speaker louder battery life product self solid, 0.37, 3], [make sound im talk bucket im talk someone, 0.8978, 4], [bass headphone skip feel cheap connect phone direction print piece paper fine need, 0.3612, 3], [tooth connection, 0.6249, 5], [, 0.6369, 5]]"
B00XZNDOFC,"[0.9377, 0.3612, 0.8126]","[5, 5, 5]","[[expect], [love, case, buy, replace, case, hes, kickstand, watch, moviesvideos, prop, phone, seems, rugged], [case, use, time, hasnt, break, drop, thing, get, case, make, everything, softer, material, push, case, make, phone, fit]]","[[expect, 0.9377, 5], [love case buy replace case hes kickstand watch moviesvideos prop phone seems rugged, 0.3612, 5], [case use time hasnt break drop thing get case make everything softer material push case make phone fit, 0.8126, 5]]"
B00Y090JUI,"[0.7146, 0.6808, 0.9357]","[5, 5, 4]","[[review, star, product, weighs, expect, want, use, charger, time, charge, phone, get, green, version, look, flashlight, isnt, bright, work, product, august, product, price, recommend, youre, consider, buying], [work, champ]]","[[review star product weighs expect want use charger time charge phone get green version look flashlight isnt bright work product august product price recommend youre consider buying, 0.7146, 5], [work champ, 0.6808, 5], [, 0.9357, 4]]"
B00Y0I897Y,[-0.2068],[4],"[[add, grip, iphone, dont, fit, corner, leave, gap, doesnt, everything]]","[[add grip iphone dont fit corner leave gap doesnt everything, -0.2068, 4]]"
B00Y9M4E8Y,[-0.4215],[2],"[[broke, try, cheap, craftsmanship]]","[[broke try cheap craftsmanship, -0.4215, 2]]"
B00YMDWPT0,[0.6794],[5],"[[install, look, make]]","[[install look make, 0.6794, 5]]"
B00Z0ME5EU,"[0.1506, -0.7558, -0.6486]","[1, 3, 1]","[[love, fact], [cant, keep, eari, use, bluetooth, time, d, wish, buy], [pink, dead, arrival, charge]]","[[love fact, 0.1506, 1], [cant keep eari use bluetooth time d wish buy, -0.7558, 3], [pink dead arrival charge, -0.6486, 1]]"
B00Z57YKP4,"[0.9201, 0.7172, 0.1779, -0.6293, 0.0, -0.875, 0.0, 0.9042]","[5, 4, 2, 1, 4, 1, 5, 4]","[[bluetooth, v, good, volume, clarity, excellent, product], [sound, quality, excellent, engineering, onoff, button, use, location, place, body, need, remove, device, push, button, use, phone, answer, make, call, earpiece, secure, fell, rate, star], [month, sound, start, get, crackley, people, start, complain, sound, talking, water], [pricei, recommend, produce], [receive, product, delivery, delay, issue, carrier, ups, indication, issue, email, text, inform, progress, thanks, amazon, primebr, br, open, package, note, instruction, booklet, write, point, text, idea, shortbr, get, bluetooth, connect, found, magnifying, glassbr, br, connect, answer, call, person, end, line, hear, highpitched, whine, shout, home, office, hand, hear, nothing, whine, anything, include, voice, try, switch, dis, reconnecting, bluetooth, button, arent, option, hopebr, br, return], [work], [start, use], [excellent, bluetooth, friend, think, talk, home, phone, im, truck, driver, noise, reduction, unit, amaze, recommend]]","[[bluetooth v good volume clarity excellent product, 0.9201, 5], [sound quality excellent engineering onoff button use location place body need remove device push button use phone answer make call earpiece secure fell rate star, 0.7172, 4], [month sound start get crackley people start complain sound talking water, 0.1779, 2], [pricei recommend produce, -0.6293, 1], [receive product delivery delay issue carrier ups indication issue email text inform progress thanks amazon primebr br open package note instruction booklet write point text idea shortbr get bluetooth connect found magnifying glassbr br connect answer call person end line hear highpitched whine shout home office hand hear nothing whine anything include voice try switch dis reconnecting bluetooth button arent option hopebr br return, 0.0, 4], [work, -0.875, 1], [start use, 0.0, 5], [excellent bluetooth friend think talk home phone im truck driver noise reduction unit amaze recommend, 0.9042, 4]]"
B00ZRGN7NY,[0.6249],[5],[[awesome]],"[[awesome, 0.6249, 5]]"
B00ZTVVVNK,[0.431],[5],"[[product, lose, remote, purchase]]","[[product lose remote purchase, 0.431, 5]]"
B00ZVI6SPW,[0.3291],[3],"[[scratch, okay]]","[[scratch okay, 0.3291, 3]]"
B00ZW90T96,[0.0],[5],"[[arrive, describe]]","[[arrive describe, 0.0, 5]]"
B00ZX1L7XK,"[0.9337, 0.8955]","[5, 4]","[[look, wallet, stay, close, w, credit, card, purchase, case, brighter, color, choicesbr, give, star, phone, case, detach, wallet, cumbersome, speak, hold, whole, wallet, credit, card, earbr, suggestion, make, wallet], [phone, wallet, case, hold, need, phone, fit, edge, screen, fact, card, divider, use, phone, noone, see, card, tend, wallet, keep, bare, mimimun, close, card, slot, limit, cash, love, plum, color, order]]","[[look wallet stay close w credit card purchase case brighter color choicesbr give star phone case detach wallet cumbersome speak hold whole wallet credit card earbr suggestion make wallet, 0.9337, 5], [phone wallet case hold need phone fit edge screen fact card divider use phone noone see card tend wallet keep bare mimimun close card slot limit cash love plum color order, 0.8955, 4]]"
B0106YHXLI,[0.6369],[5],"[[case, come, color]]","[[case come color, 0.6369, 5]]"
B01088CEJS,[0.9577],[4],"[[use, tracker, keep, tab, child, nanny, charge, trax, unit, night, tuck, organizerconsole, stroller, morning, love, know, time, use, app, iphone, enjoy, check, whereabouts, instantlybr, glitch, reading, pick, error, random, read, mile, record, reading, street, assume, something, cell, tower, satellite, coverage, use, week, day, seem, work, consider, childtracking, gps, unit, cost, month, cell, phone, bill, month, service, include, device, great, value, recommend, parent, like, know, child, day, whereabouts, device, nestcams, feel, connect, day, office]]","[[use tracker keep tab child nanny charge trax unit night tuck organizerconsole stroller morning love know time use app iphone enjoy check whereabouts instantlybr glitch reading pick error random read mile record reading street assume something cell tower satellite coverage use week day seem work consider childtracking gps unit cost month cell phone bill month service include device great value recommend parent like know child day whereabouts device nestcams feel connect day office, 0.9577, 4]]"
B010G43VAU,"[0.2177, -0.5106, 0.8095]","[2, 1, 4]","[[advertise, toughest, earth, own, le, month, use, dozen, time, light, connector, rip, shroud, shear, force, render, useless, fact, cable, bend, mean, force, induce, lightning, connector, idevice, move, charge, putting, strain, connectori, think, there, engineer, work, improve, design], [piece, garbage, way, heavy, charge, tip, broke, day, waste, money], [super, piss, break, came, mail, yesterday, im, didnt, break, inside, phone, want, something, forever, iphone, cord, break, edit, want, work, opt, get, think, make, choice, customer, service, seem, lot, sturdy, try, update, month, see, work, work, get, iphone, deal, apple, cord]]","[[advertise toughest earth own le month use dozen time light connector rip shroud shear force render useless fact cable bend mean force induce lightning connector idevice move charge putting strain connectori think there engineer work improve design, 0.2177, 2], [piece garbage way heavy charge tip broke day waste money, -0.5106, 1], [super piss break came mail yesterday im didnt break inside phone want something forever iphone cord break edit want work opt get think make choice customer service seem lot sturdy try update month see work work get iphone deal apple cord, 0.8095, 4]]"
B010HDLBJS,[0.0],[5],"[[luv, android]]","[[luv android, 0.0, 5]]"
B010OX42WO,[0.6249],[5],"[[fitbit, charge, arrive]]","[[fitbit charge arrive, 0.6249, 5]]"
B010Q1AH4G,[-0.2411],[1],"[[order, red, got, pink, cool, son]]","[[order red got pink cool son, -0.2411, 1]]"
B010SLPMR6,[0.0],[2],"[[case, look, decent, wont, middle, insert]]","[[case look decent wont middle insert, 0.0, 2]]"
B011RADD0U,[-0.4215],[1],"[[complicate, put, broke, day, get]]","[[complicate put broke day get, -0.4215, 1]]"
B0129WDT0Y,"[0.836, 0.0772]","[5, 3]","[[perfect, color], [like, color, case, difficult, wallet, compartment, cover, remove, order, charge, phone]]","[[perfect color, 0.836, 5], [like color case difficult wallet compartment cover remove order charge phone, 0.0772, 3]]"
B0131KQ4H8,"[0.9872, 0.8467, 0.4404]","[5, 4, 4]","[[seems, work, look, design, look, awesome, screen, unprotected, there, case, cover], [purchase, case, galaxy, edge, happy, return, look, case, decide, trybr, case, arrive, daysbr, put, case, edge, phone, bit, tricky, snug, screen, protector, get, case, fit, glove, look, phonebr, feel, hand, case, doesnt, functionality, edge, screen, rubberize, texture, give, grip, give, feel, security, wont, slip, hand, purchase, red, casebr, case, look, stun, contribute, appearance, looking, phonebr, case, recommend], [note, thing, slippery, phone, slim, sturdy, good, quality, time, delivery, try, get, less, case, manufacture]]","[[seems work look design look awesome screen unprotected there case cover, 0.9872, 5], [purchase case galaxy edge happy return look case decide trybr case arrive daysbr put case edge phone bit tricky snug screen protector get case fit glove look phonebr feel hand case doesnt functionality edge screen rubberize texture give grip give feel security wont slip hand purchase red casebr case look stun contribute appearance looking phonebr case recommend, 0.8467, 4], [note thing slippery phone slim sturdy good quality time delivery try get less case manufacture, 0.4404, 4]]"
B013OCZEXI,[0.7165],[4],"[[case, nice, make, charge, port, hole, fit, charger, pull, phone, charge]]","[[case nice make charge port hole fit charger pull phone charge, 0.7165, 4]]"
