1908510986,[0.6249],[5],"[[work, great]]","[[work great, 0.6249, 5]]"
B0002EXJJ8,[0.4404],[4],[[product]],"[[product, 0.4404, 4]]"
B001JM1L5Q,[0.6249],[5],"[[work, great]]","[[work great, 0.6249, 5]]"
B002ACFWB8,[0.0],[5],[[work]],"[[work, 0.0, 5]]"
B003TZGYKI,[0.5719],[5],"[[excellent, product]]","[[excellent product, 0.5719, 5]]"
B0042U9AT6,"[0.6369, 0.2732]","[5, 5]","[[seems, work, child, homework]]","[[seems work child homework, 0.6369, 5], [, 0.2732, 5]]"
B0046HHMBS,[0.9022],[5],"[[fit, great, look, well, person]]","[[fit great look well person, 0.9022, 5]]"
B005K7JLBM,[0.6249],[1],[[product]],"[[product, 0.6249, 1]]"
B006J4FZTW,[0.9349],[5],"[[arrive, shape, board, work, library, dont, forget, make, baud, rate, select, serial, monitor, correct, understand, define, ip, settingsbr, select, board, cheapies, malfunction, return, day, frustration, save, time, effort, spend, bit, choice, get, connectivity, project, tip, shield, pin, arrive, alignment, flip, arduino, use, cluster, female, connector, align, shield, pin, group, flip, shield, try, ease, pin, arduino, connector]]","[[arrive shape board work library dont forget make baud rate select serial monitor correct understand define ip settingsbr select board cheapies malfunction return day frustration save time effort spend bit choice get connectivity project tip shield pin arrive alignment flip arduino use cluster female connector align shield pin group flip shield try ease pin arduino connector, 0.9349, 5]]"
B006X387ZS,"[0.0, 0.6249, -0.3626, 0.0772]","[5, 4, 5, 5]","[[work, mount, motorcycle, handlebar, complaint], [work, great], [want], [thing, motorcycle]]","[[work mount motorcycle handlebar complaint, 0.0, 5], [work great, 0.6249, 4], [want, -0.3626, 5], [thing motorcycle, 0.0772, 5]]"
B007NFI656,"[0.9304, 0.0129, 0.4215, 0.2732]","[5, 3, 3, 5]","[[work], [clip, cellphone, wont, difficulty, finding, easy, manipulate, grip, case, carry, seem], [sorta, jinky, price, ok], [quality, mine, piece, keep, fall, stretch]]","[[work, 0.9304, 5], [clip cellphone wont difficulty finding easy manipulate grip case carry seem, 0.0129, 3], [sorta jinky price ok, 0.4215, 3], [quality mine piece keep fall stretch, 0.2732, 5]]"
B007P4Y12M,[0.872],[5],"[[level, system, work, level, x, square, stone, tile, recommend, thinker, mortar, bed, room, selflevel, use, notch, try, keep, wet, edge, tile, wont, level, tile, set, wet, squeeze, tighten, tool, hold, result, squeeze, strap, trowel, tile]]","[[level system work level x square stone tile recommend thinker mortar bed room selflevel use notch try keep wet edge tile wont level tile set wet squeeze tighten tool hold result squeeze strap trowel tile, 0.872, 5]]"
B007T2PDN6,[-0.2874],[2],"[[get, pay, wish, spent, extra, money, quality]]","[[get pay wish spent extra money quality, -0.2874, 2]]"
B0084CCN2Y,"[-0.4767, 0.8519]","[1, 5]","[[product, recommend], [poor, quality]]","[[product recommend, -0.4767, 1], [poor quality, 0.8519, 5]]"
B008KEPUQC,[0.765],[5],"[[buy, boyfriend, went, love, feature, youre, hike]]","[[buy boyfriend went love feature youre hike, 0.765, 5]]"
B008OJ8H36,[0.8381],[4],"[[case, quality, last, drop, time, drop, phone, crack, didnt, work, need, work, perfect]]","[[case quality last drop time drop phone crack didnt work need work perfect, 0.8381, 4]]"
B00974L2PC,"[0.8481, 0.4927, 0.6249, 0.0]","[5, 4, 5, 1]","[[describe, order, iphone, case, got, iphone], [awesome, great, deal]]","[[describe order iphone case got iphone, 0.8481, 5], [awesome great deal, 0.4927, 4], [, 0.6249, 5], [, 0.0, 1]]"
B009WTXB5G,[0.3612],[4],"[[come, time]]","[[come time, 0.3612, 4]]"
B009ZKR52C,[-0.5777],[2],"[[buy, product, seller, fizzle, returning, material, weak, case]]","[[buy product seller fizzle returning material weak case, -0.5777, 2]]"
B00A6UPWNY,[0.7496],[5],"[[make, product]]","[[make product, 0.7496, 5]]"
B00AJR2UJ8,[0.3612],[5],[[appears]],"[[appears, 0.3612, 5]]"
B00B20M8S4,"[0.707, 0.0772]","[1, 1]","[[garmin, didnt, give, quality, product, own, year, use, anymore, own, training, collar, work, year, dogdog, train, bought, vizslalab, mix, puppymonths, open, seem, decent, material, garmin, know, operation, set, mode, function, need, carry, study, detail, remember, mode, model, own, use, functionsmode, label, transmitter, make, bark, mode, doesnt, work, bark, collar, adjustment, doesnt, sense, dog, bark, lot, time, make, useless, purpose, mention, others, life, slow, charge, transmitter, receiver, need, plan, use, night, recharge, unit, forget, charge, go, replace, battery, field, unit, time, field, take, dog, mountain, dog, jump, water, dog, problem, unit, work, go, deeper, garmin, say, handle, hand, transmitter, receiver, dog, wear, sure, need, improvement, water, resistance, call, garmin, good, send, warranty, cant, let, dog, go, water, live, nd, driest, state, stream, river, pond, lakes, take, dog, make, product, look, brand, garmin, disappointment, glad, buy, aftermarket, extend, warranty, market, im, sure, go, need], [unit, april, month, time, collar, battery, last, day, charge, dailybr, recommend, pass, unit, buy, train, dog, keep, yard, hell, need, extension, cord, thats, longersad]]","[[garmin didnt give quality product own year use anymore own training collar work year dogdog train bought vizslalab mix puppymonths open seem decent material garmin know operation set mode function need carry study detail remember mode model own use functionsmode label transmitter make bark mode doesnt work bark collar adjustment doesnt sense dog bark lot time make useless purpose mention others life slow charge transmitter receiver need plan use night recharge unit forget charge go replace battery field unit time field take dog mountain dog jump water dog problem unit work go deeper garmin say handle hand transmitter receiver dog wear sure need improvement water resistance call garmin good send warranty cant let dog go water live nd driest state stream river pond lakes take dog make product look brand garmin disappointment glad buy aftermarket extend warranty market im sure go need, 0.707, 1], [unit april month time collar battery last day charge dailybr recommend pass unit buy train dog keep yard hell need extension cord thats longersad, 0.0772, 1]]"
B00BLQA9BM,[0.5994],[5],"[[need, install, super, pricing]]","[[need install super pricing, 0.5994, 5]]"
B00BOEOHKK,"[0.4404, 0.0, 0.0]","[5, 1, 2]","[[heat, phone, couldnt, pick], [everyone, dont, get, product, doesnt, work, time, put, bulk, heat, phone]]","[[heat phone couldnt pick, 0.4404, 5], [everyone dont get product doesnt work time put bulk heat phone, 0.0, 1], [, 0.0, 2]]"
B00BUBEJCS,[0.0],[2],[[look]],"[[look, 0.0, 2]]"
B00C2HQWYW,[0.0],[5],[[excelent]],"[[excelent, 0.0, 5]]"
B00C694JGE,[0.8883],[5],"[[put, case, fit, ipod, gen, glove, simple, clip, work, surface, case, give, something, grip, isnt, slippery, touch, part, drop, absorb, shock, dent, ipod, case, money]]","[[put case fit ipod gen glove simple clip work surface case give something grip isnt slippery touch part drop absorb shock dent ipod case money, 0.8883, 5]]"
B00C967AUG,"[-0.1027, -0.5367]","[1, 2]","[[last, couple, monthsbut, price, cant], [didnt, work, expect, figure, charge, usage]]","[[last couple monthsbut price cant, -0.1027, 1], [didnt work expect figure charge usage, -0.5367, 2]]"
B00CC4QLKU,[0.5719],[5],[[excellent]],"[[excellent, 0.5719, 5]]"
B00CLBFT3Y,[-0.2755],[1],"[[didnt, fit]]","[[didnt fit, -0.2755, 1]]"
B00CNMDYZQ,[0.5859],[4],[[hand]],"[[hand, 0.5859, 4]]"
B00CPACP24,[0.296],[4],[[ok]],"[[ok, 0.296, 4]]"
B00CRASMWY,[0.9524],[5],"[[yes, know, time, antiquate, c, phone, lucky, cover, mood, strike, switch, cover, cherry, blossom]]","[[yes know time antiquate c phone lucky cover mood strike switch cover cherry blossom, 0.9524, 5]]"
B00CXZIAHA,[-0.4939],[1],"[[product, stop, charge, battery, faulty, month, use]]","[[product stop charge battery faulty month use, -0.4939, 1]]"
B00D7XNQHG,"[0.3612, 0.0, 0.765, 0.0, 0.3832]","[5, 5, 5, 3, 4]","[[describe, spend, money, something, bend], [stuff, say, excellent, price], [ez, use], [expect], [met, need, use, tool, need, quality, fine, expect, use]]","[[describe spend money something bend, 0.3612, 5], [stuff say excellent price, 0.0, 5], [ez use, 0.765, 5], [expect, 0.0, 3], [met need use tool need quality fine expect use, 0.3832, 4]]"
B00DNKOO7E,"[-0.3197, 0.6249]","[4, 5]","[[ship, product, great], [tuff, stand, abuse]]","[[ship product great, -0.3197, 4], [tuff stand abuse, 0.6249, 5]]"
B00DWFHH56,[0.8685],[5],"[[get, yesterday, fit, phone, describe, love, buy]]","[[get yesterday fit phone describe love buy, 0.8685, 5]]"
B00E4WZZQY,[0.0],[1],"[[wasnt, correct, cover, phone]]","[[wasnt correct cover phone, 0.0, 1]]"
B00EMY2968,"[0.0, 0.0]","[1, 4]","[[last, year, outlast, wife, case]]","[[last year outlast wife case, 0.0, 1], [, 0.0, 4]]"
B00EXMM1HG,"[0.8934, 0.2579]","[5, 1]","[[clip, stretch, cause, fall, garmin, try, reattach, clip, fall, hassle, time, want, use, gps], [product, great, price, deliverd, promise]]","[[clip stretch cause fall garmin try reattach clip fall hassle time want use gps, 0.8934, 5], [product great price deliverd promise, 0.2579, 1]]"
B00EZ8E554,[-0.6901],[1],"[[buy, wife, look, hour, start, damn, bead, peel, bead, get, stuck, face, hand, everything, product, price, nod]]","[[buy wife look hour start damn bead peel bead get stuck face hand everything product price nod, -0.6901, 1]]"
B00EZK92EQ,[0.6249],[4],"[[color, sturdy]]","[[color sturdy, 0.6249, 4]]"
B00F2GR5PA,[0.1406],[4],"[[meet, desire, expectation, delivery, take, time]]","[[meet desire expectation delivery take time, 0.1406, 4]]"
B00F52U0U8,"[0.9382, 0.5251]","[5, 4]","[[speaker, battery, last, light, weight, store, finish, recommend, speaker, buyer], [expect, think, louder]]","[[speaker battery last light weight store finish recommend speaker buyer, 0.9382, 5], [expect think louder, 0.5251, 4]]"
B00F5GUSE2,"[-0.5367, 0.7496]","[1, 5]","[[screen, work, dissapointed, waste, money], [install, take, minute, find, right, size, tool, product, make, gps, look, brand]]","[[screen work dissapointed waste money, -0.5367, 1], [install take minute find right size tool product make gps look brand, 0.7496, 5]]"
B00F94NKZE,[0.5719],[5],"[[purchase, daughter, love]]","[[purchase daughter love, 0.5719, 5]]"
B00FD4J0LI,"[-0.5095, -0.5423, -0.3818, 0.3612]","[1, 1, 1, 1]","[[crap, dont, buy], [phone, turn, hit, miss, come, discount, battery, installing, sooner, lose, window, returnbr, br, ny, sticker, find, allbr, br, attach, link, give, battery, see, cycle, count, wish, wait, disappoint, productbr, br, httpswwwyoutubecomwatchvqoozzettro], [hold, charge, battery], [time, im, order, month, wont, hold, charge, hour, see, get, oct, th, order, recommend, anyone, buy, real, battery, apple]]","[[crap dont buy, -0.5095, 1], [phone turn hit miss come discount battery installing sooner lose window returnbr br ny sticker find allbr br attach link give battery see cycle count wish wait disappoint productbr br httpswwwyoutubecomwatchvqoozzettro, -0.5423, 1], [hold charge battery, -0.3818, 1], [time im order month wont hold charge hour see get oct th order recommend anyone buy real battery apple, 0.3612, 1]]"
B00FEKL0M8,[0.2617],[4],"[[speaker, work, little, rust, couple, screw, decent, use]]","[[speaker work little rust couple screw decent use, 0.2617, 4]]"
B00FH9I0EM,[0.9022],[5],"[[perfect, perfect, perfect]]","[[perfect perfect perfect, 0.9022, 5]]"
B00G3PLUQE,"[0.6369, -0.4159, 0.6801, 0.7506]","[5, 1, 5, 5]","[[wish, hole, camera, flip, edit, realize, reason, phone, get, connectivity, wifi, case, take, case, problems, case, issue, stay, connect, wifi], [amaze, price, simplicity, phone, shellbr, br, remove, g, replace, feature, turn, screen, screen, close, work], [nice, feel, slim, case, lot], [work, charm]]","[[wish hole camera flip edit realize reason phone get connectivity wifi case take case problems case issue stay connect wifi, 0.6369, 5], [amaze price simplicity phone shellbr br remove g replace feature turn screen screen close work, -0.4159, 1], [nice feel slim case lot, 0.6801, 5], [work charm, 0.7506, 5]]"
B00G5J5RH6,[0.6808],[1],"[[sad, rate, sit, type, borrow, phone, mine, wasruined, water, use, th, time, use, take, kid, water, park, perfect, time, time, nothing, refer, people, park, happen, patch, costing, couple, hundred, dollar, work]]","[[sad rate sit type borrow phone mine wasruined water use th time use take kid water park perfect time time nothing refer people park happen patch costing couple hundred dollar work, 0.6808, 1]]"
B00GLMOEO4,[0.4201],[5],"[[fit, snug, look, feel, case, light, weight, deliver, way, delivery, date]]","[[fit snug look feel case light weight deliver way delivery date, 0.4201, 5]]"
B00GQPKFZS,[0.7227],[4],"[[case, bulky, excellent, job, protect, phone]]","[[case bulky excellent job protect phone, 0.7227, 4]]"
B00GS1FFBY,[-0.1938],[2],"[[nice, case, week, pink, border, start, rip, wouldnt, recommend, buy]]","[[nice case week pink border start rip wouldnt recommend buy, -0.1938, 2]]"
B00GVGDIII,"[0.2023, 0.7003]","[1, 5]","[[super, shieldz], [shield, glare, phone, last]]","[[super shieldz, 0.2023, 1], [shield glare phone last, 0.7003, 5]]"
B00GZAKT46,"[0.5719, 0.6249]","[5, 5]","[[stocking, stuffer], [excellent, product]]","[[stocking stuffer, 0.5719, 5], [excellent product, 0.6249, 5]]"
B00H2RP9R8,"[0.9402, -0.4767, 0.6808]","[5, 1, 4]","[[bluetooth, people, tell, voice, drop, super, volume, ripoff, go, try, icon, think, voice, recognition, era, cause, problem, disappoint, review], [unit, work, take, extend, road, trip, hour, keep, hand, sound, speaker, work, charger, case, work, recommend, unit, response], [work, great, charger, connect, keyring, earpiece, seem, lose]]","[[bluetooth people tell voice drop super volume ripoff go try icon think voice recognition era cause problem disappoint review, 0.9402, 5], [unit work take extend road trip hour keep hand sound speaker work charger case work recommend unit response, -0.4767, 1], [work great charger connect keyring earpiece seem lose, 0.6808, 4]]"
B00H4G1BIS,[-0.4215],[1],"[[purchase, radio, power, u, sound, come]]","[[purchase radio power u sound come, -0.4215, 1]]"
B00H7OB81W,"[0.0, 0.9062]","[1, 5]","[[case, lot, easier, grip, phone, bit, slippery, fit, look, sleek], [cover, show, moisture]]","[[case lot easier grip phone bit slippery fit look sleek, 0.0, 1], [cover show moisture, 0.9062, 5]]"
B00HFXTO98,[0.9485],[5],"[[love, phone, case, feel, hand, amaze, look]]","[[love phone case feel hand amaze look, 0.9485, 5]]"
B00HWXTZAE,"[0.1779, 0.0]","[5, 5]","[[arrive, time, bought, cure, phone, refusing, chargebr, br, confirm, phone, die, nokia, phonesl, option, main, usb, charge], [work, advertise]]","[[arrive time bought cure phone refusing chargebr br confirm phone die nokia phonesl option main usb charge, 0.1779, 5], [work advertise, 0.0, 5]]"
B00I8AQJMW,[0.7783],[4],"[[nice, see, case, black, letherbr, br, thank]]","[[nice see case black letherbr br thank, 0.7783, 4]]"
B00IEHTVSS,[0.9423],[5],"[[get, plane, ride, son, love, choose, sticker, personalize, sound, quality, great, nd, doesnt, get, loud, perfect, toddler, plane]]","[[get plane ride son love choose sticker personalize sound quality great nd doesnt get loud perfect toddler plane, 0.9423, 5]]"
B00ISECZF8,[0.6249],[4],"[[quality, loking, type, bit, bulkey, flip, phone, case, interfears, camera]]","[[quality loking type bit bulkey flip phone case interfears camera, 0.6249, 4]]"
B00J02W0ZM,"[0.0, 0.5719]","[5, 4]","[[luv, ], [perfect]]","[[luv , 0.0, 5], [perfect, 0.5719, 4]]"
B00J3UM72M,[0.6249],[5],[[product]],"[[product, 0.6249, 5]]"
B00JLCVKE8,"[0.6705, -0.25, 0.7906, 0.6249, 0.6369, 0.6369, -0.4497, -0.357]","[5, 1, 5, 5, 5, 5, 4, 1]","[[charge, phone, love, star, others, failure, mine, day], [save, stave, buy, phone, wait, contract, renewal, cable, connector, galaxy, longer, make, connection, charge, phone, removing, battery, charge, cradle, night, day, month, id, insert, charge, battery, phone, upgrade, galaxy, recommend, charge, cradle], [work, great], [work, allright, week, charge, stand], [charge, cellular, ], [battery, charger, station, pull, socket, month, phone, charger, station, doesnt, charge, buying]]","[[charge phone love star others failure mine day, 0.6705, 5], [save stave buy phone wait contract renewal cable connector galaxy longer make connection charge phone removing battery charge cradle night day month id insert charge battery phone upgrade galaxy recommend charge cradle, -0.25, 1], [work great, 0.7906, 5], [work allright week charge stand, 0.6249, 5], [charge cellular , 0.6369, 5], [battery charger station pull socket month phone charger station doesnt charge buying, 0.6369, 5], [, -0.4497, 4], [, -0.357, 1]]"
B00JLVGC60,[0.7778],[5],"[[nice, case, difficult, get, perfect, samsung, galaxy]]","[[nice case difficult get perfect samsung galaxy, 0.7778, 5]]"
B00JSKC51A,[0.0],[1],"[[work, day, dont, work, wont, charge, phone]]","[[work day dont work wont charge phone, 0.0, 1]]"
B00JWFZ8BK,[0.9501],[4],"[[super, fun, cute, get, lot, compliment, love, card, slot, inside, closure, tab, start, break, month, use]]","[[super fun cute get lot compliment love card slot inside closure tab start break month use, 0.9501, 4]]"
B00K01ZPCC,[0.4019],[5],"[[receive, ohmohm, version, mistake, buy, sub, replace, woofer, yamaha, power, home, audio, sub, scratch, voice, coil, great, job, ooze, quality, outlast, amp]]","[[receive ohmohm version mistake buy sub replace woofer yamaha power home audio sub scratch voice coil great job ooze quality outlast amp, 0.4019, 5]]"
B00K2CKURY,[0.3716],[3],"[[work, cord, use]]","[[work cord use, 0.3716, 3]]"
B00KBT3VII,[0.2732],[1],"[[take, water, start, leak, notice, miss, cover, inside, case, thank, heaven, notice, ruin, phone, notice, phone, water, touch, screen, didnt, respond, cold, hand, cold, water]]","[[take water start leak notice miss cover inside case thank heaven notice ruin phone notice phone water touch screen didnt respond cold hand cold water, 0.2732, 1]]"
B00KFQ04CI,"[0.8885, 0.5106, 0.6249, 0.8594, 0.4215]","[5, 5, 4, 5, 5]","[[im, others, say, time, instal, screen, ask, daughter, overbr, instal, protector, admit, theyre, bit, tricky, line, opening, phone, peel, remove, air, bubble, perfect, wear, tell, there, film, dont, worry, scratch, glass, purse, etc, good, product, think, key, go, took, minute, start], [son, appreciates, protection, took, try], [perfect, fit, went, instruction, plus, book], [nice], [work, great, son, phone]]","[[im others say time instal screen ask daughter overbr instal protector admit theyre bit tricky line opening phone peel remove air bubble perfect wear tell there film dont worry scratch glass purse etc good product think key go took minute start, 0.8885, 5], [son appreciates protection took try, 0.5106, 5], [perfect fit went instruction plus book, 0.6249, 4], [nice, 0.8594, 5], [work great son phone, 0.4215, 5]]"
B00KLMB5HY,[0.0],[1],"[[work, work, week, replace]]","[[work work week replace, 0.0, 1]]"
B00KQ4T0HE,"[0.9586, 0.6249, 0.8126, 0.6249, 0.6249, 0.7906, 0.9916, -0.765, 0.3182, 0.9628, 0.9805, -0.4215, 0.0, 0.899, 0.8122, 0.8834, 0.3182, 0.7569, 0.9719, 0.5178, 0.1921]","[4, 5, 5, 5, 4, 5, 5, 1, 3, 5, 5, 1, 5, 4, 5, 5, 4, 5, 5, 3, 1]","[[slim, protects, phone, slick, hold], [use, separate, armband, case, run, button, time, try, transfer, junk], [buy, phone, case, others, amazon, use, month, warn, bit, drop, phone, time, okay, case, look, fine, order], [case, protect, phone, promise, bought, january, august, volume, power, button, break, make, use, buy, case, month, buying, case], [cheap, case, protect, anything, fragil, get, went, buy, otter, case, worth], [case, iphone, im, write, review, today, drop, foot, land, face, think, something, happen, screen, hit, hard, pleasant, surprise, lip, front, side, save, change, couple, day, case, less, love, slimness, case, sound, quality, playing, music, fact, piece, protection, button, side, buy, friend, look, case], [product, cover, provide, protection, volume, control, work], [happy, case, disappoint, color, picture, black, look, shiny, grey, mislead], [use], [case, unique, easy, install, design, security, fit, snug, button, press, product, recommend], [rubber, side, doesnt, slip, bulky], [case, save, phone, bunch, time, perfect, fit, protect, speaker, water], [awesome, product, work, expect], [case, sturdy, sleak, easy, install], [case, feel, hand, way, sends, sound, phone, buy], [case], [poor, design, button, return, volume, button, get, lost, replacement, last, week, longer, thing, happen], [perfect, case, part, case, create, nice, snug, fit, phone, give, confidence, phone, safe, hole, speaker, great, make, sound, louder, cover, charge, port, add, safety, phone, opinion, perfect, case], [rat, product, star, havent, thing, see, improve, grip, slippery, like], [case, black, finish, ], [slim, encompassing, case, layer, case, aid, impact, drop, love, case, design, amplify, sound, iphones, speaker, nice, touch, ive, own, case, weeks, please, case, allow, hand, grip, slippage]]","[[slim protects phone slick hold, 0.9586, 4], [use separate armband case run button time try transfer junk, 0.6249, 5], [buy phone case others amazon use month warn bit drop phone time okay case look fine order, 0.8126, 5], [case protect phone promise bought january august volume power button break make use buy case month buying case, 0.6249, 5], [cheap case protect anything fragil get went buy otter case worth, 0.6249, 4], [case iphone im write review today drop foot land face think something happen screen hit hard pleasant surprise lip front side save change couple day case less love slimness case sound quality playing music fact piece protection button side buy friend look case, 0.7906, 5], [product cover provide protection volume control work, 0.9916, 5], [happy case disappoint color picture black look shiny grey mislead, -0.765, 1], [use, 0.3182, 3], [case unique easy install design security fit snug button press product recommend, 0.9628, 5], [rubber side doesnt slip bulky, 0.9805, 5], [case save phone bunch time perfect fit protect speaker water, -0.4215, 1], [awesome product work expect, 0.0, 5], [case sturdy sleak easy install, 0.899, 4], [case feel hand way sends sound phone buy, 0.8122, 5], [case, 0.8834, 5], [poor design button return volume button get lost replacement last week longer thing happen, 0.3182, 4], [perfect case part case create nice snug fit phone give confidence phone safe hole speaker great make sound louder cover charge port add safety phone opinion perfect case, 0.7569, 5], [rat product star havent thing see improve grip slippery like, 0.9719, 5], [case black finish , 0.5178, 3], [slim encompassing case layer case aid impact drop love case design amplify sound iphones speaker nice touch ive own case weeks please case allow hand grip slippage, 0.1921, 1]]"
B00KY3BL1K,[0.0],[4],"[[work, describe]]","[[work describe, 0.0, 4]]"
B00L8QE2WW,"[0.91, 0.8885]","[3, 5]","[[nice, case, fit, lg, g, kickstand, part, case, broke, month, case, possession, support, phone, anyway, hardness, case, save, phone, time, make, case, regard, protection, wish, kickstand, placement, strength, consider, make, product], [product, price, sent, number, extra, nice, stylus, screen, protector, want]]","[[nice case fit lg g kickstand part case broke month case possession support phone anyway hardness case save phone time make case regard protection wish kickstand placement strength consider make product, 0.91, 3], [product price sent number extra nice stylus screen protector want, 0.8885, 5]]"
B00LIIH2TU,"[-0.0516, -0.2732]","[2, 2]","[[realize, buy, phone, gave, friend, tell, light, cord, last, weekmaybe, fluke], [color, show, whole, card, end, charge]]","[[realize buy phone gave friend tell light cord last weekmaybe fluke, -0.0516, 2], [color show whole card end charge, -0.2732, 2]]"
B00LMI5QRG,[0.8555],[5],"[[nice, material, good, grip, happy, quality]]","[[nice material good grip happy quality, 0.8555, 5]]"
B00LQA2B8M,"[0.3818, 0.6249]","[1, 5]","[[get, work, return, credit, purchase, pproduct], [work, great]]","[[get work return credit purchase pproduct, 0.3818, 1], [work great, 0.6249, 5]]"
B00M4YLT0U,[-0.5256],[1],"[[error, order, sad, cant, send, box, wish, return]]","[[error order sad cant send box wish return, -0.5256, 1]]"
B00M8YQDM0,[0.0],[5],"[[delivery, expect, order]]","[[delivery expect order, 0.0, 5]]"
B00MJ4NGA6,[-0.296],[1],"[[difficulty, charge, piece, garbage]]","[[difficulty charge piece garbage, -0.296, 1]]"
B00MRTDHAC,[0.0],[4],"[[delivery, item, work, descrbed]]","[[delivery item work descrbed, 0.0, 4]]"
B00MURWYWI,"[-0.2732, 0.5423, 0.8459]","[4, 2, 5]","[[replace, glass, screen, broke, thing, bump, replace, kind], [everything, need, replace, damage, screen, follow, youtube, video, set, connection, delicate], [fast, shipping, screen, seem, work]]","[[replace glass screen broke thing bump replace kind, -0.2732, 4], [everything need replace damage screen follow youtube video set connection delicate, 0.5423, 2], [fast shipping screen seem work, 0.8459, 5]]"
