B00T7M2OY2,"[0.0935, 0.7351, 0.7906]","[2, 4, 5]","[[cheap, plastic, sturdiest, portrait, orientation, want, landscape, swing, tripod, arm, leave, ipad, hang, side, flimsy, mount, im, afraid, ipad, fall, return, item], [hold, tablet, material], [product, mount, use]]","[[cheap plastic sturdiest portrait orientation want landscape swing tripod arm leave ipad hang side flimsy mount im afraid ipad fall return item, 0.0935, 2], [hold tablet material, 0.7351, 4], [product mount use, 0.7906, 5]]"
B00TA38KWS,[-0.296],[1],"[[stop, work, nd, day, ]]","[[stop work nd day , -0.296, 1]]"
B00TEOWSGM,[0.6369],[5],"[[im, store, card, max]]","[[im store card max, 0.6369, 5]]"
B00TIV14K2,"[-0.1406, -0.0516, 0.1045]","[1, 1, 1]","[[knock, work, phone, get, unsuported, device, error, something, plug, apple, store, indicator, false, run], [state, charge, ipads, doesnt, work, ipad], [purchase, say, apple, store, think, charge, phone, say, apple, charge, phone, ipad, disappoint, look]]","[[knock work phone get unsuported device error something plug apple store indicator false run, -0.1406, 1], [state charge ipads doesnt work ipad, -0.0516, 1], [purchase say apple store think charge phone say apple charge phone ipad disappoint look, 0.1045, 1]]"
B00TJ6HN9C,"[0.6474, 0.6249, 0.9601]","[4, 5, 5]","[[day, product], [amaze, everything, perfect, issue, front, camera, isnt, quality, iphone, front, camera, camera, amaze, hd, love], [cell, phone, college, student]]","[[day product, 0.6474, 4], [amaze everything perfect issue front camera isnt quality iphone front camera camera amaze hd love, 0.6249, 5], [cell phone college student, 0.9601, 5]]"
B00U0A3W8M,[0.8402],[5],"[[gel, case, look, stylish, buy, whitecolored, phone, color, show, thru, nice, design, simple, stylish, fit, phone, nice, solid, nice, product]]","[[gel case look stylish buy whitecolored phone color show thru nice design simple stylish fit phone nice solid nice product, 0.8402, 5]]"
B00U5BS1LO,"[0.7003, 0.3612, 0.0516, 0.7783, 0.4215, 0.6369, 0.8016, 0.4767, 0.6249, 0.0, 0.6562, 0.5719, 0.8878]","[5, 5, 3, 3, 4, 5, 4, 4, 5, 5, 5, 5, 5]","[[husband, love], [come, time, expect, job], [case, sturdy, easy, use, provide, protection, samsung, case, sell, phone, store], [case, thanks], [product, sturdy, shock, resistant, time], [nice], [case, belt, clip, crap, break, super], [case, sturdy, come, belt, clip, attachment, product, deliver, package], [need, decent, price], [get, watch, movie, show, hold, lol, thank], [case, work, wellfits, phone, feel, hand, problem, cant, get, phone, lock, belt, holder, phone, case], [yes, thank], [order, product, use, otter, box, year, draw, box, rubber, stretch, overtime, difficulty, latch, belt, clip, point, side, buddibox, rubbery, feel, provides, grip, area, latch, belt, clip, draw, using, month, belt, clip, broke]]","[[husband love, 0.7003, 5], [come time expect job, 0.3612, 5], [case sturdy easy use provide protection samsung case sell phone store, 0.0516, 3], [case thanks, 0.7783, 3], [product sturdy shock resistant time, 0.4215, 4], [nice, 0.6369, 5], [case belt clip crap break super, 0.8016, 4], [case sturdy come belt clip attachment product deliver package, 0.4767, 4], [need decent price, 0.6249, 5], [get watch movie show hold lol thank, 0.0, 5], [case work wellfits phone feel hand problem cant get phone lock belt holder phone case, 0.6562, 5], [yes thank, 0.5719, 5], [order product use otter box year draw box rubber stretch overtime difficulty latch belt clip point side buddibox rubbery feel provides grip area latch belt clip draw using month belt clip broke, 0.8878, 5]]"
B00U7CYSXQ,[0.9798],[5],"[[receive, product, love, case, picture, cover, iphone, silicone, snug, remove, button, get, youre, look, case, get, fan, price, worth]]","[[receive product love case picture cover iphone silicone snug remove button get youre look case get fan price worth, 0.9798, 5]]"
B00UG2M0HI,[0.9042],[5],"[[cable, purchase, looking, cable, one, seem, use, thanks]]","[[cable purchase looking cable one seem use thanks, 0.9042, 5]]"
B00UMIO588,[0.5994],[5],"[[daughter, love]]","[[daughter love, 0.5994, 5]]"
B00UMMD4N6,[0.4877],[5],"[[tendency, break, thing, look, price, fit, bill]]","[[tendency break thing look price fit bill, 0.4877, 5]]"
B00UMZN47Y,"[0.5867, 0.9382]","[1, 5]","[[work, help, lot, tight, space, everything, test, work, perfect, notice, difference, speed, device, read, usb, great, price], [use, macbook, pro, keep, disk, attach, extra, space, angle, make, didnt, stick, fail, connection, disk, order, avoid, corruption, constant, connection, issue, remove, back, connection, usb, stick, id, dont, know, faulty, couldnt, risk, damage]]","[[work help lot tight space everything test work perfect notice difference speed device read usb great price, 0.5867, 1], [use macbook pro keep disk attach extra space angle make didnt stick fail connection disk order avoid corruption constant connection issue remove back connection usb stick id dont know faulty couldnt risk damage, 0.9382, 5]]"
B00UZJY570,"[0.8957, -0.5093, 0.7964, 0.765, 0.765, 0.3559, 0.4404, 0.6249, -0.0644, 0.7935, 0.7727, 0.3612, 0.8519, 0.0, 0.9118, 0.9451, -0.1832, 0.5719, 0.9432, -0.7661, 0.9217, 0.9656, 0.6369, 0.7391]","[5, 5, 5, 4, 4, 3, 5, 5, 5, 5, 1, 5, 5, 5, 4, 5, 4, 5, 5, 2, 5, 5, 5, 5]","[[love, case, fit, galaxy, edge, star, ship, delay], [case, fit, phone, ship, rugged, make, bulky], [outer, case, clip, ok, cover, plastic, cover, dont, fit, quality], [phone, protect, access, edge, look, love, case], [seems, abit, cheap, tight, fit, make, handy, protect, phone], [product, fit, hand, edge, fact, bite, invite, use, edge, consider, accentuates, edge, holster, hook, belt, clip, cant, snatch, bump, feeling, add, attraction, phone, recommend, product, anyone, samsung, galaxy, edge, verus, thor, holster, broke, twice, supcase, well, rugged, feel, con, put, case, phone, pain, take, rubber, effort, oh, work, wireless, charge, pad], [seller, starsbr, product, quality, starsbr, br, bit, difficult, install, cut, case, dont, option, samsung, edge, anyway], [magnificent, clip, fit, phone, side, button, break, thats, thing, book, plug, againit, charge, bluetooth, case, doesnt, effect, bt, charge, buy, yea], [case, protect, phone, otterbox, install, test, drop, hold, tight, value, phone, suggest, buy, cover], [case, rock], [case, great, send, day], [case, hold, work], [cover, headphone, jack, port, speaker, put], [case, love], [feel, rugged, make, protect], [design, edge, make, case, protect, case, trick, screen, protector, need, case, phone, fit, feel, lot, safer, case], [case, look, im, give, star, find, difficult, case, install, phone, get, fit, time, use, belt, clip, case, rip, screen, protector, thing, using, rubber, case, get, galaxy, edge, problem, day, use, supcase, baterry, door, glass, crack, drop, robber, case, spent, dollar, replacement, glass, battery, cover, pay, intallation], [case, slim, phone, case, save, phone, couple, time, get, vena, vsheild, antiscratch, screen, cover, dont, stay, side, edge, case, put, screen, protector, snap, case, edge, screen, protector, hold, case], [product, there, way, plug, usb, otg, flash, memory, use, case], [case, drop, phone, time, issue, thin, case, problem, view, side, bar], [thank, ], [perfect, case], [case, love, sturdy, phone]]","[[love case fit galaxy edge star ship delay, 0.8957, 5], [case fit phone ship rugged make bulky, -0.5093, 5], [outer case clip ok cover plastic cover dont fit quality, 0.7964, 5], [phone protect access edge look love case, 0.765, 4], [seems abit cheap tight fit make handy protect phone, 0.765, 4], [product fit hand edge fact bite invite use edge consider accentuates edge holster hook belt clip cant snatch bump feeling add attraction phone recommend product anyone samsung galaxy edge verus thor holster broke twice supcase well rugged feel con put case phone pain take rubber effort oh work wireless charge pad, 0.3559, 3], [seller starsbr product quality starsbr br bit difficult install cut case dont option samsung edge anyway, 0.4404, 5], [magnificent clip fit phone side button break thats thing book plug againit charge bluetooth case doesnt effect bt charge buy yea, 0.6249, 5], [case protect phone otterbox install test drop hold tight value phone suggest buy cover, -0.0644, 5], [case rock, 0.7935, 5], [case great send day, 0.7727, 1], [case hold work, 0.3612, 5], [cover headphone jack port speaker put, 0.8519, 5], [case love, 0.0, 5], [feel rugged make protect, 0.9118, 4], [design edge make case protect case trick screen protector need case phone fit feel lot safer case, 0.9451, 5], [case look im give star find difficult case install phone get fit time use belt clip case rip screen protector thing using rubber case get galaxy edge problem day use supcase baterry door glass crack drop robber case spent dollar replacement glass battery cover pay intallation, -0.1832, 4], [case slim phone case save phone couple time get vena vsheild antiscratch screen cover dont stay side edge case put screen protector snap case edge screen protector hold case, 0.5719, 5], [product there way plug usb otg flash memory use case, 0.9432, 5], [case drop phone time issue thin case problem view side bar, -0.7661, 2], [thank , 0.9217, 5], [perfect case, 0.9656, 5], [case love sturdy phone, 0.6369, 5], [, 0.7391, 5]]"
B00V66R9I8,[0.8885],[5],"[[case, person, soft, look, recommend, family, member]]","[[case person soft look recommend family member, 0.8885, 5]]"
B00V9PU0N2,"[-0.0138, 0.8481]","[5, 5]","[[get, get, serf, purpose], [perfect, protect, phone, grip]]","[[get get serf purpose, -0.0138, 5], [perfect protect phone grip, 0.8481, 5]]"
B00VKQ0NVO,"[0.0, 0.6115]","[1, 4]","[[case, work, thing, change, button, side, turn, volume, use], [take, effort, get, use, leave, side, screen]]","[[case work thing change button side turn volume use, 0.0, 1], [take effort get use leave side screen, 0.6115, 4]]"
B00VO37JII,[0.0],[3],"[[set, come, apart, didnt, oping]]","[[set come apart didnt oping, 0.0, 3]]"
B00VQFCTHU,[0.9741],[5],"[[case, awesome, lightweight, slim, feel, sturdy, feel, hold, phone, seem, protect, took, case, att, put, phone, rep, help, give, praise, seem, surprise, something, availablebr, br, color, get, attractivea, deep, red, beat, price]]","[[case awesome lightweight slim feel sturdy feel hold phone seem protect took case att put phone rep help give praise seem surprise something availablebr br color get attractivea deep red beat price, 0.9741, 5]]"
B00VTS6P2Y,[0.0772],[2],"[[seems, heavy, duty, appeal, eye, side, button, push, home, screen, button, button, front, phone, take, screenshot]]","[[seems heavy duty appeal eye side button push home screen button button front phone take screenshot, 0.0772, 2]]"
B00VU60N7S,[-0.5122],[4],"[[place, keep, stylus]]","[[place keep stylus, -0.5122, 4]]"
B00VYPV752,[0.7351],[2],"[[way, look, snap, work, credit, card, slot]]","[[way look snap work credit card slot, 0.7351, 2]]"
B00W2UOBOC,"[-0.7906, -0.2263]","[1, 2]","[[stop, work], [order, set, husband, son, cut, lag, watch, youtube, ipod, phone]]","[[stop work, -0.7906, 1], [order set husband son cut lag watch youtube ipod phone, -0.2263, 2]]"
B00W652XAW,"[0.6533, 0.6249, 0.3612, 0.992]","[5, 5, 5, 4]","[[color, place, cart, shimmer, vehicle, paint, give, depth, slim, sleek, make, material, silicone, case, make, way, know, got, case, price, awesome], [admit, im, phone, dropper, drop, phone, time, day, case, let, damage, happen, phone, case, stand, test, tendecies, guess, awesome, case], [case, come, look, wait, order, color, case, device, thank]]","[[color place cart shimmer vehicle paint give depth slim sleek make material silicone case make way know got case price awesome, 0.6533, 5], [admit im phone dropper drop phone time day case let damage happen phone case stand test tendecies guess awesome case, 0.6249, 5], [case come look wait order color case device thank, 0.3612, 5], [, 0.992, 4]]"
B00W7063FW,[-0.566],[2],"[[charge, phone, make, phone, roam, good]]","[[charge phone make phone roam good, -0.566, 2]]"
B00W8DP63I,[0.4404],[4],[[money]],"[[money, 0.4404, 4]]"
B00WARAV3M,"[0.6249, 0.6249]","[5, 5]","[[thing, fit], [case]]","[[thing fit, 0.6249, 5], [case, 0.6249, 5]]"
B00WE1FZM6,"[-0.5242, 0.6249, -0.3566]","[1, 5, 1]","[[sound, price], [sound, isnt, always, noise, earbudis, bluetooth, distanceand, microphone, work], [deserve, star, headphone, piece, fell, use, item, return, item]]","[[sound price, -0.5242, 1], [sound isnt always noise earbudis bluetooth distanceand microphone work, 0.6249, 5], [deserve star headphone piece fell use item return item, -0.3566, 1]]"
B00WHW1Y72,[0.0],[5],"[[work, fast, ship]]","[[work fast ship, 0.0, 5]]"
B00WI8L7UE,"[0.6908, 0.0]","[4, 1]","[[nice, design, easy, protection, rubber, edge, bottom], [color, fade]]","[[nice design easy protection rubber edge bottom, 0.6908, 4], [color fade, 0.0, 1]]"
B00WNQARR0,[0.7814],[3],"[[case, great, holster, come, cant, take, put, phone, holster, hand]]","[[case great holster come cant take put phone holster hand, 0.7814, 3]]"
B00WSJ3TAO,[-0.3101],[3],"[[lose, phone, dont, trust, protect, phone]]","[[lose phone dont trust protect phone, -0.3101, 3]]"
B00X0CGE0U,[-0.1592],[2],"[[case, back, hook, belt, look, glue, came, week, sorry, make]]","[[case back hook belt look glue came week sorry make, -0.1592, 2]]"
B00X53T5C8,[0.7003],[4],"[[buy, case, girlfriend, less, month, start, stain, pocket, purse, case, protects, phone, fine, wish, pink, color]]","[[buy case girlfriend less month start stain pocket purse case protects phone fine wish pink color, 0.7003, 4]]"
B00X6DHQ82,[0.8591],[5],"[[selfie, stick, get, value, extension, simple, use, app]]","[[selfie stick get value extension simple use app, 0.8591, 5]]"
B00XBZNGKC,[0.5984],[5],"[[case, money, wear, back, side]]","[[case money wear back side, 0.5984, 5]]"
B00XPBB0RS,[0.7964],[4],"[[feel, grip]]","[[feel grip, 0.7964, 4]]"
B00XPTSNWK,[0.4404],[5],[[case]],"[[case, 0.4404, 5]]"
B00XQL3HPK,"[0.9382, 0.9274]","[5, 4]","[[case, cute, protect, phone, multiple, fall, complaint, part, become], [case, great, fit, wonderful, color, combo]]","[[case cute protect phone multiple fall complaint part become, 0.9382, 5], [case great fit wonderful color combo, 0.9274, 4]]"
B00XU2HV2K,"[0.6249, 0.5719, 0.5974]","[5, 5, 4]","[[fivestar, color, option, use, asus, apps, email, calendar, message, etc, utilize, circular, window, featurebr, br, reason, product, imo, cover, embeds, nfc, back, cover, replace, flip, cover, view, email, text, calendar, window, side, sacrifice, privacy, read, whatever, window, leave, flip, cover, feature, display, clock, weather, protect, phone, screenbr, br, conclusion, recommend, product, get, transparent, cover, cost, less], [excellent, product]]","[[fivestar color option use asus apps email calendar message etc utilize circular window featurebr br reason product imo cover embeds nfc back cover replace flip cover view email text calendar window side sacrifice privacy read whatever window leave flip cover feature display clock weather protect phone screenbr br conclusion recommend product get transparent cover cost less, 0.6249, 5], [excellent product, 0.5719, 5], [, 0.5974, 4]]"
B00XZGRKY0,"[0.8402, 0.8573, 0.7346]","[5, 3, 5]","[[dont, know, expect, front, expect, arrive, condition, fair, price, find, screen, protector], [cover, phone, look], [recommend, ship]]","[[dont know expect front expect arrive condition fair price find screen protector, 0.8402, 5], [cover phone look, 0.8573, 3], [recommend ship, 0.7346, 5]]"
B00XZP02L4,[0.4703],[5],"[[title, mislead, thought, go, receiving, cord, car, adapter, get, bargain, cord, length, arrive, day, expect]]","[[title mislead thought go receiving cord car adapter get bargain cord length arrive day expect, 0.4703, 5]]"
B00Y2PUZPE,[0.9236],[4],"[[case, quality, doesnt, stand, sideways, break, yet, stylus, quality, youd, get, buy, dollar, store, doesnt, bulk, phone, protect]]","[[case quality doesnt stand sideways break yet stylus quality youd get buy dollar store doesnt bulk phone protect, 0.9236, 4]]"
B00Y4GCP40,[-0.8687],[1],"[[buy, case, cheap, fake, case, somebody, print, print, distort, focus, shane, seller, disappoint]]","[[buy case cheap fake case somebody print print distort focus shane seller disappoint, -0.8687, 1]]"
B00Y6I1QEG,[-0.5423],[1],[[image]],"[[image, -0.5423, 1]]"
B00YGUT11Y,[0.6115],[4],"[[daughter, love, case, expect]]","[[daughter love case expect, 0.6115, 4]]"
B00YMDWDGA,[0.0],[5],[[excelente]],"[[excelente, 0.0, 5]]"
B00YNLCCDK,"[0.3182, -0.6808, 0.0, 0.4195, 0.296, -0.0418, 0.0, -0.2411]","[1, 1, 1, 1, 1, 3, 1, 1]","[[work, charge, kind, sometimes, give, notification, accessory, support, unplug, plug, get, pay, case, price], [stop, work, week, use, save, money], [work, week], [test, cable, wall, charger, apple, brand, charge, time, iphone, hour, iphone, take, hour, charge, use, rope, tie, garbage, bundle, serve, purpose, order, amazon, basic, apple, certify, lightning, usb, use, result, throw, useless, cable, pay, review, cheap, phone], [waiting, month, quit, work, couple, us, pure, crap], [read, review, think, get, awesome, deal, nope, throw, feel, go, get, work, problem, fact, share, wouldnt, recommend], [iphone, ipad, mini, say, accessory, support, cable, charge, stuff], [wont, stay, place, charge, phone]]","[[work charge kind sometimes give notification accessory support unplug plug get pay case price, 0.3182, 1], [stop work week use save money, -0.6808, 1], [work week, 0.0, 1], [test cable wall charger apple brand charge time iphone hour iphone take hour charge use rope tie garbage bundle serve purpose order amazon basic apple certify lightning usb use result throw useless cable pay review cheap phone, 0.4195, 1], [waiting month quit work couple us pure crap, 0.296, 1], [read review think get awesome deal nope throw feel go get work problem fact share wouldnt recommend, -0.0418, 3], [iphone ipad mini say accessory support cable charge stuff, 0.0, 1], [wont stay place charge phone, -0.2411, 1]]"
B00YTWNIH2,"[0.0, 0.6249, 0.8481]","[5, 5, 4]","[[work, intend, ask], [reason, give, star, rating, test, plan, take, sea, kayak, trip, week, test, max, water, leakage, work, swipe, screen, use, button, otherwise, use, phone, pouch, work, gym], [use, item, time, park, work, shoulder]]","[[work intend ask, 0.0, 5], [reason give star rating test plan take sea kayak trip week test max water leakage work swipe screen use button otherwise use phone pouch work gym, 0.6249, 5], [use item time park work shoulder, 0.8481, 4]]"
B00YZO04CQ,"[0.8627, 0.5648, 0.9273]","[5, 5, 5]","[[nice, magnet, fit, slot, make, smart, phone, look, built, navi, system], [device, operate, advertise, increase, utility, iphone, use, waze, problem], [order, cd, slot, car, mount, wife, satisfy, work, magnet, hold, iphone, slippagemovement, hand, placement, removal, design, look, car, excellent, product]]","[[nice magnet fit slot make smart phone look built navi system, 0.8627, 5], [device operate advertise increase utility iphone use waze problem, 0.5648, 5], [order cd slot car mount wife satisfy work magnet hold iphone slippagemovement hand placement removal design look car excellent product, 0.9273, 5]]"
B00ZWWDLKC,[0.2235],[1],"[[light, indicator, charge, malfunction, indicator, stop, blinkin, know, charge]]","[[light indicator charge malfunction indicator stop blinkin know charge, 0.2235, 1]]"
B010D2URFW,[0.8271],[5],"[[monitor, play]]","[[monitor play, 0.8271, 5]]"
B010LUB5VQ,[-0.34],[1],"[[buy, item, day, good, day, day, volume, get, day, stop, work]]","[[buy item day good day day volume get day stop work, -0.34, 1]]"
B010OV8EN4,"[0.0, -0.4767]","[2, 2]","[[case, phone, lg, g, case, show, rest, g, case, refund, story], [half, inch, phone]]","[[case phone lg g case show rest g case refund story, 0.0, 2], [half inch phone, -0.4767, 2]]"
B011270HKW,[-0.6705],[5],"[[impress, look, feel, function, cable, order, foot, cable, pink, thicker, sturdier, cable, include, apple, one, iphone, charge, use, cord, speed, apple, cord, weve, gone, countless, charger, family, order, hoping, color, make, family, member, leave, aroundlose, make, findbr, br, say, try, dozen, brand, cable, year, know, fact, iphone, charger, work, promise, update, review, ones, hold]]","[[impress look feel function cable order foot cable pink thicker sturdier cable include apple one iphone charge use cord speed apple cord weve gone countless charger family order hoping color make family member leave aroundlose make findbr br say try dozen brand cable year know fact iphone charger work promise update review ones hold, -0.6705, 5]]"
B0112Y3ZGS,[0.9269],[5],"[[case, month, amaze, case, look, nice, isnt, pocket, love]]","[[case month amaze case look nice isnt pocket love, 0.9269, 5]]"
B0115IAQGS,"[0.7906, 0.7159]","[5, 4]","[[sound, great, use]]","[[sound great use, 0.7906, 5], [, 0.7159, 4]]"
B0118S8V9Y,"[-0.6604, 0.6361]","[1, 5]","[[way, quality, return, open, explore, feel, cheap, dont, think, color, website], [love, use, wallet, im, purse, know, dont, need, everything, leave, em, car, catch, thir]]","[[way quality return open explore feel cheap dont think color website, -0.6604, 1], [love use wallet im purse know dont need everything leave em car catch thir, 0.6361, 5]]"
B011H4ESBE,[0.5789],[5],"[[look, amazon, appear, selfie, stick, theyre, lame, connection, phone, set, timer, phone, take, worthless, connect, phone, bluetooth, seem, experience, learn, connection, fail, unreliablebr, br, get, ishot, ultra, connects, phone, put, phone, study, holder, youre, good, go, hassle, timer, bluetooth, connection, handle, extends, silicone, grip, keep, control, time, fit, phone, fold, recommend, selfie, stickasinbhesbe, selfie, stick, ishot, ultra, release, wire, compact, handheld, monopod, remote, shutter, lightweight, plug, play, battery, charge, bluetooth, pair, apple, iphone, android, blue]]","[[look amazon appear selfie stick theyre lame connection phone set timer phone take worthless connect phone bluetooth seem experience learn connection fail unreliablebr br get ishot ultra connects phone put phone study holder youre good go hassle timer bluetooth connection handle extends silicone grip keep control time fit phone fold recommend selfie stickasinbhesbe selfie stick ishot ultra release wire compact handheld monopod remote shutter lightweight plug play battery charge bluetooth pair apple iphone android blue, 0.5789, 5]]"
