B00H9B7ALK,"[0.7574, -0.7351, 0.0, 0.9245, 0.7351, 0.8736, 0.7711, 0.6249, 0.2732, 0.6249, 0.8424, 0.4019, 0.6249, 0.7906, 0.7902, -0.0772, 0.6249, 0.5106, 0.6369, 0.8555, 0.4927]","[5, 1, 1, 5, 5, 5, 5, 5, 5, 5, 5, 4, 5, 4, 5, 5, 5, 5, 5, 5, 5]","[[work, nexus, naked, case], [charger, perform, useno, hunt, sweet, spotand, recomend], [itbr, work, samsung, charm], [charger, work, putting, phone, top, charger, charge, beep, sound, confirmbr, fast, charge, snapin, whenever, put, phone, surface, chargebr, try, wireless, charger, end, return, allbr, recommend], [buy, awesome], [work, great, nexus], [thing, doesnt, work], [buy, husband, samsung, us, night, issue, happy, husband, happy, wife], [happy, purchase, thank], [nd, charge, port, stop, work, product], [work, well, try, sammy, sweet, spot, find, charge, area, leather, case, plastic, holster, combine, work, time, hear, beep, confirm, charge, disconnect, sammys, oh, mention, think, go, order, office], [buy, love, convenience], [product, amaze, meet, exceed, expectation, there, thing, want, say, charger, work, otterbox, defender, galaxy, phone, center, pad, work], [product, nexus, micro, usb, connector, break, charge, anymore, look, product, amazon, pick, base, review, price, excellent, result, charge, tablet, start, cover, try, success, charger, sits, corner, desk, nexus, overlap, problem, charger, thin, couple, week], [device, work, problem, allbr, recomend, family, friend], [google, nexus, charge, case], [work, great, wire, charger, buy, work, home, work, convenient], [thick, case, galaxy, edge, charger, work, case, place, phone, charge, pad, pad, beep, bit, phone, touch, think, work, case, use, try, couple, wireless, charger, disappoint, good, im, think, buying, keep, work], [charge, good, slim, use, lg, g, charge, proficient, rate], [charger, work, list, doesnt, build, heat, way, turn, blink, charge, light, night], [work, great]]","[[work nexus naked case, 0.7574, 5], [charger perform useno hunt sweet spotand recomend, -0.7351, 1], [itbr work samsung charm, 0.0, 1], [charger work putting phone top charger charge beep sound confirmbr fast charge snapin whenever put phone surface chargebr try wireless charger end return allbr recommend, 0.9245, 5], [buy awesome, 0.7351, 5], [work great nexus, 0.8736, 5], [thing doesnt work, 0.7711, 5], [buy husband samsung us night issue happy husband happy wife, 0.6249, 5], [happy purchase thank, 0.2732, 5], [nd charge port stop work product, 0.6249, 5], [work well try sammy sweet spot find charge area leather case plastic holster combine work time hear beep confirm charge disconnect sammys oh mention think go order office, 0.8424, 5], [buy love convenience, 0.4019, 4], [product amaze meet exceed expectation there thing want say charger work otterbox defender galaxy phone center pad work, 0.6249, 5], [product nexus micro usb connector break charge anymore look product amazon pick base review price excellent result charge tablet start cover try success charger sits corner desk nexus overlap problem charger thin couple week, 0.7906, 4], [device work problem allbr recomend family friend, 0.7902, 5], [google nexus charge case, -0.0772, 5], [work great wire charger buy work home work convenient, 0.6249, 5], [thick case galaxy edge charger work case place phone charge pad pad beep bit phone touch think work case use try couple wireless charger disappoint good im think buying keep work, 0.5106, 5], [charge good slim use lg g charge proficient rate, 0.6369, 5], [charger work list doesnt build heat way turn blink charge light night, 0.8555, 5], [work great, 0.4927, 5]]"
B00HKTNXMG,[0.6249],[5],"[[product, seller]]","[[product seller, 0.6249, 5]]"
B00HNT5ZYW,"[0.8746, 0.5719]","[5, 4]","[[im, amazon, struggle, navigating, find, picture, phone, case, product, thrill, case, iphone, theyre, endanger, specie, thank], [get, case, love, color, look, phone, love, came, mail]]","[[im amazon struggle navigating find picture phone case product thrill case iphone theyre endanger specie thank, 0.8746, 5], [get case love color look phone love came mail, 0.5719, 4]]"
B00HWLWEKY,[0.069],[5],"[[need, loud, nice, clear]]","[[need loud nice clear, 0.069, 5]]"
B00HZCPYGG,[0.0],[5],"[[handiest, thing]]","[[handiest thing, 0.0, 5]]"
B00IKFTNJQ,[0.9042],[5],"[[phone, case, came, ship, israel]]","[[phone case came ship israel, 0.9042, 5]]"
B00IUQ2XAQ,"[0.9735, 0.8604]","[5, 1]","[[excellent, product, attach, work, phone, surface, excellent, addition, great, phone, samsung], [purchase, aduro, shatterguardz, iphones, galaxy, fit, phone, screen, screen, protect, try, glass, protector, werent, apply, left, bubble, purchase, iphone, purchase, shatterguardz, surprise, find, thinner, product, cover, entire, screen, leave, screen, unprotected, imagine, protect, scratch, way, protect, iphone, screen, crack, aduro, offer, iphone, contact, aduro, customer, service, couldnt, appropriate, response, instruction, return, product, im]]","[[excellent product attach work phone surface excellent addition great phone samsung, 0.9735, 5], [purchase aduro shatterguardz iphones galaxy fit phone screen screen protect try glass protector werent apply left bubble purchase iphone purchase shatterguardz surprise find thinner product cover entire screen leave screen unprotected imagine protect scratch way protect iphone screen crack aduro offer iphone contact aduro customer service couldnt appropriate response instruction return product im, 0.8604, 1]]"
B00J2FHXGS,[0.9599],[4],"[[case, love, belt, clip, drop, phone, couple, time, take, pride, seem, sturdy, issue, kickstand, time, easiest, pop, sure, get, looser, gotten, well, time, break, accident, twice, part, back, pop, awesome, case, belt, clip, case]]","[[case love belt clip drop phone couple time take pride seem sturdy issue kickstand time easiest pop sure get looser gotten well time break accident twice part back pop awesome case belt clip case, 0.9599, 4]]"
B00J7QNFTQ,[0.807],[5],"[[perfect, product, seller, honest, product, quality]]","[[perfect product seller honest product quality, 0.807, 5]]"
B00JCFETQ0,[0.3716],[4],"[[case, great, remove, phone, snap, hold, phone, keep, break]]","[[case great remove phone snap hold phone keep break, 0.3716, 4]]"
B00JGIHC5I,[-0.2924],[1],"[[drop, day, protect, phone]]","[[drop day protect phone, -0.2924, 1]]"
B00JH88O72,"[0.9201, 0.32, 0.0, 0.0]","[5, 3, 1, 1]","[[wish, hold, card, get, stiff, stronger, aside, love, case, save, carry, bulky, wallet, pocket, phone, wit, otterbox, case], [look, cheap, use, item], [leather, top, qualityhope, make, well, quality], [return, strap, wouldnt, stay, shut, inside, wasnt, overpacked]]","[[wish hold card get stiff stronger aside love case save carry bulky wallet pocket phone wit otterbox case, 0.9201, 5], [look cheap use item, 0.32, 3], [leather top qualityhope make well quality, 0.0, 1], [return strap wouldnt stay shut inside wasnt overpacked, 0.0, 1]]"
B00JHKCAYS,[-0.3749],[1],"[[stop, work, month, worth, hassle, return]]","[[stop work month worth hassle return, -0.3749, 1]]"
B00JJVTSHW,"[0.7734, -0.1027]","[5, 2]","[[put], [apply, wouldnt, know, there, screen, protector, didnt, mess, come, sheet, see, bubble, remove, film, layer, bubble, gone, get, smudge, breath, rub, soft, cloth, shirt, voila, sleek]]","[[put, 0.7734, 5], [apply wouldnt know there screen protector didnt mess come sheet see bubble remove film layer bubble gone get smudge breath rub soft cloth shirt voila sleek, -0.1027, 2]]"
B00JW386SO,[-0.1913],[3],"[[get, week, work, cigarette, lighter, fit, outlet, make, charge, work, wont, recommend, anyone]]","[[get week work cigarette lighter fit outlet make charge work wont recommend anyone, -0.1913, 3]]"
B00JZD021U,[0.0],[1],"[[didnt, work, dims, phonestupid, dont, buy]]","[[didnt work dims phonestupid dont buy, 0.0, 1]]"
B00K5V1FJY,[0.7906],[5],"[[use, work]]","[[use work, 0.7906, 5]]"
B00K6ODND6,[0.631],[1],"[[look, sound, start, skip, day, get, pay, easy, return, hassle]]","[[look sound start skip day get pay easy return hassle, 0.631, 1]]"
B00KA2OLV2,[0.8962],[4],"[[price, annoyance, upgrade, battery, doesnt, kick, time, find, drain, charger, phone, remove, charger, charge, seems, data, doesnt, work, pop, charger, transfer, file, usb, bulk, phone, duhbr, br, know, con, battery, backup, triple, life, battery, plus, travel, sightsee, use, camera, gps, data, day, get, went, europe, head, hotel, afternoon, charge, phone, whole, day, charge, data, usebr, br, price, product, think, add, nexus, owner]]","[[price annoyance upgrade battery doesnt kick time find drain charger phone remove charger charge seems data doesnt work pop charger transfer file usb bulk phone duhbr br know con battery backup triple life battery plus travel sightsee use camera gps data day get went europe head hotel afternoon charge phone whole day charge data usebr br price product think add nexus owner, 0.8962, 4]]"
B00KG45W1C,"[0.6997, 0.4808, 0.0, 0.8431, 0.3612, 0.6369, 0.4404, -0.7269, -0.0701, 0.9136, 0.6369, 0.946]","[5, 5, 3, 5, 5, 5, 4, 2, 1, 5, 5, 5]","[[work, great, phone, battery, recommend, product], [thank], [dont, believe, hype, charge, samsung, maybe, dy, mah, battery, miss, something, experience, look], [item, look, item, wasnt, sure, hold, charge, girlfriend, month, say, hasnt, issue, car, doesnt, cigarette, lighter, plug, great, buy, shes, road, love], [go, charger, glad, purchase, work, amaze, got, color, def, got, fast], [went, trip, charger, help, keep, phone, heavier, stolen, luggage, trip, complain, weight, work], [buy, buy, apple, adapterits, include, disappoint, frustrating], [think], [quick, convenient, love], [battery, pack, work, charge, iphone, work, purchase, great, battery, pack]]","[[work great phone battery recommend product, 0.6997, 5], [thank, 0.4808, 5], [dont believe hype charge samsung maybe dy mah battery miss something experience look, 0.0, 3], [item look item wasnt sure hold charge girlfriend month say hasnt issue car doesnt cigarette lighter plug great buy shes road love, 0.8431, 5], [go charger glad purchase work amaze got color def got fast, 0.3612, 5], [went trip charger help keep phone heavier stolen luggage trip complain weight work, 0.6369, 5], [buy buy apple adapterits include disappoint frustrating, 0.4404, 4], [think, -0.7269, 2], [quick convenient love, -0.0701, 1], [battery pack work charge iphone work purchase great battery pack, 0.9136, 5], [, 0.6369, 5], [, 0.946, 5]]"
B00KL03PU6,[0.8122],[2],"[[love, appearance, case, rhinestones, come]]","[[love appearance case rhinestones come, 0.8122, 2]]"
B00KN7NB2O,[0.5719],[4],"[[excellent, describe, ship]]","[[excellent describe ship, 0.5719, 4]]"
B00KN92HKY,"[0.6249, 0.7579]","[5, 4]","[[work, great, item, receive, order], [nice, screen, saver, fit, perfect]]","[[work great item receive order, 0.6249, 5], [nice screen saver fit perfect, 0.7579, 4]]"
B00KNFWON8,[0.2382],[2],"[[idea, good, glassine, cover, come, undone, glue, dont, stay]]","[[idea good glassine cover come undone glue dont stay, 0.2382, 2]]"
B00L6JSFEM,[0.6249],[5],"[[screen, protector]]","[[screen protector, 0.6249, 5]]"
B00L9FUV4U,[0.3612],[1],"[[star, work, day, connecting, disconnect, charger, get, phone]]","[[star work day connecting disconnect charger get phone, 0.3612, 1]]"
B00LFWS1QM,[0.765],[5],"[[provides, great, protection, snug, fit, fit, inside, carry, case, purchase]]","[[provides great protection snug fit fit inside carry case purchase, 0.765, 5]]"
B00LGIVI06,[0.5719],[5],"[[excellent, receive, quality, product]]","[[excellent receive quality product, 0.5719, 5]]"
B00LP9HRNS,"[0.6249, 0.9253, 0.875, 0.8481, 0.0, 0.4754, 0.6436]","[5, 5, 5, 5, 2, 5, 5]","[[awesome, quality, night, light, price, point], [light, sensor, bottom, bit, design, flaw, something, plug, sensor, block, stay, lit, room, work, room, didnt, work, others, light, issue, way, cost, worth, color, fade, light, change, color, nice, doesnt, overdo, buy], [work, great, price], [nice], [amount, nightlight, changingtransitioning, color, make, better, sensor, bottom, work, charm], [bulb, go], [cool, shift, color, turn, provides, decent, amount, light, rent, bedroom, airbnb, hallway, guest, find, bathroom, nightlight]]","[[awesome quality night light price point, 0.6249, 5], [light sensor bottom bit design flaw something plug sensor block stay lit room work room didnt work others light issue way cost worth color fade light change color nice doesnt overdo buy, 0.9253, 5], [work great price, 0.875, 5], [nice, 0.8481, 5], [amount nightlight changingtransitioning color make better sensor bottom work charm, 0.0, 2], [bulb go, 0.4754, 5], [cool shift color turn provides decent amount light rent bedroom airbnb hallway guest find bathroom nightlight, 0.6436, 5]]"
B00MAAKEUE,[0.7469],[3],"[[didnt, love]]","[[didnt love, 0.7469, 3]]"
B00MAWQN70,[0.7701],[4],"[[give, star, product, matter, fact, drop, phone, didnt, break, crack, screen, give, star, known, time, screen, cover, outer, case]]","[[give star product matter fact drop phone didnt break crack screen give star known time screen cover outer case, 0.7701, 4]]"
B00MO9MGSO,[-0.0516],[2],"[[fine, fall, test, water, get, inside, screen, make, see, buy, case]]","[[fine fall test water get inside screen make see buy case, -0.0516, 2]]"
B00MP59X3S,"[-0.2263, 0.6868]","[1, 1]","[[get, unit, excite, review, give, cost, think, try, issue, car, charger, work, end, use, charger, cell, phone, credit, seller, offer, refund, faulty, chargerbr, br, fast, forward, summer, week, review, video, notice, blurry, focus, think, lens, window, dirty, clean, issue, video, online, research, seem, amount, user, device, issue, warping, heatbr, br, unit, design, place, car, windshield, unit, ruin, video, image, blurry, month, return, date, im, stuck, itbr, br, prosbr, great, size, form, factor, wedge, shape, ideal, dash, cam, hang, suction, cupsbr, decent, quality, video, camera, price, range, lastedbr, seller, good, reimburse, faulty, car, chargerbr, br, consbr, unit, make, idea, lens, lens, house, glass, metalbr, way, refocus, lens, fix, positionbr, florida, hot, area, country, think, twice, choose, unit], [stop, work, month]]","[[get unit excite review give cost think try issue car charger work end use charger cell phone credit seller offer refund faulty chargerbr br fast forward summer week review video notice blurry focus think lens window dirty clean issue video online research seem amount user device issue warping heatbr br unit design place car windshield unit ruin video image blurry month return date im stuck itbr br prosbr great size form factor wedge shape ideal dash cam hang suction cupsbr decent quality video camera price range lastedbr seller good reimburse faulty car chargerbr br consbr unit make idea lens lens house glass metalbr way refocus lens fix positionbr florida hot area country think twice choose unit, -0.2263, 1], [stop work month, 0.6868, 1]]"
B00MU3VYPA,[0.4215],[5],[[nice]],"[[nice, 0.4215, 5]]"
B00MW1LAK4,[0.6908],[5],[[color]],"[[color, 0.6908, 5]]"
B00NCD955I,[0.4678],[4],"[[sound, darn, use, bass, blow, everything, listen]]","[[sound darn use bass blow everything listen, 0.4678, 4]]"
B00NERB2VC,[0.734],[5],"[[nice, case, order, order, order, nice, case]]","[[nice case order order order nice case, 0.734, 5]]"
B00NOFF7HO,[0.7506],[5],"[[get, husband, iphone, think, wood, picture, lol, rubber, wood, grain, look, wood, bit, get, close, put, phone, tight, case]]","[[get husband iphone think wood picture lol rubber wood grain look wood bit get close put phone tight case, 0.7506, 5]]"
B00NOHAN08,[0.7992],[4],"[[hold, credit, card, driver, license, ability, hold, item, slip, stay, holder, get, credit, card, thats, thing, view, problem, defect, part, wearandtear, perspective]]","[[hold credit card driver license ability hold item slip stay holder get credit card thats thing view problem defect part wearandtear perspective, 0.7992, 4]]"
B00NP82JEY,"[0.0, 0.7743, 0.0]","[3, 4, 1]","[[case, clip, make, noise, protection, ], [clip, keep, break, holster]]","[[case clip make noise protection , 0.0, 3], [clip keep break holster, 0.7743, 4], [, 0.0, 1]]"
B00NQWGGE8,[0.6249],[4],"[[product, price, fact, take, picture, water]]","[[product price fact take picture water, 0.6249, 4]]"
B00NTJKS7O,[0.0],[4],"[[look, professional, thing, isit, cant, selfie, use]]","[[look professional thing isit cant selfie use, 0.0, 4]]"
B00NTOFFWW,[-0.2263],[3],"[[chain, break]]","[[chain break, -0.2263, 3]]"
B00O0Z98M2,"[0.3182, 0.296]","[4, 5]","[[drawback, cord, otherwise, star, id, rate, half, star, buy, product], [ok]]","[[drawback cord otherwise star id rate half star buy product, 0.3182, 4], [ok, 0.296, 5]]"
B00O5M6WRO,[0.9334],[5],"[[husband, happy, coz, phone, look, put, case, satisfy]]","[[husband happy coz phone look put case satisfy, 0.9334, 5]]"
B00O9J39KG,[0.0772],[1],"[[crap, well, put, bag, phone]]","[[crap well put bag phone, 0.0772, 1]]"
B00O9PGSIK,[-0.1027],[2],"[[get, phone]]","[[get phone, -0.1027, 2]]"
B00OOOE4P0,[0.1298],[3],"[[love, screen, protector, help, protect, phone, fall, gym, floor, reason, ranking, drop, take, month, start, shatter, yes, drop, lot, go, file, claim, warranty, wouldnt, let, packaging, claim, month, worryfree, guarantee, disappoint, buy, thing, happen, decide, go, different, product, second, try]]","[[love screen protector help protect phone fall gym floor reason ranking drop take month start shatter yes drop lot go file claim warranty wouldnt let packaging claim month worryfree guarantee disappoint buy thing happen decide go different product second try, 0.1298, 3]]"
B00OTW7QS4,[0.0258],[5],"[[way, go, team, qi, wireless, charger, pleson, ultraslim, qi, wireless, charge, station, pad, buy, charge, station, pad, difference, charge, ability]]","[[way go team qi wireless charger pleson ultraslim qi wireless charge station pad buy charge station pad difference charge ability, 0.0258, 5]]"
B00OU26JGI,"[0.9793, -0.2047]","[5, 5]","[[leave, review, product, great, expectation, review, say, screen, protector, provide, screen, let, know, review, false, screen, protector, fit, well, screen, protector, purchase, buy, deali, use, brandcase, release, case, model, event, stick], [work, describe, problem, non, oem, charger, dont, thru, charger, slot, remove, case, charge, issue, associate, case, kick, stand, feature, case]]","[[leave review product great expectation review say screen protector provide screen let know review false screen protector fit well screen protector purchase buy deali use brandcase release case model event stick, 0.9793, 5], [work describe problem non oem charger dont thru charger slot remove case charge issue associate case kick stand feature case, -0.2047, 5]]"
B00OUS9T0U,[0.128],[5],"[[product, great, seller, wonderful, post, office, crap, get, product, today, delivery, sence, saturday]]","[[product great seller wonderful post office crap get product today delivery sence saturday, 0.128, 5]]"
B00P69IKQQ,[-0.4767],[1],"[[cheap, quality, revive, break]]","[[cheap quality revive break, -0.4767, 1]]"
B00PD2AWFI,[0.4927],[4],"[[please, case, follow, seller]]","[[please case follow seller, 0.4927, 4]]"
B00PFOY3YK,[0.8316],[5],"[[excellent, quality, case, receive, item, week, order, service]]","[[excellent quality case receive item week order service, 0.8316, 5]]"
B00PGSKVNW,"[0.0, 0.4404]","[1, 5]","[[junk, cable, buy, something], [cable, work, sync, charge, quality, price]]","[[junk cable buy something, 0.0, 1], [cable work sync charge quality price, 0.4404, 5]]"
B00PJWK3G0,"[0.6249, 0.6369, 0.4927, 0.7964, -0.7469]","[5, 5, 3, 5, 3]","[[please, fit, phone, take, case, use], [come, expect, delivery, date, love], [fact, walk], [take, time, get, product, product, cheap, price, match, product, complaint], [product]]","[[please fit phone take case use, 0.6249, 5], [come expect delivery date love, 0.6369, 5], [fact walk, 0.4927, 3], [take time get product product cheap price match product complaint, 0.7964, 5], [product, -0.7469, 3]]"
B00PPSMSES,[0.3612],[4],"[[look, picture, rip, month, ship]]","[[look picture rip month ship, 0.3612, 4]]"
B00QE472XE,"[0.8588, -0.4585]","[5, 1]","[[happy, case, phone], [color, perfect]]","[[happy case phone, 0.8588, 5], [color perfect, -0.4585, 1]]"
B00QGISM8W,[0.5719],[5],[[excellent]],"[[excellent, 0.5719, 5]]"
B00QK6PLZM,[0.6249],[3],"[[stand, great, remote, stay, connect, iphone, minute]]","[[stand great remote stay connect iphone minute, 0.6249, 3]]"
B00QSB3UXE,"[-0.7478, 0.0693, 0.6249, 0.3612, -0.3412, 0.8658, 0.6249]","[1, 1, 5, 5, 1, 5, 5]","[[work, bos], [arrive, earlyproduct, need, thanks], [expect, work], [say, apple, ipad, plug, wall, recognize, ti, try, cord, port, replicator, come, plug, work, guess, fault, reading, review, hand, guess, return], [purchase, adapter, work, doa, week, work, die, sure, problem, quality, control, adapter, badbr, br, recommend, stay, adapter], [work, great], [quality]]","[[work bos, -0.7478, 1], [arrive earlyproduct need thanks, 0.0693, 1], [expect work, 0.6249, 5], [say apple ipad plug wall recognize ti try cord port replicator come plug work guess fault reading review hand guess return, 0.3612, 5], [purchase adapter work doa week work die sure problem quality control adapter badbr br recommend stay adapter, -0.3412, 1], [work great, 0.8658, 5], [quality, 0.6249, 5]]"
B00QTU21Z2,[0.7351],[5],"[[perfect, fit]]","[[perfect fit, 0.7351, 5]]"
B00QZXQP50,"[0.6249, 0.7979]","[5, 4]","[[charger, cord, cord, nook, come, work, reach, chair, outlet, use], [work, great]]","[[charger cord cord nook come work reach chair outlet use, 0.6249, 5], [work great, 0.7979, 4]]"
B00R0QCILG,[0.8297],[4],"[[everything, good, nice, seller, recommend]]","[[everything good nice seller recommend, 0.8297, 4]]"
B00R0WWUM2,"[0.5859, 0.874]","[1, 4]","[[phone, select, he, happy, alls], [open, package, make, sure, phone, fit, go, put, clip, belt, entire, clip, come, clip, suppose, connect, rivet, rivet, close, hold, clip, fell, find, floor]]","[[phone select he happy alls, 0.5859, 1], [open package make sure phone fit go put clip belt entire clip come clip suppose connect rivet rivet close hold clip fell find floor, 0.874, 4]]"
B00R458WE0,"[0.6281, 0.4404]","[5, 5]","[[work, want, dont, reach, flip, belt, side, change, setting, need], [strap, fit, iphone, bumper, case, easy, clip, phone, keep, bag]]","[[work want dont reach flip belt side change setting need, 0.6281, 5], [strap fit iphone bumper case easy clip phone keep bag, 0.4404, 5]]"
B00R6DEHQW,"[0.0, 0.6249, 0.6249]","[5, 5, 5]","[[oe, work, intend], [price], [work, great]]","[[oe work intend, 0.0, 5], [price, 0.6249, 5], [work great, 0.6249, 5]]"
B00R70C43C,[0.6249],[5],"[[wallet, buy]]","[[wallet buy, 0.6249, 5]]"
B00RC5M5KE,[0.9169],[5],"[[buy, stepdad, love, fit, protection]]","[[buy stepdad love fit protection, 0.9169, 5]]"
B00RDLKI2Y,"[0.9484, 0.8979]","[5, 5]","[[sturdy, case, slim, confident, note, protect, feel, hand, slipperybr, br, please, purchase], [case, think, theyre, protect, phone, purple, im, got, price]]","[[sturdy case slim confident note protect feel hand slipperybr br please purchase, 0.9484, 5], [case think theyre protect phone purple im got price, 0.8979, 5]]"
B00RGICB74,"[-0.8616, -0.3412]","[1, 1]","[[decent, sound, cut, time, freak, frustratingbr, worth, money], [ask, order, good, money]]","[[decent sound cut time freak frustratingbr worth money, -0.8616, 1], [ask order good money, -0.3412, 1]]"
B00RKCS1EI,[0.9025],[5],"[[screen, protector, buy, moto, x, nd, gen, sell, take, review, need, motorola, replace, phonebr, br, look, adhere, leave, edge, affect]]","[[screen protector buy moto x nd gen sell take review need motorola replace phonebr br look adhere leave edge affect, 0.9025, 5]]"
B00RKF9GJO,"[0.7579, 0.6369, 0.5719, 0.6486]","[5, 5, 5, 5]","[[phone, remain, slim, case, come, need, replace, phone, battery, great, case], [nice, case], [excellent]]","[[phone remain slim case come need replace phone battery great case, 0.7579, 5], [nice case, 0.6369, 5], [excellent, 0.5719, 5], [, 0.6486, 5]]"
B00RLHTVIW,[-0.7783],[1],"[[broke, say, transfer, cord, headphone, get, stuck, wont, come, broke, phone, help, dont, get, case]]","[[broke say transfer cord headphone get stuck wont come broke phone help dont get case, -0.7783, 1]]"
B00RM1675W,[-0.7915],[2],"[[charger, city, disappoint, doesnt, stay, motorcycle, bicycle, youre, use, touchscreen, use, plastic, great, purchase]]","[[charger city disappoint doesnt stay motorcycle bicycle youre use touchscreen use plastic great purchase, -0.7915, 2]]"
B00RM5UG50,[0.4404],[5],[[quality]],"[[quality, 0.4404, 5]]"
B00RMODYVE,[0.9382],[5],"[[awesome, phone, cover, get, compliment, time, fit, perfect, button, push, side, cushion, phone]]","[[awesome phone cover get compliment time fit perfect button push side cushion phone, 0.9382, 5]]"
B00RYRT18Y,"[-0.34, 0.0]","[5, 3]","[[complaint, back, case], [cheap, build, quality, want, case, slimmer]]","[[complaint back case, -0.34, 5], [cheap build quality want case slimmer, 0.0, 3]]"
B00S0DJ3WA,[0.6908],[4],"[[work, carrying, phone, couple, card, place, store, cash, provide, card, slot, like, ring, phone]]","[[work carrying phone couple card place store cash provide card slot like ring phone, 0.6908, 4]]"
B00SCTIC5Q,[-0.7163],[2],"[[give, star, color, vibrant, look, amaze, drop, hardwood, floor, screen, crack, whats, point, case, doesnt, protect, screen, disappoint]]","[[give star color vibrant look amaze drop hardwood floor screen crack whats point case doesnt protect screen disappoint, -0.7163, 2]]"
B00SGA6XCK,[0.4404],[4],[[case]],"[[case, 0.4404, 4]]"
B00SP3G18Y,[0.0],[1],"[[charger, work, return]]","[[charger work return, 0.0, 1]]"
B00STVE4F4,[-0.2755],[1],"[[false, advertisement, fit, iphone]]","[[false advertisement fit iphone, -0.2755, 1]]"
B00SXGZFYY,[0.3612],[5],"[[cover, entire, screen]]","[[cover entire screen, 0.3612, 5]]"
