B00J6EFDAI,"[0.5719, -0.4215]","[5, 1]","[[clip, break, day, receive], [perfect, replacement]]","[[clip break day receive, 0.5719, 5], [perfect replacement, -0.4215, 1]]"
B00JAKNKN0,[0.911],[3],"[[dont, feel, battery, last, play, pretty, guess, cant, complain]]","[[dont feel battery last play pretty guess cant complain, 0.911, 3]]"
B00JKS5S00,"[0.6249, 0.4044]","[4, 1]","[[bluetooth, speaker], [worse, thing, buy, speaker, regret, buy, speaker, buy, listen, work, work, car, known, loud, buy, office, plus, charger, fall, speaker, move, use, bluetooth, phone, work, great, easy, way, waste, money, buy, junk, speaker, buy, sound, speaker, save, money, something, well]]","[[bluetooth speaker, 0.6249, 4], [worse thing buy speaker regret buy speaker buy listen work work car known loud buy office plus charger fall speaker move use bluetooth phone work great easy way waste money buy junk speaker buy sound speaker save money something well, 0.4044, 1]]"
B00JWULO4U,"[0.9588, 0.1779]","[5, 4]","[[case, buy, thing, make, port], [work, bit, get, wont, slip, get, shape, put, test, dropping, phone, feel, confident, work, extra, rubber, corner, seem, pen, offer, value, happy, package, there, nothing]]","[[case buy thing make port, 0.9588, 5], [work bit get wont slip get shape put test dropping phone feel confident work extra rubber corner seem pen offer value happy package there nothing, 0.1779, 4]]"
B00JWXW5ZE,[0.7906],[5],"[[quality, price]]","[[quality price, 0.7906, 5]]"
B00K15Q2B0,"[0.788, 0.8052, 0.2023, 0.4404]","[3, 5, 5, 5]","[[use, know, base, phone, run], [get, love, phonebr, use, phone, awhile, find, difficult, access, sd, card, try, root, find, thru, research, boot, loader, lock, root, use, hot, spot, losses, file, go, africa, horse, rid, trail, film, family, giraffe, feet, show, rider, go, share, gonebr, dont, love, phone], [purchase, return, samsung, galaxy, id, purchase, seller, condition, recommend, phone, fyi, im, use, phone, att, service, talk, problem], [work, fine, att]]","[[use know base phone run, 0.788, 3], [get love phonebr use phone awhile find difficult access sd card try root find thru research boot loader lock root use hot spot losses file go africa horse rid trail film family giraffe feet show rider go share gonebr dont love phone, 0.8052, 5], [purchase return samsung galaxy id purchase seller condition recommend phone fyi im use phone att service talk problem, 0.2023, 5], [work fine att, 0.4404, 5]]"
B00K227PG8,[0.2134],[3],[[ok]],"[[ok, 0.2134, 3]]"
B00K6YEQUK,[0.0],[5],"[[say, inch, sae, usb, cord, charge, device, usb, cord]]","[[say inch sae usb cord charge device usb cord, 0.0, 5]]"
B00KAAWEKY,"[0.7351, 0.8952]","[5, 5]","[[look, card, fit, bill], [love, work, come, handy, thank]]","[[look card fit bill, 0.7351, 5], [love work come handy thank, 0.8952, 5]]"
B00KFVM6K6,[0.2732],[5],[[work]],"[[work, 0.2732, 5]]"
B00KFW7Q4G,[0.0],[4],"[[case, arrive, tact, indicate, picture, order]]","[[case arrive tact indicate picture order, 0.0, 4]]"
B00KH9G2QK,"[0.5859, 0.6369]","[5, 5]","[[head, set]]","[[head set, 0.5859, 5], [, 0.6369, 5]]"
B00KNNSOMK,[-0.6542],[4],"[[cheaply, make, tell, sticker, picture, complaint, buck]]","[[cheaply make tell sticker picture complaint buck, -0.6542, 4]]"
B00KRV4E36,[-0.9221],[1],"[[buy, product, year, come, review, product, secound, time, secound, time, receive, charge, wouldnt, hold, charge, contact, seller, tell, describe, told, product, know, trick, wave, say, keep, charging, thats, battery, day, dosent, hold, charge, dy, charge, power, button, get, stuck, fustrating, im, disappoint, purchase, come, repurchase, misplace, batter, loyal, customer, say, buyer, beware, save, rude, customer, service]]","[[buy product year come review product secound time secound time receive charge wouldnt hold charge contact seller tell describe told product know trick wave say keep charging thats battery day dosent hold charge dy charge power button get stuck fustrating im disappoint purchase come repurchase misplace batter loyal customer say buyer beware save rude customer service, -0.9221, 1]]"
B00L5Z42QW,"[0.0, 0.9164, 0.6941]","[4, 5, 5]","[[hold, ups, fall, throw, need, replace, month, screen, get, see], [get, case, expect, shatter, phone, screen, need, case, protect, phone, didnt, want, spend, otterbox, surprise, case, protect, phone], [case, super, id, compare, otter, box, alot, tricky, get, want, tight]]","[[hold ups fall throw need replace month screen get see, 0.0, 4], [get case expect shatter phone screen need case protect phone didnt want spend otterbox surprise case protect phone, 0.9164, 5], [case super id compare otter box alot tricky get want tight, 0.6941, 5]]"
B00LAWC4PG,[-0.6652],[2],"[[receive, item, color, show, picture, take, time, get, case, loosen, ipod, fit, least, front, case, open, longer]]","[[receive item color show picture take time get case loosen ipod fit least front case open longer, -0.6652, 2]]"
B00LFO5SYS,[0.7783],[5],"[[keep, phone, loving]]","[[keep phone loving, 0.7783, 5]]"
B00LGRYMEQ,[-0.2755],[2],"[[tower, come, week, wouldnt, recommend]]","[[tower come week wouldnt recommend, -0.2755, 2]]"
B00LNB7YPE,[0.886],[5],"[[excellent, screen, protector, fit, lg, g, watch]]","[[excellent screen protector fit lg g watch, 0.886, 5]]"
B00LOYL3HU,[0.7351],[5],"[[stick, screen]]","[[stick screen, 0.7351, 5]]"
B00LPJY1ZK,[0.9169],[5],"[[get, mom, love, fit, look]]","[[get mom love fit look, 0.9169, 5]]"
B00M3Z6G1W,[-0.6936],[2],"[[case, fit, camera, become, use, button, top, camera, power, button, button, flash, hard, take, button, account, flash, note, use, case, camera, fit, inside, leather, strap, case, design, camera, case, close, case, camera, end, use, case, pain, turn, camera]]","[[case fit camera become use button top camera power button button flash hard take button account flash note use case camera fit inside leather strap case design camera case close case camera end use case pain turn camera, -0.6936, 2]]"
B00M7F89DG,"[0.0, 0.7057, 0.0]","[1, 5, 3]","[[everything, say, description, havent, problem, motivate, message, minute, activity, info, make, aware, diet, overall, health, wish, check, hr, thats, issue, product, issue], [cheap, verison, bette, product, buck, extra], [malfunction, us]]","[[everything say description havent problem motivate message minute activity info make aware diet overall health wish check hr thats issue product issue, 0.0, 1], [cheap verison bette product buck extra, 0.7057, 5], [malfunction us, 0.0, 3]]"
B00MAD0DES,"[0.6369, 0.9858, 0.595, 0.7607, 0.0]","[5, 4, 4, 5, 5]","[[surprise, work, block, clock, need, tilt, get, effect, vent, wouldnt, insert, player, stay, put, magnet, adjusts, angle], [work, want, toits, interfere, drive, view, see, turn, head, move, bumpy, part, road, matter], [product, magnet, piece, magnat, wish, material, magnet, lot, longer, find, thats, pay, extra, buck, magnet, nice, concept, look, ipad, sit, hold, look, quality, product, use, home, game, work, file, use, wireless, mouse, entertainment, set, use, radio, dash, navi, youtube, playlist, pandora, radio, pure, music, bluetooth], [stay, slot, shake, moving, magnetics, phone, ipad, road, tossing, phone, whenever, get, car], [aweome]]","[[surprise work block clock need tilt get effect vent wouldnt insert player stay put magnet adjusts angle, 0.6369, 5], [work want toits interfere drive view see turn head move bumpy part road matter, 0.9858, 4], [product magnet piece magnat wish material magnet lot longer find thats pay extra buck magnet nice concept look ipad sit hold look quality product use home game work file use wireless mouse entertainment set use radio dash navi youtube playlist pandora radio pure music bluetooth, 0.595, 4], [stay slot shake moving magnetics phone ipad road tossing phone whenever get car, 0.7607, 5], [aweome, 0.0, 5]]"
B00MFMHSBU,[0.0],[4],"[[star, work, p]]","[[star work p, 0.0, 4]]"
B00MRIJ1MG,[0.9426],[5],"[[fit, secure, money, tell, quality, material, case, great, job, protection]]","[[fit secure money tell quality material case great job protection, 0.9426, 5]]"
B00MVQY3D6,[0.5719],[5],"[[excellent, product]]","[[excellent product, 0.5719, 5]]"
B00MVRJYJ8,[-0.5574],[1],"[[crappy, quality]]","[[crappy quality, -0.5574, 1]]"
B00N174FNC,"[0.34, 0.5267]","[3, 3]","[[drop, phone, everyday, havent, use, break, screen, everyday, dont, drop, phone, time], [serf, purpose, something, protect, edge]]","[[drop phone everyday havent use break screen everyday dont drop phone time, 0.34, 3], [serf purpose something protect edge, 0.5267, 3]]"
B00NBT1IA8,[0.3919],[4],"[[havent, use, water, fit, phone, problem, take, charger, charge]]","[[havent use water fit phone problem take charger charge, 0.3919, 4]]"
B00NETKRHA,[0.1962],[4],"[[color, look, photo, problem, rubber, get, dirty, doesnt, look, nice]]","[[color look photo problem rubber get dirty doesnt look nice, 0.1962, 4]]"
B00NETKRXY,"[0.8852, 0.6369]","[4, 5]","[[nice, great, fit, doesnt, clean]]","[[nice great fit doesnt clean, 0.8852, 4], [, 0.6369, 5]]"
B00NHXH9HO,"[0.765, 0.9322, -0.3412, 0.4627, -0.8011]","[5, 5, 3, 3, 1]","[[get, package, put, nice, case, seem, advertise, color, recommend, get, want, nice, case, price], [case, protect, phone, damage, drop, screen, crack, drop, phone, foot, useless], [looking, return], [buy, gift, sonhe, love], [seems, ok, rubber, pad, edge, see]]","[[get package put nice case seem advertise color recommend get want nice case price, 0.765, 5], [case protect phone damage drop screen crack drop phone foot useless, 0.9322, 5], [looking return, -0.3412, 3], [buy gift sonhe love, 0.4627, 3], [seems ok rubber pad edge see, -0.8011, 1]]"
B00NIOXLNI,[-0.2057],[4],"[[leather, doesnt, hold]]","[[leather doesnt hold, -0.2057, 4]]"
B00NJ5OXHE,[0.2263],[4],"[[nice, case, month, chip, cornersbr, white, corner]]","[[nice case month chip cornersbr white corner, 0.2263, 4]]"
B00NL5WULI,[-0.5873],[1],"[[color, dull, silver, combination, recommend]]","[[color dull silver combination recommend, -0.5873, 1]]"
B00NL70TUU,[0.1868],[5],"[[delivery, case, sooner, promise, case, sturdy]]","[[delivery case sooner promise case sturdy, 0.1868, 5]]"
B00NM6CMZ0,[0.926],[5],"[[case, simple, keep, iphone, hand, excess, button, charge, etc]]","[[case simple keep iphone hand excess button charge etc, 0.926, 5]]"
B00NMWJSBK,[0.9194],[3],"[[phone, good, phone, ie, everything, say, battery, quality, good, download, apps, picture, quality, good, video, quality, good, everything, good, phone, use, phone, month, speaker, phone, go, badi, hearing, caller, strange, reason, hear, beauty, sharkk, customer, service, contact, sharkk, phone, replace, everything, seem, work, month, use, replace, phone, problem, occur, speaker, phone, caller, hear, word, say, contact, sharkk, say, problem, part, phone, search, phone, fix, speaker, thing, andriod, phone, money]]","[[phone good phone ie everything say battery quality good download apps picture quality good video quality good everything good phone use phone month speaker phone go badi hearing caller strange reason hear beauty sharkk customer service contact sharkk phone replace everything seem work month use replace phone problem occur speaker phone caller hear word say contact sharkk say problem part phone search phone fix speaker thing andriod phone money, 0.9194, 3]]"
B00NOLCUWS,[-0.0807],[1],"[[recommend, item, size, look, photo, life]]","[[recommend item size look photo life, -0.0807, 1]]"
B00NVJ7PKK,[0.836],[4],"[[excellent, product, love]]","[[excellent product love, 0.836, 4]]"
B00NWJ830K,[0.7311],[4],"[[sent, black, order, case, want]]","[[sent black order case want, 0.7311, 4]]"
B00O1PJS08,[0.7761],[2],"[[carbon, fiber, design, take, beating, go, pocket, wear]]","[[carbon fiber design take beating go pocket wear, 0.7761, 2]]"
B00O8K7CY0,[0.9574],[4],"[[case, nice, feel, make, fit, phone, give, screen, bit, buffer, room, drop, face, problem, case, print, design, anything, print, case, wrap, side, piece, picture, show, fact, margin, blank, space, case, bright, white, picture, show, brighter, design, nice, good, case]]","[[case nice feel make fit phone give screen bit buffer room drop face problem case print design anything print case wrap side piece picture show fact margin blank space case bright white picture show brighter design nice good case, 0.9574, 4]]"
B00OH4HOOA,"[0.5083, 0.6915, 0.0276]","[3, 3, 1]","[[case, look, work, pretty, offer, protection, complaint, band, go, start, turn, guess, paint, mold, grey, plastic, paint, start, wear, start, use, look], [micro, usb, fit, case], [poor, build, quality, add, cheap, feel, flagship, phone, nice, flimsy, feel, poor, grip, side, button, diafficult, tell, look, design, appeal, quality, lack]]","[[case look work pretty offer protection complaint band go start turn guess paint mold grey plastic paint start wear start use look, 0.5083, 3], [micro usb fit case, 0.6915, 3], [poor build quality add cheap feel flagship phone nice flimsy feel poor grip side button diafficult tell look design appeal quality lack, 0.0276, 1]]"
B00OHXHO6Y,[0.6361],[5],[[like]],"[[like, 0.6361, 5]]"
B00OOF3MG6,"[0.8555, -0.2057]","[2, 1]","[[dog, gone, disappoint, br, sunflower, phone, case, use, couple, week, case, tab, fold, case, crack, stiches, take, care, case, neglect, make, make, ], [doesnt, stand, remove, phone, talk]]","[[dog gone disappoint br sunflower phone case use couple week case tab fold case crack stiches take care case neglect make make , 0.8555, 2], [doesnt stand remove phone talk, -0.2057, 1]]"
B00OR4VZ9A,"[0.7783, 0.8481]","[5, 5]","[[case, get, compliment], [get, ton, compliment, protects, phone]]","[[case get compliment, 0.7783, 5], [get ton compliment protects phone, 0.8481, 5]]"
B00OWEJYCK,[0.5719],[5],"[[excellent, privacy, screen, buy]]","[[excellent privacy screen buy, 0.5719, 5]]"
B00OYVM5XG,[0.4927],[5],"[[product, time, deliver]]","[[product time deliver, 0.4927, 5]]"
B00P60ASC4,[0.807],[3],"[[nice, gf, love]]","[[nice gf love, 0.807, 3]]"
B00P7U7FHY,[0.4404],[5],[[thanks]],"[[thanks, 0.4404, 5]]"
B00P8KHT8S,[0.4754],[5],[[satisfy]],"[[satisfy, 0.4754, 5]]"
B00P92Y0UK,[0.7474],[5],"[[product, ti, use, installbr]]","[[product ti use installbr, 0.7474, 5]]"
B00PA2JQ4Y,[0.0],[5],"[[work, expect, say]]","[[work expect say, 0.0, 5]]"
B00PG3TSWW,"[0.5719, -0.1045, 0.4767, 0.8074]","[5, 3, 5, 4]","[[excellent, product], [awesome, magnate, stick, screw, bolt, anything], [m, adhesive, doesnt, stick, anything, need, gorilla, glue, magnet, pull, filling, outta, teeth, mount, withstand, shake, vibration, semi], [name, brand, equivalent, purchase, money, rock, quality, work, great]]","[[excellent product, 0.5719, 5], [awesome magnate stick screw bolt anything, -0.1045, 3], [m adhesive doesnt stick anything need gorilla glue magnet pull filling outta teeth mount withstand shake vibration semi, 0.4767, 5], [name brand equivalent purchase money rock quality work great, 0.8074, 4]]"
B00PHN7A4E,[0.0],[5],"[[arrive, describe]]","[[arrive describe, 0.0, 5]]"
B00PJ1ZT8S,"[0.0516, 0.4215]","[1, 5]","[[nice], [material, end, break, week, return, refund, seller, ignore, request, recommend, look]]","[[nice, 0.0516, 1], [material end break week return refund seller ignore request recommend look, 0.4215, 5]]"
B00PKQ7MVO,[-0.2767],[3],"[[love, color, red, doesnt, fit, iphone, didnt, realize, plastic, search, cover, seem, miss, part, description, thats]]","[[love color red doesnt fit iphone didnt realize plastic search cover seem miss part description thats, -0.2767, 3]]"
B00PMXQNGK,"[0.96, -0.5859, -0.2755]","[4, 2, 1]","[[time, start, leak, water, test, water, resistance, risk, iphone], [iphone, get, wet, put, water, recommend], [buy, yes, make, pitch, noise, karaoke, night, stop, yes, case, iphone, phone, yes, rubber, nub, headphone, area, pain, butt, using, little, chili, pepper, thing, come, case, yes, break, phone, longer, yes, drop, time, case, suffer, damage, time, yes, stand, broke, month, last, month, constant, close, use, yes, chili, pepper, thing, work, intend, tie, core, come, hang, corner, lose, chili, pepper, whole, time, pocket, front, think, phone, size, issue, case, yes, use, thumbprint, option, work, month, start, wrinkle, take, try, get, read, print, cant, give, fall, apart, give, last, protect, phone, form, fall]]","[[time start leak water test water resistance risk iphone, 0.96, 4], [iphone get wet put water recommend, -0.5859, 2], [buy yes make pitch noise karaoke night stop yes case iphone phone yes rubber nub headphone area pain butt using little chili pepper thing come case yes break phone longer yes drop time case suffer damage time yes stand broke month last month constant close use yes chili pepper thing work intend tie core come hang corner lose chili pepper whole time pocket front think phone size issue case yes use thumbprint option work month start wrinkle take try get read print cant give fall apart give last protect phone form fall, -0.2755, 1]]"
B00PV1NY6K,[0.6956],[2],"[[get, pay, br, use, aux, cord, phone, price, break]]","[[get pay br use aux cord phone price break, 0.6956, 2]]"
B00Q4JNXXM,[0.4927],[4],[[product]],"[[product, 0.4927, 4]]"
B00Q515ZYY,[0.4404],[5],[[quality]],"[[quality, 0.4404, 5]]"
B00Q8JF8L8,[0.0],[1],"[[case, peel, turn, month, use, ]]","[[case peel turn month use , 0.0, 1]]"
B00Q9S9RJC,[0.6369],[5],"[[display, battery, life, quality, everything, work, call, finding, lose, phonesaved, phone, reading, message, timedates, weather, course, need, screen, protector, avoid, scratch, day, screen, display, get, mark, get, compliment, wear]]","[[display battery life quality everything work call finding lose phonesaved phone reading message timedates weather course need screen protector avoid scratch day screen display get mark get compliment wear, 0.6369, 5]]"
B00QGGG68M,[0.3612],[4],[[thank]],"[[thank, 0.3612, 4]]"
B00QLCCIJ2,"[0.8777, 0.6249, 0.4285, 0.9571]","[5, 4, 2, 5]","[[product], [case, great, feel, slip, lip, screen, give, bit, sense, security, like, affordability, case, felt, hand], [case, month, love, protect, phone, scratch, crack, drop, case, break, im, repurchase], [l, love, case, month, matte, black, gold, perfect, stylish, month, case, script, isnt, problem, button, push, volume, lock, button, fallen, make, use, get, rid, case]]","[[product, 0.8777, 5], [case great feel slip lip screen give bit sense security like affordability case felt hand, 0.6249, 4], [case month love protect phone scratch crack drop case break im repurchase, 0.4285, 2], [l love case month matte black gold perfect stylish month case script isnt problem button push volume lock button fallen make use get rid case, 0.9571, 5]]"
B00QW03O3W,[0.0],[1],"[[cheap, color, fade, bottom]]","[[cheap color fade bottom, 0.0, 1]]"
B00QWV71VM,"[0.659, 0.9169]","[5, 5]","[[cord, need, length, buy, foot, make, gave, couple, coworkers, love, buy], [awesome, buy]]","[[cord need length buy foot make gave couple coworkers love buy, 0.659, 5], [awesome buy, 0.9169, 5]]"
B00QY5KNIO,[0.4404],[5],[[condition]],"[[condition, 0.4404, 5]]"
B00R3IK804,[-0.5256],[1],"[[poor, case, flimsy]]","[[poor case flimsy, -0.5256, 1]]"
B00RFJ3LAU,[0.8703],[5],"[[color, vibrant]]","[[color vibrant, 0.8703, 5]]"
B00RPZHDSA,[0.6486],[3],"[[value, money]]","[[value money, 0.6486, 3]]"
B00RVSOWIU,"[0.765, 0.5994]","[5, 3]","[[write, review, say, love, notice, mirror, start, come, couple, us, nothing, cant, fix], [year, old, daughter, love, case, thanks, business]]","[[write review say love notice mirror start come couple us nothing cant fix, 0.765, 5], [year old daughter love case thanks business, 0.5994, 3]]"
B00S12MW5K,[-0.7391],[2],"[[doesnt, feature, mention, description, doesnt, recognize, ipod, voice, navigation, system, cant, understand, instruction, booklet, page, help, set, understand, feature, radio]]","[[doesnt feature mention description doesnt recognize ipod voice navigation system cant understand instruction booklet page help set understand feature radio, -0.7391, 2]]"
B00S4RQLUY,[0.5719],[5],"[[girlfriend, love, case]]","[[girlfriend love case, 0.5719, 5]]"
B00SI9WV1Q,[0.5574],[4],"[[fit, plan, take]]","[[fit plan take, 0.5574, 4]]"
B00SJRNSO6,[0.1783],[5],"[[work, field, scrub, need, clip, case, face, case, time, consume, clip, use, break, awesome, built, clip, break, fit, snug, flop, excellent, buy, color]]","[[work field scrub need clip case face case time consume clip use break awesome built clip break fit snug flop excellent buy color, 0.1783, 5]]"
B00SWEPGG4,[-0.6595],[2],"[[charger, work, fine, dont, use, plug, radio, stop, play, affect, car, system, dont, want, start, car, fire, anything]]","[[charger work fine dont use plug radio stop play affect car system dont want start car fire anything, -0.6595, 2]]"
B00SXFEAJ6,"[-0.0, 0.7003, 0.98, 0.8271]","[4, 5, 5, 1]","[[case, seem, protection, think, bore, simple, blue, sleek, design, look, price, world, phone, case, lack, kind, kickstand, critique, think, everyone, standard], [buy, husband, phone, upgrade, model, insist, see, urban, armor, model, case, year, brand, couldnt, ask, better, protection, drop, phone, time, count, issue, rubber, bumper, protect, phone, screen, phone, get, light, weight, less, case, add, heft, phone, make, hold, like, button, side, work, doesnt, case, half, cost, pricier, case, love, case, perfect, combination, sturdy, rugged, price, case], [wireless, charger, phone, overheat, reboot, get, come, take, case, cool, ha, ve, use, uag, galaxy, work, like, case, scar, go, fry, phone], [thin, hold, allow, plugging, size, power, audio, plug, type, case, good]]","[[case seem protection think bore simple blue sleek design look price world phone case lack kind kickstand critique think everyone standard, -0.0, 4], [buy husband phone upgrade model insist see urban armor model case year brand couldnt ask better protection drop phone time count issue rubber bumper protect phone screen phone get light weight less case add heft phone make hold like button side work doesnt case half cost pricier case love case perfect combination sturdy rugged price case, 0.7003, 5], [wireless charger phone overheat reboot get come take case cool ha ve use uag galaxy work like case scar go fry phone, 0.98, 5], [thin hold allow plugging size power audio plug type case good, 0.8271, 1]]"
B00T47F7UI,"[0.3612, 0.9246, 0.6837]","[4, 5, 4]","[[packaging, love, case, great, buy], [own, case, month, love, credit, card, slot, clean, cloth, quality, case, clasp, incline, phone, movie, view, complaint, quality, plastic, phone, holder, broke, corner, time, remove, camera, case, phone, holder, softer, rubbery, material, year, use, break, get, case, upgrade, phone, recommend, case, removing, phone], [thank]]","[[packaging love case great buy, 0.3612, 4], [own case month love credit card slot clean cloth quality case clasp incline phone movie view complaint quality plastic phone holder broke corner time remove camera case phone holder softer rubbery material year use break get case upgrade phone recommend case removing phone, 0.9246, 5], [thank, 0.6837, 4]]"
B00T48YMHQ,[0.4201],[5],"[[case, month, havent, issue]]","[[case month havent issue, 0.4201, 5]]"
B00T4H373C,[0.0],[3],"[[smudge, print, process, black, white, part]]","[[smudge print process black white part, 0.0, 3]]"
B00T6J3V52,"[0.7964, 0.6369, -0.8034, 0.9757, 0.8126, 0.8211, 0.8176, 0.8761]","[4, 5, 1, 3, 5, 5, 5, 4]","[[excellent, product, good, battery, life, game, recommend], [excellent, winner, brother, think, iphone, show, phone, himthanks, blu], [nice, phoneamazing, life, battery, sweet, custom, o, color, orange, look, coolbr, start, blu, developer, team, update, phone, lollipop, promise, june], [nice, love], [blu, phone], [today, online, description, say, upgrade, lollipop, seem, blu, renege, accord, spec, today, suppose, upgrade, june, september, texas, know, trade, practice, sure, newer, version, lollipop, purchase, phone, base, state, promise, upgrade, amazon, require, advertiser, honest, honor, commitmentsbr, br, otherwise, battery, life, outstanding], [blu, smartphone, audio, drop, toilet, dry, work, water, stain, inside, glass, didnt, hundred, dollar, invest, got, screen, button, pocket, battery, dont, make, shure, charge, night, yes, happy, company, product], [worst, phone, ive, boughtstraight, box, headphone, jack, work, month, own, cheap, battery, life, span, less, half, good, box, order, version, know, connectivity, issue, tmobiles, prepay, network, drop, call, text, get, screen, picture, screen, warp, discolors, nowhere, look, cheap, phone, thats, try, asus, zenphone, avoid, unsupportivte, company, cost]]","[[excellent product good battery life game recommend, 0.7964, 4], [excellent winner brother think iphone show phone himthanks blu, 0.6369, 5], [nice phoneamazing life battery sweet custom o color orange look coolbr start blu developer team update phone lollipop promise june, -0.8034, 1], [nice love, 0.9757, 3], [blu phone, 0.8126, 5], [today online description say upgrade lollipop seem blu renege accord spec today suppose upgrade june september texas know trade practice sure newer version lollipop purchase phone base state promise upgrade amazon require advertiser honest honor commitmentsbr br otherwise battery life outstanding, 0.8211, 5], [blu smartphone audio drop toilet dry work water stain inside glass didnt hundred dollar invest got screen button pocket battery dont make shure charge night yes happy company product, 0.8176, 5], [worst phone ive boughtstraight box headphone jack work month own cheap battery life span less half good box order version know connectivity issue tmobiles prepay network drop call text get screen picture screen warp discolors nowhere look cheap phone thats try asus zenphone avoid unsupportivte company cost, 0.8761, 4]]"
