B00KT09QPG,"[-0.4023, 0.5719, -0.8925]","[1, 5, 2]","[[get, grandson, love], [magic, wand, functionality, patchy, bestbr, br, keyboard, apple, compatiblebr, br, battery, life], [confuse, product, bought, picture, product, description, productbr, br, remote, day, fail, work, try, computer, work, issue, computer, software, relatedbr, br, work, please, idea, thing, lie, bed, type, keyboard, cant, hold, remote, head, shuts, keyboard, side, theres, esc, key]]","[[get grandson love, -0.4023, 1], [magic wand functionality patchy bestbr br keyboard apple compatiblebr br battery life, 0.5719, 5], [confuse product bought picture product description productbr br remote day fail work try computer work issue computer software relatedbr br work please idea thing lie bed type keyboard cant hold remote head shuts keyboard side theres esc key, -0.8925, 2]]"
B00KWWBQOU,[0.8519],[5],"[[cover, love]]","[[cover love, 0.8519, 5]]"
B00KXQ2NQK,[0.6249],[5],"[[phone, ]]","[[phone , 0.6249, 5]]"
B00L3Z7ILK,[0.0],[3],[[work]],"[[work, 0.0, 3]]"
B00L4IQM3Q,[0.3612],[2],"[[battery, hold, charge, battery, preform]]","[[battery hold charge battery preform, 0.3612, 2]]"
B00L7P1PVA,[-0.6249],[1],"[[joystick, dont, work, spot, timing]]","[[joystick dont work spot timing, -0.6249, 1]]"
B00LCAVSO4,"[0.4404, 0.6249, 0.9976, -0.0516]","[5, 5, 5, 3]","[[stumble, uag, case, radioshack, prebankruptcy, day, purchase, uag, case, white, case, black, accent, black, iphone, crack, screen, iphone, case, think, go, prevent, crack, happen, case, pun, humor, anyhow, get, screen, replace, browse, buy, radioshack, amazon, decide, uag, case, service, member, army, advertise, product, grade, protection, like, style, iphone, case, patriot, couldnt, turn, marketing, gimmickbr, br, iphone, uag, case, didnt, fail, upgrade, iphone, browse, amazon, uag, selection, iphone, uag, case, purchase, case, iphone, gold, exterior, want, enjoy, see, case, great, drop, phone, front, family, coworkers, complete, stranger, prove, toughness, exterior, gone, unharmed, immediacy, ready, drop, phone, indoors, rattle, component, inside, make, phone, drop, closer, nonfunctionality, regardless, treat, phone, case, recommend, everyone, want, iphone, accidental, dropsbr, br, light, cable, headphone, fit, case, obstruct, camera, flash, work, volume, button, vibrate, switch, home, button, screen, button, touch, case, simple, super, buy, case, continue, look, case, cart, save, browse, time], [buy, case, month, protection, drop, dust, rubber, separate, poor, load, photo, case], [case, iphone, ]]","[[stumble uag case radioshack prebankruptcy day purchase uag case white case black accent black iphone crack screen iphone case think go prevent crack happen case pun humor anyhow get screen replace browse buy radioshack amazon decide uag case service member army advertise product grade protection like style iphone case patriot couldnt turn marketing gimmickbr br iphone uag case didnt fail upgrade iphone browse amazon uag selection iphone uag case purchase case iphone gold exterior want enjoy see case great drop phone front family coworkers complete stranger prove toughness exterior gone unharmed immediacy ready drop phone indoors rattle component inside make phone drop closer nonfunctionality regardless treat phone case recommend everyone want iphone accidental dropsbr br light cable headphone fit case obstruct camera flash work volume button vibrate switch home button screen button touch case simple super buy case continue look case cart save browse time, 0.4404, 5], [buy case month protection drop dust rubber separate poor load photo case, 0.6249, 5], [case iphone , 0.9976, 5], [, -0.0516, 3]]"
B00LGM1OHY,"[0.0, 0.7569, -0.4404, 0.2188, 0.6933, 0.7948, 0.4404]","[1, 5, 1, 1, 3, 4, 5]","[[mount, stick, textured, dash, solid, fit, note], [doesnt, stick, dash, heat, relate, summer, seem, sturdy, device, good, quality, sure, wont, stay, dash], [flimsy, buy, recommend], [junk, throw, day, stay, put], [worthless], [doesnt, grab, phone, use, one, time, time, go, gps, thing, suction, sticky, stuff, like, rigidity, let, sister, borrow, give, wish, say]]","[[mount stick textured dash solid fit note, 0.0, 1], [doesnt stick dash heat relate summer seem sturdy device good quality sure wont stay dash, 0.7569, 5], [flimsy buy recommend, -0.4404, 1], [junk throw day stay put, 0.2188, 1], [worthless, 0.6933, 3], [doesnt grab phone use one time time go gps thing suction sticky stuff like rigidity let sister borrow give wish say, 0.7948, 4], [, 0.4404, 5]]"
B00LM5W8IO,"[-0.6259, 0.3252]","[1, 4]","[[happy, shown, picture], [ill, get]]","[[happy shown picture, -0.6259, 1], [ill get, 0.3252, 4]]"
B00LZCP4SA,[0.1779],[5],"[[provide, shock, protection, increase, profile, phone, lip, defends, glass, nice, gap, broken, screen, live, use, case, recommend, case, anyone, repair]]","[[provide shock protection increase profile phone lip defends glass nice gap broken screen live use case recommend case anyone repair, 0.1779, 5]]"
B00LZIGA9G,"[0.0, 0.6249]","[1, 5]","[[work, great], [month, product, doesnt, work]]","[[work great, 0.0, 1], [month product doesnt work, 0.6249, 5]]"
B00M8PRSWI,[0.8402],[5],"[[amaze, love]]","[[amaze love, 0.8402, 5]]"
B00MGZ120Y,"[0.6249, 0.93]","[5, 4]","[[nice, sleek, product, nice, fit, better, bass, good, runworkoutoverall, worth, money, spent], [period]]","[[nice sleek product nice fit better bass good runworkoutoverall worth money spent, 0.6249, 5], [period, 0.93, 4]]"
B00MIO0WXQ,[0.8316],[4],"[[case, wife, love, give, star, chain, come, couple, week]]","[[case wife love give star chain come couple week, 0.8316, 4]]"
B00MK7GYQA,[0.8655],[5],"[[carry, stand, house, watch, video, fold, cook, makeup, etc, iphone, sits]]","[[carry stand house watch video fold cook makeup etc iphone sits, 0.8655, 5]]"
B00MMIAESQ,[0.0],[5],[[order]],"[[order, 0.0, 5]]"
B00MMLTUG0,"[0.6249, 0.4215]","[5, 4]","[[product], [nice, item]]","[[product, 0.6249, 5], [nice item, 0.4215, 4]]"
B00MWRNMEK,[-0.2732],[3],"[[buy, unitsbr, charge, fastbr]]","[[buy unitsbr charge fastbr, -0.2732, 3]]"
B00MYOY5RO,[0.7845],[5],"[[lightning, cord, charging, category, charge, iphone, hour, dont, use, sleep, mode, great, product]]","[[lightning cord charging category charge iphone hour dont use sleep mode great product, 0.7845, 5]]"
B00MYY15OU,[0.0],[1],"[[junk, dont, buy]]","[[junk dont buy, 0.0, 1]]"
B00N7VO636,"[-0.7096, -0.666]","[1, 2]","[[piece, junk, plastic, connector, clip, break, make, useless], [rj, plug, radar, detector, expose, tuck, contact, pull, apart, worthless]]","[[piece junk plastic connector clip break make useless, -0.7096, 1], [rj plug radar detector expose tuck contact pull apart worthless, -0.666, 2]]"
B00NA9JQLM,"[-0.2523, 0.788, 0.5994, 0.836]","[2, 5, 5, 5]","[[buy, hope, compare, anker, port, charger, buy, work, want, recommend, product, want, work, day], [trick, charge, phone, night, trip], [job, costbr, travel, europe, converter, unit, charge, vary, combination, ipads, iphones, night, yes, output, iphones, need, charge, night], [charge, ipads, android, tablet, timebr, br, ipod, product, charger, use, changer, occupy, power, outlet, plenty, hotel, room, use, kind, power, strip, bulky]]","[[buy hope compare anker port charger buy work want recommend product want work day, -0.2523, 2], [trick charge phone night trip, 0.788, 5], [job costbr travel europe converter unit charge vary combination ipads iphones night yes output iphones need charge night, 0.5994, 5], [charge ipads android tablet timebr br ipod product charger use changer occupy power outlet plenty hotel room use kind power strip bulky, 0.836, 5]]"
B00NBGJ8H6,[-0.6486],[2],"[[difficult, operate, button, broke, make, watch]]","[[difficult operate button broke make watch, -0.6486, 2]]"
B00NF2RUTO,"[0.8689, 0.765]","[4, 5]","[[wish, see, case, buy, weight, protects, phone, top, bottom, front, touch, id, work], [case, lot, remove]]","[[wish see case buy weight protects phone top bottom front touch id work, 0.8689, 4], [case lot remove, 0.765, 5]]"
B00NH1PY9Q,"[0.2975, 0.7172, 0.6249, -0.3618]","[4, 4, 5, 1]","[[need, improve, sensitivity, press, voice, note, rec, sec, press], [product, purchase, tech, armor, im, please, privacy, protector, screen, recommend, iphone, user], [warn, chip, desk, bump, fail, say, warranty, advertisement, make, get, replacement, consider, total, loss, dont, time, play, find, warranty, game, website, stuck, zagg, see, photo, edge, chip, thing, crack, slight, bump, edge, desk, deal, reading, call, lifetime, warranty, write, greek, go, try, get, replace, buy, techarmor, buy, zagg, invisisheild, lesson, learn], [screen, protector]]","[[need improve sensitivity press voice note rec sec press, 0.2975, 4], [product purchase tech armor im please privacy protector screen recommend iphone user, 0.7172, 4], [warn chip desk bump fail say warranty advertisement make get replacement consider total loss dont time play find warranty game website stuck zagg see photo edge chip thing crack slight bump edge desk deal reading call lifetime warranty write greek go try get replace buy techarmor buy zagg invisisheild lesson learn, 0.6249, 5], [screen protector, -0.3618, 1]]"
B00NH5O5HO,"[-0.3744, 0.3612, -0.3616, 0.0]","[2, 5, 2, 2]","[[wheres, mute, button, seem, bluetooth, headset, get, yet, loose, feature, feel], [time, use, amazon, item, didnt, work, hear, amazon, replace, headset, headset, work, onoff, switch, switch, doesnt, engage, switch, time, turn], [wont, stay, connect, item]]","[[wheres mute button seem bluetooth headset get yet loose feature feel, -0.3744, 2], [time use amazon item didnt work hear amazon replace headset headset work onoff switch switch doesnt engage switch time turn, 0.3612, 5], [wont stay connect item, -0.3616, 2], [, 0.0, 2]]"
B00NHL4QKO,[0.9332],[5],"[[expect, color, rich, red, nice, fit]]","[[expect color rich red nice fit, 0.9332, 5]]"
B00NNB9B9O,[-0.296],[4],[[comment]],"[[comment, -0.296, 4]]"
B00NOLH4NI,"[-0.2755, 0.4927, 0.891, 0.6697, -0.5267, 0.8519, 0.7964]","[1, 5, 3, 5, 1, 5, 5]","[[quality], [love], [case, offer, protection, bit, flimsy, break, interfere, signal, gps, mine, occasion, metal, case, dont, expect, protect, phone, case, drop, look, phone, type, case], [fit, great], [case, order, safe, keep, people, fancy, look, met, expectation], [didnt, fit, phone], [plain, find, case, prevents, phone, receive, att, samsung, galaxy, resort, wear, view, case, reception, case, phone]]","[[quality, -0.2755, 1], [love, 0.4927, 5], [case offer protection bit flimsy break interfere signal gps mine occasion metal case dont expect protect phone case drop look phone type case, 0.891, 3], [fit great, 0.6697, 5], [case order safe keep people fancy look met expectation, -0.5267, 1], [didnt fit phone, 0.8519, 5], [plain find case prevents phone receive att samsung galaxy resort wear view case reception case phone, 0.7964, 5]]"
B00NP25LYU,[0.2024],[3],"[[getting, today, impression, pink, think, order, photo, pink, get, window, display, sun, wash, sunbr, phone, get, clip, dont, think, use, get, phone, put, wash, pink, wanna, use, case, belt, clip, doubt, use, lot, anyway, ok, price, guess, expect, price, want, quality, pay]]","[[getting today impression pink think order photo pink get window display sun wash sunbr phone get clip dont think use get phone put wash pink wanna use case belt clip doubt use lot anyway ok price guess expect price want quality pay, 0.2024, 3]]"
B00NP25P9Q,[0.8316],[5],"[[product, excellent, protection, phone]]","[[product excellent protection phone, 0.8316, 5]]"
B00NPDQ1FC,[0.9743],[5],"[[case, black, edge, case, white, note, perfect, fit, case, galaxy, past, rigid, side, edge, grip, wish, case, thats, nit, picky, case, protect, phone, couple, fall, alreadybr, br, note, begin, opinion, want, case, didnt, add, preexist, bulk, case, month, use, hold]]","[[case black edge case white note perfect fit case galaxy past rigid side edge grip wish case thats nit picky case protect phone couple fall alreadybr br note begin opinion want case didnt add preexist bulk case month use hold, 0.9743, 5]]"
B00NQBP9EM,"[0.7783, 0.1893]","[5, 3]","[[kinda, suck, okay], [keep, clean, stick, firm]]","[[kinda suck okay, 0.7783, 5], [keep clean stick firm, 0.1893, 3]]"
B00NUJT8PG,[0.4215],[5],[[nice]],"[[nice, 0.4215, 5]]"
B00NZ7Z38Y,[0.5927],[3],"[[look, nice, nice, lose, baseball, game, parking, lot, forcing, buy, better, band, wasnt, accurate, sleep, functionality, want, sleep, mode, detect, fell, asleep, determining, deep, sleep, light, sleep, woke, accurate]]","[[look nice nice lose baseball game parking lot forcing buy better band wasnt accurate sleep functionality want sleep mode detect fell asleep determining deep sleep light sleep woke accurate, 0.5927, 3]]"
B00O1BR3SG,"[0.8442, 0.4754, 0.6369, 0.6369]","[5, 5, 5, 5]","[[phone, case, ship, super, fast], [satisfy], [case, slight, shimmer]]","[[phone case ship super fast, 0.8442, 5], [satisfy, 0.4754, 5], [case slight shimmer, 0.6369, 5], [, 0.6369, 5]]"
B00O3LJAGM,"[-0.296, 0.8074]","[3, 5]","[[privacy], [look, picture, online, inexpensive, work, fit, screen, perfect]]","[[privacy, -0.296, 3], [look picture online inexpensive work fit screen perfect, 0.8074, 5]]"
B00O5KPLBO,[0.0],[3],"[[color, doesnt]]","[[color doesnt, 0.0, 3]]"
B00O8RUDS0,[-0.383],[5],"[[daughter, us, case, make, place, phone, card, change, loose, end, cant, say, thing]]","[[daughter us case make place phone card change loose end cant say thing, -0.383, 5]]"
B00OA4N75C,[0.4404],[5],"[[case, time, great, job, protect, phone, time, scratch]]","[[case time great job protect phone time scratch, 0.4404, 5]]"
B00OB3UBE2,"[0.5927, -0.2983, 0.6249, 0.8779]","[4, 4, 2, 5]","[[satisfy, ten, pack, unsatisfied, mess, couple, day], [charge, overnight, charge], [work, awesome, week, break], [color, carging, seem, charger, come, note]]","[[satisfy ten pack unsatisfied mess couple day, 0.5927, 4], [charge overnight charge, -0.2983, 4], [work awesome week break, 0.6249, 2], [color carging seem charger come note, 0.8779, 5]]"
B00OHRYFGC,"[0.0, -0.5849, -0.7944, -0.0134, 0.4404, 0.5379, 0.6249, -0.8422, 0.8746, 0.6124, -0.6697, 0.765, -0.6116, 0.765, 0.8122, 0.0, 0.8553, 0.6369, 0.4215, 0.85, 0.3167, 0.6124]","[1, 2, 2, 1, 5, 5, 5, 1, 5, 4, 2, 5, 2, 5, 5, 1, 5, 5, 5, 4, 4, 5]","[[fianc, like], [sound, happy, purchase], [lot, clearer, lgs], [exspected], [advertise, sound, listening, music, phone, quality, ok, music, sound, bass, change, setting, return, refund], [work, tend, slide, ear, canal, get, work, great, application, besides, exercise, sound, quality, good, drop, connection], [product, company, productbr, week, earpiece, separate, expose, wire, contact, company, tell, get, product, didnt, inventory, week, hop, waitin, addition, take, day, order, range, headset, foot, far, less, lgbr, company, customer, service, brand, company, locate, germany, know, lg, year, problemsdo, money, avoid, product], [wait, review, phaiser, headphone, quality, good, think, purchase], [sound, quality], [disappoint, dissatisfy, purchase, made, amazoni, purchase, set, havent, month, poor, qualityone, bluetooth, poor, sound, quality, cant, hear, set, bluetooth, leave, piece, come, apart, wire, dangle, dollars, feel, bluetooth, set, shouldnt, tore, fast, amount, money, worthi, value, customer, amazon, purchase, satisfaction, experience, bluetoothi, disappoint, dissatisfiedi, want, replacement, money, email, yolandabyahoocom, see, rectify, situation, bluetooth, headset], [daughter, say, work, work], [please], [cant, hear, anything], [use, headphone, month, ear, bud, go, use, headphone, month, thats, thingbr, probr, great, audio, buy, people, comment, loud, volune, case, quitebr, wire, sturdy, take, pullingbr, button, usebr, call, quality, excellent, thing, super, good, microphone, bluetooth, feedback, person, endbr, consbr, go, gym, lot, tend, slip, bit, aggravate, learn, adaptbr, round, holster, keep, cord, place, tend, come, get, annoy, point, frustration, timesbr, br, recommend, buy], [arrive, working, ear, seller, sent, replacement, took, work, describe], [buy, pair, wife, didnt, gave, shot, music, part, work, base, voice, call, part, microphone, problem, pick, voice, scream, side, ear, peace, stop, work, end, shelve, unit, take, wife, let, see, work], [quality, phone, call, clear, nice, build, sits, neck, audio, playback, quality], [work, great, sound, amazingperfect, cut, grass, jam, musicbr, recommend], [quick, shipping, great, product, customer, service, girl, ask, thank], [lower, raise, volume]]","[[fianc like, 0.0, 1], [sound happy purchase, -0.5849, 2], [lot clearer lgs, -0.7944, 2], [exspected, -0.0134, 1], [advertise sound listening music phone quality ok music sound bass change setting return refund, 0.4404, 5], [work tend slide ear canal get work great application besides exercise sound quality good drop connection, 0.5379, 5], [product company productbr week earpiece separate expose wire contact company tell get product didnt inventory week hop waitin addition take day order range headset foot far less lgbr company customer service brand company locate germany know lg year problemsdo money avoid product, 0.6249, 5], [wait review phaiser headphone quality good think purchase, -0.8422, 1], [sound quality, 0.8746, 5], [disappoint dissatisfy purchase made amazoni purchase set havent month poor qualityone bluetooth poor sound quality cant hear set bluetooth leave piece come apart wire dangle dollars feel bluetooth set shouldnt tore fast amount money worthi value customer amazon purchase satisfaction experience bluetoothi disappoint dissatisfiedi want replacement money email yolandabyahoocom see rectify situation bluetooth headset, 0.6124, 4], [daughter say work work, -0.6697, 2], [please, 0.765, 5], [cant hear anything, -0.6116, 2], [use headphone month ear bud go use headphone month thats thingbr probr great audio buy people comment loud volune case quitebr wire sturdy take pullingbr button usebr call quality excellent thing super good microphone bluetooth feedback person endbr consbr go gym lot tend slip bit aggravate learn adaptbr round holster keep cord place tend come get annoy point frustration timesbr br recommend buy, 0.765, 5], [arrive working ear seller sent replacement took work describe, 0.8122, 5], [buy pair wife didnt gave shot music part work base voice call part microphone problem pick voice scream side ear peace stop work end shelve unit take wife let see work, 0.0, 1], [quality phone call clear nice build sits neck audio playback quality, 0.8553, 5], [work great sound amazingperfect cut grass jam musicbr recommend, 0.6369, 5], [quick shipping great product customer service girl ask thank, 0.4215, 5], [lower raise volume, 0.85, 4], [, 0.3167, 4], [, 0.6124, 5]]"
B00OIQ16NC,[0.5095],[3],"[[case, take, tab, begin, crack, replace, leather, case]]","[[case take tab begin crack replace leather case, 0.5095, 3]]"
B00OQGJE3I,"[-0.7778, 0.34]","[2, 5]","[[case, prob, month, corner, broke], [phone, water, part, start, fall, break, case, day, flip, cover, broke, nd, day, disappoint, purchase]]","[[case prob month corner broke, -0.7778, 2], [phone water part start fall break case day flip cover broke nd day disappoint purchase, 0.34, 5]]"
B00OS8BJ9G,[-0.2732],[3],"[[device, work, workvolume, headset, bit, talking, speak, tone, recipient, interpret]]","[[device work workvolume headset bit talking speak tone recipient interpret, -0.2732, 3]]"
B00OTITJHO,[-0.6041],[5],"[[problem, cord, work, month, daughter, problem, warranty, refrigeration, contact, company, replace, problem, customer, service]]","[[problem cord work month daughter problem warranty refrigeration contact company replace problem customer service, -0.6041, 5]]"
B00OZ9VXU8,"[0.0, -0.0382]","[1, 5]","[[order, galaxy], [screen, protector, cover, side, side, grey, edge]]","[[order galaxy, 0.0, 1], [screen protector cover side side grey edge, -0.0382, 5]]"
B00P0GZZYU,"[0.9398, 0.6586, 0.5719, 0.8126, 0.3167, 0.6369, 0.5023]","[5, 4, 5, 5, 4, 5, 4]","[[armband, case, perfect, strap, start, loose, weight, arm, velcro, go, doesnt, fit, snug, nice, strap, arm, buy, company, ], [wife, love, armband, use, case, phone, case, use, armband], [need, armband, phone, read, review, job, band, configure, velcro, close, tighter, pinch, arm, mile, armband, use, run], [slim, work], [im, satisfy, product, put, struggle, say, come, case], [product, amaze, case, come, piece, inner, case, make, sturdy, material, second, holder, loop, armband, love, slide, phone, downward, remove, casing, slide, upward, im, go, againbr, br, use, yoga, dance, phone, stay, place, dont, feel, restrict]]","[[armband case perfect strap start loose weight arm velcro go doesnt fit snug nice strap arm buy company , 0.9398, 5], [wife love armband use case phone case use armband, 0.6586, 4], [need armband phone read review job band configure velcro close tighter pinch arm mile armband use run, 0.5719, 5], [slim work, 0.8126, 5], [im satisfy product put struggle say come case, 0.3167, 4], [product amaze case come piece inner case make sturdy material second holder loop armband love slide phone downward remove casing slide upward im go againbr br use yoga dance phone stay place dont feel restrict, 0.6369, 5], [, 0.5023, 4]]"
B00P787YHM,[-0.7269],[5],"[[drop, phone, embarrass, number, time, carry, pocket, key, case, keep, phone, protect, worn, rubber, plug, bottom, stay, monthsbr, br, add, bulk, people, iphones, ask, kind, phone, fit, pocket, problem, plug, aftermarket, cable]]","[[drop phone embarrass number time carry pocket key case keep phone protect worn rubber plug bottom stay monthsbr br add bulk people iphones ask kind phone fit pocket problem plug aftermarket cable, -0.7269, 5]]"
B00P9N89YC,"[0.6115, -0.426]","[5, 4]","[[serf, purpose, graphic, wear, week, unfortunate, phone, give, number, time, day, bounce, floor, go, otterbox, product, go, ya], [happy]]","[[serf purpose graphic wear week unfortunate phone give number time day bounce floor go otterbox product go ya, 0.6115, 5], [happy, -0.426, 4]]"
B00PG1P6RA,[-0.4956],[1],"[[quality, didnt, fit, phone]]","[[quality didnt fit phone, -0.4956, 1]]"
B00PJAGH5S,[0.5719],[5],[[excellent]],"[[excellent, 0.5719, 5]]"
B00PL9ZT56,[0.3506],[3],"[[stone, fell]]","[[stone fell, 0.3506, 3]]"
B00PS2QVHQ,[0.308],[5],"[[get, tire, buying, noncertified, cable, crap, day, end, buy, work, charm, time]]","[[get tire buying noncertified cable crap day end buy work charm time, 0.308, 5]]"
