B00PRXHCPQ,[0.8304],[5],"[[lightweight, form, fit, recharge, iphone, good, value, compare, competition]]","[[lightweight form fit recharge iphone good value compare competition, 0.8304, 5]]"
B00PU1ZJ82,[0.9717],[5],"[[write, amazon, review, think, guy, deserve, looking, phone, case, awhile, hold, buy, anything, couldnt, find, look, phone, case, wonderful, leather, great, quality, put, problem, take, picture, flash, closure, fit, card, inside, doesnt, look, either, ]]","[[write amazon review think guy deserve looking phone case awhile hold buy anything couldnt find look phone case wonderful leather great quality put problem take picture flash closure fit card inside doesnt look either , 0.9717, 5]]"
B00PUQ2OLM,"[-0.4822, 0.2732]","[3, 5]","[[receive, phone, today, try, set, tell, fake, please, tell, thats, ], [work, ecuadorgood, resolution, picture]]","[[receive phone today try set tell fake please tell thats , -0.4822, 3], [work ecuadorgood resolution picture, 0.2732, 5]]"
B00PV0EQ9A,[0.9609],[5],"[[receive, temper, glass, screen, protector, day, say, moto, g, gen, product, fit, perfect, install, love, protector, crystal, clear, lifetime, warranty, reason, decide, buy, recommend, others]]","[[receive temper glass screen protector day say moto g gen product fit perfect install love protector crystal clear lifetime warranty reason decide buy recommend others, 0.9609, 5]]"
B00PVOYEH0,"[0.4818, 0.6249]","[3, 5]","[[case, hold, get, phone, worth, cost]]","[[case hold get phone worth cost, 0.4818, 3], [, 0.6249, 5]]"
B00PYEEKJY,[0.7351],[5],"[[perfect, fit]]","[[perfect fit, 0.7351, 5]]"
B00QG9FHN4,"[0.0243, 0.8122]","[1, 5]","[[color, wasnt, picture, didnt, matter, fade, week, light, use, look, someone, photocopy, picture, someone, email, design, find, someone, el, facebook], [nice, case, roomy, secure, classy]]","[[color wasnt picture didnt matter fade week light use look someone photocopy picture someone email design find someone el facebook, 0.0243, 1], [nice case roomy secure classy, 0.8122, 5]]"
B00QHIHRLO,"[0.8271, 0.4404]","[5, 5]","[[deliver, promise, perfect, fit], [expect, shipping, delivery]]","[[deliver promise perfect fit, 0.8271, 5], [expect shipping delivery, 0.4404, 5]]"
B00QZ5NRA4,[-0.4767],[5],"[[send, order]]","[[send order, -0.4767, 5]]"
B00R176SYW,"[0.4404, 0.296]","[5, 4]","[[ok], [sit, desk, work, galaxy, run, noscreen, phone, charge, charge, fact, run, test, wireless, charger, increase, charge, time, accord, phonebr, tech, armor, case, sit, phone, case, raise, phone, seat, charge, stop, phone, sit, solve, problem]]","[[ok, 0.4404, 5], [sit desk work galaxy run noscreen phone charge charge fact run test wireless charger increase charge time accord phonebr tech armor case sit phone case raise phone seat charge stop phone sit solve problem, 0.296, 4]]"
B00R3N69N4,[0.5719],[5],[[excellent]],"[[excellent, 0.5719, 5]]"
B00R7IGL1A,[0.0],[3],"[[barley, fit]]","[[barley fit, 0.0, 3]]"
B00RG4NVJK,[0.9231],[4],"[[piece, size, case, size, iphone, adapter, work, hold, phone, duty, selfie, stick, great, picture, video]]","[[piece size case size iphone adapter work hold phone duty selfie stick great picture video, 0.9231, 4]]"
B00RHONLQW,[0.3962],[2],"[[okay, nothing, id, home, get, job, done, gripe, thing, get, annoy, youre, try, take, picture, outer, thing, phone, lot, clunky, make, hold, phone, wallet, item, thats, pen, thing, tore, get, hold, bill, isnt, case, say, protects, phone, get, case, carry, wallet]]","[[okay nothing id home get job done gripe thing get annoy youre try take picture outer thing phone lot clunky make hold phone wallet item thats pen thing tore get hold bill isnt case say protects phone get case carry wallet, 0.3962, 2]]"
B00RROU7T6,"[0.3291, 0.9701]","[3, 5]","[[pull, snap, earbud, okay, last], [bugger, disappoint, cordless, control, volume, skiprepeat, song, android, lot, ear, bud, work, android, devicebr, br, great, sound, great, design, awesome, price]]","[[pull snap earbud okay last, 0.3291, 3], [bugger disappoint cordless control volume skiprepeat song android lot ear bud work android devicebr br great sound great design awesome price, 0.9701, 5]]"
B00S77A6CK,"[0.4404, -0.5499, 0.2263]","[5, 3, 4]","[[nice, phone, anymore], [arrive, fast, product], [product, ok, order, thing, need, moto, x, st, gen]]","[[nice phone anymore, 0.4404, 5], [arrive fast product, -0.5499, 3], [product ok order thing need moto x st gen, 0.2263, 4]]"
B00SA2V47S,"[0.8481, 0.0]","[5, 2]","[[tad, bit, clunky, turn, blue, jean], [awesome, deal, awesome, product]]","[[tad bit clunky turn blue jean, 0.8481, 5], [awesome deal awesome product, 0.0, 2]]"
B00SEC3AS0,"[0.9442, 0.9325]","[5, 5]","[[fit, great, look, size, isnt, instruction, video, help], [fit, good, want, make, rubber, doesnt, pull, hair, clasp, use, band, cut, out, attache, watch, market, band, recommend, anyone]]","[[fit great look size isnt instruction video help, 0.9442, 5], [fit good want make rubber doesnt pull hair clasp use band cut out attache watch market band recommend anyone, 0.9325, 5]]"
B00SGYFWZU,[0.0],[2],"[[cheap, material, move, start, charge]]","[[cheap material move start charge, 0.0, 2]]"
B00SIB9OKK,[0.9518],[4],"[[nice, feel, case, feel, hand, soft, firm, textured, prevent, dropping, fit, case, doesnt, port, plug, usb, earphone, camera, lens, sensor, sturdy, stand, hard, pull, open, snap, shut, lock, place, use, keep, phone, attitude, blister, fit, switch, volumezoom, control, button, dont, seem, ability, use, case, difficult, take, apart, place, phone, good, thing, indicate, come, apart, drop, time, figure, get, apart, precise, instruction, include, peel, skin, pop, inner, frame, apart, nest, phone, close, upper, frame, snap, place, recover, skin, difficult, figure, spend, puzzle, minute, try, get, point, werent, difficulty, place, phone, case, give, star, rating, please, performance]]","[[nice feel case feel hand soft firm textured prevent dropping fit case doesnt port plug usb earphone camera lens sensor sturdy stand hard pull open snap shut lock place use keep phone attitude blister fit switch volumezoom control button dont seem ability use case difficult take apart place phone good thing indicate come apart drop time figure get apart precise instruction include peel skin pop inner frame apart nest phone close upper frame snap place recover skin difficult figure spend puzzle minute try get point werent difficulty place phone case give star rating please performance, 0.9518, 4]]"
B00SM61BKC,"[-0.296, 0.4404, 0.0, 0.8413, 0.8519]","[1, 5, 2, 5, 5]","[[doesnt, work, crack, drop, carpet], [order, product, happy, get, get, upset, iphone, order, product, email, company, tell, br, today, check, mail, get, package, sent, brand, make, day, look, fit, look, amaze, ], [put], [product, cheap, price, love, body, ask, bought]]","[[doesnt work crack drop carpet, -0.296, 1], [order product happy get get upset iphone order product email company tell br today check mail get package sent brand make day look fit look amaze , 0.4404, 5], [put, 0.0, 2], [product cheap price love body ask bought, 0.8413, 5], [, 0.8519, 5]]"
B00SX9TICG,[0.6124],[5],[[product]],"[[product, 0.6124, 5]]"
B00T2P253O,[0.802],[3],"[[everything, great, look, case, knock, dolphins, name, blurry]]","[[everything great look case knock dolphins name blurry, 0.802, 3]]"
B00T2SK93Y,[0.0],[4],[[]],"[[, 0.0, 4]]"
B00T9JOTTQ,[0.7311],[3],"[[case, color, none, le, slim, crack, day, use, dont, drop, phone]]","[[case color none le slim crack day use dont drop phone, 0.7311, 3]]"
B00T9K3450,[0.5719],[5],"[[excellent, product]]","[[excellent product, 0.5719, 5]]"
B00TADC1LY,[0.0],[5],[[describe]],"[[describe, 0.0, 5]]"
B00TBELD02,[0.9409],[5],"[[fit, lot, extra, room, cable, earbuds, quality, sturdy, material, protects, headphone]]","[[fit lot extra room cable earbuds quality sturdy material protects headphone, 0.9409, 5]]"
B00TKM8VT6,[0.4404],[5],[[purchase]],"[[purchase, 0.4404, 5]]"
B00TPHXQCS,[-0.3911],[4],"[[unit, nice, im, use, google, cardboard, application, iphone, development, surprise, everything, isnt, synched, headset, part]]","[[unit nice im use google cardboard application iphone development surprise everything isnt synched headset part, -0.3911, 4]]"
B00TUMMJGM,[0.2023],[4],"[[work, fine]]","[[work fine, 0.2023, 4]]"
B00TWIRJ5K,[0.8271],[5],"[[elegant, quality, leather, summary, expect, blackberry, case, recommendedbr, side, nothing, product, mention, think, case, side, consider, value, cell, phone, worth, penny]]","[[elegant quality leather summary expect blackberry case recommendedbr side nothing product mention think case side consider value cell phone worth penny, 0.8271, 5]]"
B00TXDRWW4,[0.9489],[5],"[[case, put, phone, thing, let, know, phone, protect, thing, nice, price]]","[[case put phone thing let know phone protect thing nice price, 0.9489, 5]]"
B00TXV1326,"[0.9658, -0.7885, 0.7938, 0.7879]","[5, 3, 5, 4]","[[nice, use, month, drop, time, phone, remain, protect, havent, lose, crystal], [talk, shin, star, photograph, dont, justice, piece, jewelry, accessorizes, hand, use, phone, love, love, love, ], [yes, beautiful, case, hate, cant, remove, come], [case, use, everyday, havent, lose, stone, make]]","[[nice use month drop time phone remain protect havent lose crystal, 0.9658, 5], [talk shin star photograph dont justice piece jewelry accessorizes hand use phone love love love , -0.7885, 3], [yes beautiful case hate cant remove come, 0.7938, 5], [case use everyday havent lose stone make, 0.7879, 4]]"
B00U7CLJ7O,[-0.8625],[2],"[[length, plus, quality, poor, last, couple, month, fail, loose, connection, phone, charge, port, stop, charge, time]]","[[length plus quality poor last couple month fail loose connection phone charge port stop charge time, -0.8625, 2]]"
B00UKLDGX2,[0.7906],[3],"[[nice, case, love, kick, stand, didnt, need, pen]]","[[nice case love kick stand didnt need pen, 0.7906, 3]]"
B00UMH5B6O,"[0.3071, 0.6597]","[4, 5]","[[cool, case, suck, put, phone, way, way, better, slide, belt, holster, screen, face], [thank, u]]","[[cool case suck put phone way way better slide belt holster screen face, 0.3071, 4], [thank u, 0.6597, 5]]"
B00UNNLJOU,"[-0.5733, 0.0516]","[1, 5]","[[fit, phone, problem, bulky, stiff, hot, wear, wore, wont, use], [keep, phone, secure, arm, slippage]]","[[fit phone problem bulky stiff hot wear wore wont use, -0.5733, 1], [keep phone secure arm slippage, 0.0516, 5]]"
B00UNRQJQ4,[0.7783],[5],"[[product, pricebr, yes, reccomended]]","[[product pricebr yes reccomended, 0.7783, 5]]"
B00UUE3XDW,[0.5267],[5],[[get]],"[[get, 0.5267, 5]]"
B00UVSOMWI,[0.5927],[3],"[[expect, something, sturdier, piece, plastic, thats, paint, silver, look, well, picture]]","[[expect something sturdier piece plastic thats paint silver look well picture, 0.5927, 3]]"
B00UYX2VMS,"[-0.1027, 0.0, 0.34]","[3, 1, 4]","[[case, people, hearing, ne, call], [people, talk, phone], [put, cover, take, verizon, say, cover, threw]]","[[case people hearing ne call, -0.1027, 3], [people talk phone, 0.0, 1], [put cover take verizon say cover threw, 0.34, 4]]"
B00V47C858,[0.296],[2],"[[ok, cant, press, button, front, screen, cover, press, screen, button, un]]","[[ok cant press button front screen cover press screen button un, 0.296, 2]]"
B00V8HP04A,[0.9463],[5],"[[crazy, fast, ship, came, otter, box, packaging, etc, otter, box, im, happy, product, price, pay, super, awesome, ]]","[[crazy fast ship came otter box packaging etc otter box im happy product price pay super awesome , 0.9463, 5]]"
B00VA0B3D2,[-0.693],[1],"[[return, product, screen, product]]","[[return product screen product, -0.693, 1]]"
B00VELEPBO,[0.2609],[2],"[[case, way, need, lot, lighter]]","[[case way need lot lighter, 0.2609, 2]]"
B00VHS8NNU,[0.8481],[5],"[[fit, great, picture, awesome, show]]","[[fit great picture awesome show, 0.8481, 5]]"
B00VIYD71G,[-0.8797],[2],"[[sheet, metal, hinge, spring, go, month, use, weaken, hinge, spring, belt, clip, pop, belt, remove, jacket, exit, car, protection, seem, spite, knock, belt, pavement, damage, concern, loss]]","[[sheet metal hinge spring go month use weaken hinge spring belt clip pop belt remove jacket exit car protection seem spite knock belt pavement damage concern loss, -0.8797, 2]]"
B00VK18CDA,[0.4404],[5],"[[work, water, case]]","[[work water case, 0.4404, 5]]"
B00VQ8RJTA,"[0.9933, -0.5786, 0.6369, 0.6956]","[4, 1, 5, 5]","[[car, want, get, decent, car, stereo, thing, aux, fm, hand, calling, cdmp, player, usb, video, support, dvd, rear, camera, want, budget, lot, consideration, confusion, go, vx, say, disappoint, fit, look, thing, saysbr, prosbr, different, eq, setting, inputbr, follow, ui, screen, excellent, dvd, watchingbr, decent, bluetooth, pair, speedbr, smooth, installation, issue, whatsoeverbr, rear, camera, viewbr, good, dvd, controlsbr, doesnt, look, cheapbr, br, consbr, audio, quality, blame, speaker, thoughbr, boot, time, br, installationbr, br, stereo, range, week, recommend], [instal, ford, escape, sound, great, litlle, trouble, bluetooth, call, think, location, nice, product, price], [price, good, gone, upper, model, ability, change, color, wallpaper], [buy, find, volt, fuse, require, car, audio, equipment, want, wow, wish, purchase, equipment, require, volt, fuse, radio, pure, garbage, read, good, review, want, warn, thing, work, struggle, read, iphone, usb, device, touchscreen, useless, bluetooth, stop, work, month, customer, service, rude, dismissivebr, br, read, review, buy, product, good, luck]]","[[car want get decent car stereo thing aux fm hand calling cdmp player usb video support dvd rear camera want budget lot consideration confusion go vx say disappoint fit look thing saysbr prosbr different eq setting inputbr follow ui screen excellent dvd watchingbr decent bluetooth pair speedbr smooth installation issue whatsoeverbr rear camera viewbr good dvd controlsbr doesnt look cheapbr br consbr audio quality blame speaker thoughbr boot time br installationbr br stereo range week recommend, 0.9933, 4], [instal ford escape sound great litlle trouble bluetooth call think location nice product price, -0.5786, 1], [price good gone upper model ability change color wallpaper, 0.6369, 5], [buy find volt fuse require car audio equipment want wow wish purchase equipment require volt fuse radio pure garbage read good review want warn thing work struggle read iphone usb device touchscreen useless bluetooth stop work month customer service rude dismissivebr br read review buy product good luck, 0.6956, 5]]"
B00VQEOZIW,[0.867],[2],"[[ok, case, purchase, couple, month, preinstalled, glass, break, easy, time, oreder, see]]","[[ok case purchase couple month preinstalled glass break easy time oreder see, 0.867, 2]]"
B00VSQ2X4Q,[-0.5994],[4],"[[job, complaint]]","[[job complaint, -0.5994, 4]]"
B00VTN5TAI,[0.4019],[2],"[[rubber, gasket, shine, keep, pop, keep, band, liking]]","[[rubber gasket shine keep pop keep band liking, 0.4019, 2]]"
B00VVUDBEU,[0.0382],[5],"[[case, disappoint, thank]]","[[case disappoint thank, 0.0382, 5]]"
B00VWBX6F2,[0.9485],[3],"[[cute, love, protecting, phone, love, come, screen, protector, phone, case, month, kickstand, break, use, tape, keep, mention, cant, use, kickstand, anymore]]","[[cute love protecting phone love come screen protector phone case month kickstand break use tape keep mention cant use kickstand anymore, 0.9485, 3]]"
B00VWU4134,[-0.7506],[1],"[[pain, open, headphone, adapter, broke, us, pain]]","[[pain open headphone adapter broke us pain, -0.7506, 1]]"
B00VZHC2MG,[0.1531],[3],"[[ok, work]]","[[ok work, 0.1531, 3]]"
B00W4AH4YE,[0.9079],[4],"[[selfie, stick, buy, gift, friend, everyone, love, stick, sturdy, fit, type, phone, try, try, micromax, samsung, iphone, sony, nexus, us, click, action, work, get, issue, micromax, phone, download, software, google, playstore, recognize, bluetooth, click, phone, work, time, anything, course, plug, inbr, br, stick, come, headache, carry, battery, compactbr, br, consider, price, nice, product, order, ensure, choose, color, want, dont, chose, color, default, get, stick, pink, color, handle]]","[[selfie stick buy gift friend everyone love stick sturdy fit type phone try try micromax samsung iphone sony nexus us click action work get issue micromax phone download software google playstore recognize bluetooth click phone work time anything course plug inbr br stick come headache carry battery compactbr br consider price nice product order ensure choose color want dont chose color default get stick pink color handle, 0.9079, 4]]"
B00W5JAZPE,[0.3612],[4],[[lot]],"[[lot, 0.3612, 4]]"
B00W5PSTN8,[0.6486],[2],"[[make, rubber, outer, cover, prefer, thicker, pvc, vinyl, cover, smooth, handlebr, reorder]]","[[make rubber outer cover prefer thicker pvc vinyl cover smooth handlebr reorder, 0.6486, 2]]"
B00WA08ZOQ,[0.743],[5],"[[case, fit]]","[[case fit, 0.743, 5]]"
B00WT1Q44O,[0.0],[5],[[excelente]],"[[excelente, 0.0, 5]]"
B00WU4C98K,"[0.7906, 0.1176, -0.154, 0.9184, 0.5849, 0.5994, 0.802, 0.0, 0.6808]","[5, 5, 5, 5, 5, 5, 5, 5, 5]","[[considerate, give, protector, package, good, ], [dont, let, review, fool, take, min, install, peel, film, slide, frame, put, phone, frame, slide, snap, back, place, look, classy, sure, protect, offer, bit, protection], [block, strengthbr, buy, aluminum, bumper, casebut, block, case, frame, hug, edge, phone, skin, keep], [back, covergiving, iphone, protection], [arrive, expect, look], [seller, give, bookmarkits], [difficult, get, seatedbr, take, time, put, case, settle, piece, cake], [protect, camera, worth, price], [light, weight]]","[[considerate give protector package good , 0.7906, 5], [dont let review fool take min install peel film slide frame put phone frame slide snap back place look classy sure protect offer bit protection, 0.1176, 5], [block strengthbr buy aluminum bumper casebut block case frame hug edge phone skin keep, -0.154, 5], [back covergiving iphone protection, 0.9184, 5], [arrive expect look, 0.5849, 5], [seller give bookmarkits, 0.5994, 5], [difficult get seatedbr take time put case settle piece cake, 0.802, 5], [protect camera worth price, 0.0, 5], [light weight, 0.6808, 5]]"
B00WXVPNU6,[0.6997],[5],"[[crystal, clear, place, lg]]","[[crystal clear place lg, 0.6997, 5]]"
B00WZT2A02,"[0.9478, 0.3716, 0.7783, 0.6478, 0.0, -0.1531, -0.3612, 0.9268, 0.0, 0.296, 0.7425, -0.7201, 0.0]","[3, 4, 5, 5, 1, 1, 4, 4, 5, 5, 5, 1, 1]","[[productno, instruction, look, youtube], [ok], [screen, arrive, day, package, quality, screen, good, reason, give, star, say, description, instruction, include, go, instruction, internet, device, view, instruction, instruction, website, detail, picture, illustration], [fix, apple, screen, anyone], [month, start, come, apart, stop, work], [put, screen, lock, phone, issue, seem, form, get, flush, filing, hand, corner, lock, leave, corner, glass, separate, display, portion, disappoint, aftermarket, product, cant, expect, quality, guessbr, br, buy, phone, cover, wrap, screen, hold, togetherbr, br, impress, tool, kit, screwdriver, magnetize, super, dealing, tiny, screwsbr, br, others, take, youtube, website, get, complete, instruction, include, package, help], [something, wrong, screen, iphone, day, use, screen, pop, digitizer, seem, wasnt], [install, work], [c, home, button, configuration], [work, tool, unscrew, screw], [didnt, work], [quality, fix, wife, phone, everybody, want, fix, see, instruction, watch, video, get, job, done], [quality, replacement, screen, replacement, straight]]","[[productno instruction look youtube, 0.9478, 3], [ok, 0.3716, 4], [screen arrive day package quality screen good reason give star say description instruction include go instruction internet device view instruction instruction website detail picture illustration, 0.7783, 5], [fix apple screen anyone, 0.6478, 5], [month start come apart stop work, 0.0, 1], [put screen lock phone issue seem form get flush filing hand corner lock leave corner glass separate display portion disappoint aftermarket product cant expect quality guessbr br buy phone cover wrap screen hold togetherbr br impress tool kit screwdriver magnetize super dealing tiny screwsbr br others take youtube website get complete instruction include package help, -0.1531, 1], [something wrong screen iphone day use screen pop digitizer seem wasnt, -0.3612, 4], [install work, 0.9268, 4], [c home button configuration, 0.0, 5], [work tool unscrew screw, 0.296, 5], [didnt work, 0.7425, 5], [quality fix wife phone everybody want fix see instruction watch video get job done, -0.7201, 1], [quality replacement screen replacement straight, 0.0, 1]]"
B00X2CTWAC,[0.1513],[1],"[[screw, fall, tighten, day, rubber, cheap]]","[[screw fall tighten day rubber cheap, 0.1513, 1]]"
B00X5KVQLY,[0.7828],[5],"[[work, love]]","[[work love, 0.7828, 5]]"
B00XBX5IFK,[0.9669],[5],"[[get, wife, like, picture, fun, quality, wrap, excellent, fit, phone, look, happy]]","[[get wife like picture fun quality wrap excellent fit phone look happy, 0.9669, 5]]"
B00XGOYZLW,[0.6369],[5],[[time]],"[[time, 0.6369, 5]]"
B00XI06VY8,[0.0747],[3],"[[youve, crack, microsoft, lumia, screen, wouldnt, recommend, buy, product, google, black, lcd, replacement, nokia, microsoft, lumia, lcd, click, link, aliexpresscom, link, site, sell, replacement, screen, plastic, frame, backing, glass, lcd, screen, display]]","[[youve crack microsoft lumia screen wouldnt recommend buy product google black lcd replacement nokia microsoft lumia lcd click link aliexpresscom link site sell replacement screen plastic frame backing glass lcd screen display, 0.0747, 3]]"
B00XMJEEKS,[-0.7963],[4],"[[fit, mini, phone, doesnt, attach]]","[[fit mini phone doesnt attach, -0.7963, 4]]"
B00XW1AVAS,"[0.0, 0.9312, -0.3412]","[2, 5, 2]","[[amaze, product, relief, road, lot, help, business, car, im, love, bluetooth, transmitter, recommend], [company, ship, device, isnt, good, blow, fuse]]","[[amaze product relief road lot help business car im love bluetooth transmitter recommend, 0.0, 2], [company ship device isnt good blow fuse, 0.9312, 5], [, -0.3412, 2]]"
B00XZ2OYOS,"[0.8621, 0.9229]","[3, 5]","[[delight, circle, case, lg, g, amaze, innovation, clock, face, choice, thing, phone, lock, case, close, thing, add, access, alarm, clock, case, reason, choose, lg, g, phone, please], [quality, case, awesome, leather, feel, color, true, picture, picture, magnet, work, put, phone, fridge, play, music, listen, im, wash, dish, case, stay, convenient, pocket, credit, card, fit, card, nicelybr, br, take, star, magnetsbr, magnet, nice, feature, believe, put, ear, hearing, people, phone, hold, phone, ear, notice, fold, phone, case, talk, take, phone, case, clarity, come, use, phone, case, fold, call, everyone, talk, sound, muffle, underwater, fold, back, take, phone, case, clarity, clear, understand, person, phone, speaker, phone, notice, quality, changebr, br, purchase, case, none, review, mention, type, interference, phone, notice, poor, speaker, quality, use, case]]","[[delight circle case lg g amaze innovation clock face choice thing phone lock case close thing add access alarm clock case reason choose lg g phone please, 0.8621, 3], [quality case awesome leather feel color true picture picture magnet work put phone fridge play music listen im wash dish case stay convenient pocket credit card fit card nicelybr br take star magnetsbr magnet nice feature believe put ear hearing people phone hold phone ear notice fold phone case talk take phone case clarity come use phone case fold call everyone talk sound muffle underwater fold back take phone case clarity clear understand person phone speaker phone notice quality changebr br purchase case none review mention type interference phone notice poor speaker quality use case, 0.9229, 5]]"
B00Y1I325M,"[0.0, 0.8508]","[1, 5]","[[receive, screen, protector, fit], [didnt, work]]","[[receive screen protector fit, 0.0, 1], [didnt work, 0.8508, 5]]"
B00Y2P0T1E,[0.25],[3],[[alright]],"[[alright, 0.25, 3]]"
