B00X5L8P8K,"[0.7817, 0.9021, 0.0, -0.5409, -0.0426, 0.0, -0.2732, 0.5356]","[4, 5, 1, 4, 1, 5, 3, 3]","[[nice, gadget, customer, service, problem, send, email, get, respond, hour, replacement, item, arrive, day, impress, couldnt, happierbr, product, come, remote, dont, use, function, work, quality, sound, phone, music, music, reception, poor, fine, sweet, spot, vehicle, try, put, instal, car], [mad, work], [work, got, refund], [unplug, sound], [simple, use, volume, louder, nice, leave, car, turn, unit, pair, go], [need], [screen, melt, summer, heat, leave, car, day, expecting, product, hop, use, couple, day, function, look, deform, hiss, noise, bit, annoy, recommend]]","[[nice gadget customer service problem send email get respond hour replacement item arrive day impress couldnt happierbr product come remote dont use function work quality sound phone music music reception poor fine sweet spot vehicle try put instal car, 0.7817, 4], [mad work, 0.9021, 5], [work got refund, 0.0, 1], [unplug sound, -0.5409, 4], [simple use volume louder nice leave car turn unit pair go, -0.0426, 1], [need, 0.0, 5], [screen melt summer heat leave car day expecting product hop use couple day function look deform hiss noise bit annoy recommend, -0.2732, 3], [, 0.5356, 3]]"
B00XL4JZKI,[0.6048],[5],"[[try, band, reaction, metal, apples, sport, band, leather, band, arent, genuin, leather, crack, bend, band, amaze, rash, metal, clasp, crack, strap, buy, red, went, buy, wish, offer, color]]","[[try band reaction metal apples sport band leather band arent genuin leather crack bend band amaze rash metal clasp crack strap buy red went buy wish offer color, 0.6048, 5]]"
B00XVVO1IW,[0.765],[5],"[[gotten, lot, comment, itbr, concern, flap, get, way, try, make, call]]","[[gotten lot comment itbr concern flap get way try make call, 0.765, 5]]"
B00XW32DQG,[0.8885],[4],"[[husband, love, case, he, phone, month, help]]","[[husband love case he phone month help, 0.8885, 4]]"
B00XYV9W3S,[0.2023],[5],"[[light, soft, rubbery, total, klutz, phone, drop, seems, give, cushioning, cover, tight, phone, freeze, put, squeeze, hard]]","[[light soft rubbery total klutz phone drop seems give cushioning cover tight phone freeze put squeeze hard, 0.2023, 5]]"
B00Y2HGWT0,[-0.4767],[3],"[[poor, quality, image]]","[[poor quality image, -0.4767, 3]]"
B00Y3AI6X6,[0.9553],[5],"[[wow, wireless, charger, perfect, compact, travel, design, position, angle, compare, charger, others, win, angle, position, wireless, technology, inspire, order, afford, work, desk, bedside, work, are, home, etc, charge, surprise, warm, phone, charge, phenomenon, recommend, difference, position, ability, sit, height, work, surface, add, reflection, device, screen, reposition, angle, charger, house, phone, galaxy, series, phone, use, add, battery, charging, receiver, module, asinbqgmkik, qifull, ultrathin, qi, standard, wireless, charge, receiver, module, samsung, galaxy, black, galaxy, httpwwwamazoncomwirelesschargerchargingreceiversamsungdpbdvsdwrefsrieutfqidsrkeywordsswirelesschargingreceiverpebpperidtjwdsnadhxgds, recommend, item]]","[[wow wireless charger perfect compact travel design position angle compare charger others win angle position wireless technology inspire order afford work desk bedside work are home etc charge surprise warm phone charge phenomenon recommend difference position ability sit height work surface add reflection device screen reposition angle charger house phone galaxy series phone use add battery charging receiver module asinbqgmkik qifull ultrathin qi standard wireless charge receiver module samsung galaxy black galaxy httpwwwamazoncomwirelesschargerchargingreceiversamsungdpbdvsdwrefsrieutfqidsrkeywordsswirelesschargingreceiverpebpperidtjwdsnadhxgds recommend item, 0.9553, 5]]"
B00YD6QRCW,[0.7184],[4],"[[phone, case, thick, holder, shallow, hold, phone, work, phone, case, quality, seem]]","[[phone case thick holder shallow hold phone work phone case quality seem, 0.7184, 4]]"
B00YEJ9XKG,[0.8442],[4],"[[case, wont, accommodate, lighten, amazon, apple, cord, work, fine, keep, use, take, charge]]","[[case wont accommodate lighten amazon apple cord work fine keep use take charge, 0.8442, 4]]"
B00YI9Q6SO,[0.8793],[4],"[[nice, great, quality, love, design, apply, look, time, pattern, case, order, make, thing, lg, g, stylo, picture, inner, gel, come, bottom, picture, phone, fit, prying, tool, stylus, order, case, come, package]]","[[nice great quality love design apply look time pattern case order make thing lg g stylo picture inner gel come bottom picture phone fit prying tool stylus order case come package, 0.8793, 4]]"
B00YM48OSU,[0.5106],[5],"[[well, use, cover, bubble]]","[[well use cover bubble, 0.5106, 5]]"
B00Z9TBRLI,[0.6249],[5],"[[case, last, longer, expect]]","[[case last longer expect, 0.6249, 5]]"
B00ZBMH07S,[0.1324],[2],"[[duty, case, seem, problem, flap, charger, port, wont, close, lesson, learn, cheap, case]]","[[duty case seem problem flap charger port wont close lesson learn cheap case, 0.1324, 2]]"
B00ZBSGVE0,[0.4019],[1],"[[look, ring, screen, mean, buy, fact, leave, circle, hallow, fail, thin, sheet, plastic, circle, make, case, perfect]]","[[look ring screen mean buy fact leave circle hallow fail thin sheet plastic circle make case perfect, 0.4019, 1]]"
B00ZC3C684,[0.3523],[4],"[[seems, good, problem, fit, therefore, difficult, get, lose]]","[[seems good problem fit therefore difficult get lose, 0.3523, 4]]"
B00ZDUEEP4,[-0.0289],[3],"[[month, use, whole, gold, paint, peal, case, look, ald, use, case, want, looking, case, protects, phone, count, run]]","[[month use whole gold paint peal case look ald use case want looking case protects phone count run, -0.0289, 3]]"
B00ZFWU8JG,"[-0.8476, 0.0, 0.2023, 0.6369, 0.7602, 0.6369, 0.2382, 0.5112, 0.6249, 0.0, -0.0857, -0.8436, 0.0, -0.4821, 0.1779]","[1, 1, 1, 5, 1, 5, 3, 2, 5, 1, 1, 2, 1, 5, 1]","[[get, message, phone, isnt, support, work, notice, charge], [cord, take, forever, charge, device], [cord, box, charge, iphone, charge, ipad, air, ipad, ding, show, message, charge], [garbage, cycle, power, phone, go, buy], [doesnt, work], [one, certify, phone, darn, notice, go, time, plug, phone, remind, bought, cord, charge, ok, seem, ala, see, work], [lightning, end, make, tolerance, apple, wiggle, fit, charge, buy], [work, fine, month], [ipad, air, cord, package, cord, look, cool, nylon, braid, inside, plastic, outer, cover, disappointment, charge, ipad, hour, chargedbr, br, day, bit, comprise, plug, head, part, plug, tablet, cord, rest, order, work, needle, say, return, amazon, spent, couple, buck, anker, brand, cord, perform, flawlesslybr, br, defense, cord, come, pack, fail, return, pair, try, use, cheap, make, china, provide, quality, control, factory, cord, fine, base, experience, product], [awesome], [design, length, charge, phone, super, im, sure, mean, generation, iphones, anyway, iphone, take, charge, think, drain, battery], [dont, waste, money, cord, convenient, charge, time, plug, time, check, phone, say, accessory, wake, morning, phone, stop, charge, junk, product, love, return, get, money], [cable, dont, work, hook, iphone, mac, connectsdisconnects, unplug, wont, return, pay, isnt, worth, time, heck], [cord]]","[[get message phone isnt support work notice charge, -0.8476, 1], [cord take forever charge device, 0.0, 1], [cord box charge iphone charge ipad air ipad ding show message charge, 0.2023, 1], [garbage cycle power phone go buy, 0.6369, 5], [doesnt work, 0.7602, 1], [one certify phone darn notice go time plug phone remind bought cord charge ok seem ala see work, 0.6369, 5], [lightning end make tolerance apple wiggle fit charge buy, 0.2382, 3], [work fine month, 0.5112, 2], [ipad air cord package cord look cool nylon braid inside plastic outer cover disappointment charge ipad hour chargedbr br day bit comprise plug head part plug tablet cord rest order work needle say return amazon spent couple buck anker brand cord perform flawlesslybr br defense cord come pack fail return pair try use cheap make china provide quality control factory cord fine base experience product, 0.6249, 5], [awesome, 0.0, 1], [design length charge phone super im sure mean generation iphones anyway iphone take charge think drain battery, -0.0857, 1], [dont waste money cord convenient charge time plug time check phone say accessory wake morning phone stop charge junk product love return get money, -0.8436, 2], [cable dont work hook iphone mac connectsdisconnects unplug wont return pay isnt worth time heck, 0.0, 1], [cord, -0.4821, 5], [, 0.1779, 1]]"
B00ZKVS72W,[-0.7061],[1],"[[im, fan, case, make, call, hear, headphones, annoy, dont, use, case, anymore]]","[[im fan case make call hear headphones annoy dont use case anymore, -0.7061, 1]]"
B00ZQNF45W,"[0.8516, 0.9579, 0.0, -0.6249, 0.9857, 0.6213, -0.6089, 0.3612, 0.5223]","[4, 5, 1, 1, 4, 4, 1, 5, 1]","[[work, stay, load, matter, dothios, hate, stuff, amazon, cant, go, store, see, work, etc], [user, putting, music, folder, joke, figure, get, music, play, random, play, song, song, nothing, player], [mp, player, limitation, quirk, learn, quicker, sound, good, headphone, use, didnt, care, ear, bud, come, light, weight, feel, bit, cheep, question, durability, month, wife, run, wash, forget, take, pocket, consider, base, pricebr, br, note, use, listen, mp, couldnt, imagine, watch, video, couple, minute, go, view, photo, consider, ebook, function, worthless, screen, read, anything, extend, period, record, function, prove, need, nice, act, radio, havent, test, came, game, boxman, prove, br, thing, come, term, maneuver, menu, fact, menu, button, top, circular, control, select, button, use, play, button, function, go, side, side, use, forward, backward, button, side, control, get, everything, fall, br, try, maneuver, music, selection, prove, challenge, think, figure, info, mention, make, sense, here, quick, rundown, select, music, wasnt, sparse, instruction, couldnt, guide, internet, use, forwardbackward, button, selection, click, menu, button, take, list, click, menu, button, folder, selection, use, forwardbackward, button, get, click, menu, button, root, selection, use, forwardbackward, button, folder, whatever, folder, set, contain, music, click, menu, button, display, folder, load, device, mine, show, artist, use, forwardbackward, button, go, artist, click, menu, see, album, click, menu, get, album, menu, time, get, album, use, play, button, start, playing, music, intuitive, figure, okay, note, sort, folder, weird, use, forwardbackward, button, keep, scroll, find, look, forbr, br, note, turn, use, second, im, adjust, settingsbr, br, price, im, complain, control, amount, mp, file, store, micro, sd, slot, good, pricebr, br, audiblecom, user, take, note, devise, appear, work, proprietary, file, try, load, device, manager, software, list, thats, annoy, thats], [thats, expect, thing, user, ipod, course, doesnt, sync, itunes, service, convert, song, mp, drag, device, connect, computer, drm, protect, itunes, account, youre, go, get, device, sound, quality, good, cant, tell, difference, ipod, screen, graphic, bottom, line, work, battery, life, decent, meet, need], [thank], [frustration, request, refund, accept, keep, useless, care, pay, return, shipping, offer, replace, instruction, booklet, joke, understand, turn, charge, setup, get, language, change, problem, deal, satisfy, way, say, btw, connect, computer, expect, help, nope, nothing, problem, electronics, day, rate, recommend], [work, follow, instruction, send], [understand, reason, give, rating, product, cant, say, fact, give, buy, mp, player, know, youre, get, simple, interface, simple, design, expect, frill, thrill, buck, expect, went, target, walmart, find, cheapest, mp, player, least, mediocre, review, cost, found, didnt, receive, total, garbage, rating, area, dollar, area, star, user, experience, problem, something, anyone, like, see, admit, control, interface, bit, confuse, nothing, couldnt, figure, day, use, toss, sim, card, player, come, gig, use, estimating, average, mb, fit, range, song, recommend, youre, someone, like, search, song, sound, get, loud, depend, headphone, purpose, get, mp, player, take, gym, deal, something, happens, song, time, player, perfect, sum, feel, get, moneys, product, keep, expectation, temper, expect, interface, confusion, start, go, buy, couple, case, something, happens, backup, drop, something]]","[[work stay load matter dothios hate stuff amazon cant go store see work etc, 0.8516, 4], [user putting music folder joke figure get music play random play song song nothing player, 0.9579, 5], [mp player limitation quirk learn quicker sound good headphone use didnt care ear bud come light weight feel bit cheep question durability month wife run wash forget take pocket consider base pricebr br note use listen mp couldnt imagine watch video couple minute go view photo consider ebook function worthless screen read anything extend period record function prove need nice act radio havent test came game boxman prove br thing come term maneuver menu fact menu button top circular control select button use play button function go side side use forward backward button side control get everything fall br try maneuver music selection prove challenge think figure info mention make sense here quick rundown select music wasnt sparse instruction couldnt guide internet use forwardbackward button selection click menu button take list click menu button folder selection use forwardbackward button get click menu button root selection use forwardbackward button folder whatever folder set contain music click menu button display folder load device mine show artist use forwardbackward button go artist click menu see album click menu get album menu time get album use play button start playing music intuitive figure okay note sort folder weird use forwardbackward button keep scroll find look forbr br note turn use second im adjust settingsbr br price im complain control amount mp file store micro sd slot good pricebr br audiblecom user take note devise appear work proprietary file try load device manager software list thats annoy thats, 0.0, 1], [thats expect thing user ipod course doesnt sync itunes service convert song mp drag device connect computer drm protect itunes account youre go get device sound quality good cant tell difference ipod screen graphic bottom line work battery life decent meet need, -0.6249, 1], [thank, 0.9857, 4], [frustration request refund accept keep useless care pay return shipping offer replace instruction booklet joke understand turn charge setup get language change problem deal satisfy way say btw connect computer expect help nope nothing problem electronics day rate recommend, 0.6213, 4], [work follow instruction send, -0.6089, 1], [understand reason give rating product cant say fact give buy mp player know youre get simple interface simple design expect frill thrill buck expect went target walmart find cheapest mp player least mediocre review cost found didnt receive total garbage rating area dollar area star user experience problem something anyone like see admit control interface bit confuse nothing couldnt figure day use toss sim card player come gig use estimating average mb fit range song recommend youre someone like search song sound get loud depend headphone purpose get mp player take gym deal something happens song time player perfect sum feel get moneys product keep expectation temper expect interface confusion start go buy couple case something happens backup drop something, 0.3612, 5], [, 0.5223, 1]]"
B00ZTDP6YI,[0.0],[5],[[loveit]],"[[loveit, 0.0, 5]]"
B00ZVGDH9E,[0.8189],[5],"[[fit, drop, phone, happens, talking, phone, people]]","[[fit drop phone happens talking phone people, 0.8189, 5]]"
B00ZYEY9CC,[0.7832],[5],"[[hunt, case, iphone, plus, came, verus, case, satisfy, loss, others, state, look, feel, build, youre, look, case, buy]]","[[hunt case iphone plus came verus case satisfy loss others state look feel build youre look case buy, 0.7832, 5]]"
B0102XWFXY,[0.6249],[5],[[product]],"[[product, 0.6249, 5]]"
B010EYKBYG,[0.2382],[5],"[[iphone, case, light, light, con, take, apart]]","[[iphone case light light con take apart, 0.2382, 5]]"
B010GJY0DM,[0.8725],[1],"[[get, case, time, went, picture, start, fade, color, start, come, dont, print, case, wish, finish, didnt, wear]]","[[get case time went picture start fade color start come dont print case wish finish didnt wear, 0.8725, 1]]"
B010TWK800,[0.886],[5],"[[perfect, case, waste, money, look, make, slim, case, stand, use, iphone, everything, travel, work, ebook, reading, movie, try, case, stand, bulky, make, find, accident, wow, love, trifold, stand, back, case, ultra, slip, perfect, case, solve, problem, money, waste, case, order, hahahahabr, br, update, sad, stand, separate, use, lot, watch, movie, fly, love, product]]","[[perfect case waste money look make slim case stand use iphone everything travel work ebook reading movie try case stand bulky make find accident wow love trifold stand back case ultra slip perfect case solve problem money waste case order hahahahabr br update sad stand separate use lot watch movie fly love product, 0.886, 5]]"
B010YFE07Y,[0.0],[1],"[[work, day, didnt, charge, got, message, cell, reading, accessory, iphone]]","[[work day didnt charge got message cell reading accessory iphone, 0.0, 1]]"
B0110NIK8O,"[-0.25, 0.7902, 0.6124]","[5, 4, 4]","[[slim, case, work, expect, provides, amount, protection, add, bulk, problem], [protection, fro, money, case, fit, edge, camera, line, wellbr, buy, buy, price], [fit, moto, g, rd, gen, bulky, port, remain, powervolume, button, responsive, slip, case]]","[[slim case work expect provides amount protection add bulk problem, -0.25, 5], [protection fro money case fit edge camera line wellbr buy buy price, 0.7902, 4], [fit moto g rd gen bulky port remain powervolume button responsive slip case, 0.6124, 4]]"
B0112S9KM2,[0.5719],[5],"[[excellent, quality, come, suppose]]","[[excellent quality come suppose, 0.5719, 5]]"
B011HHZ82O,[0.4019],[2],"[[constant, rustle, sound, edge, hearing, use, earphone, feel, fall, problem, havent, earphone, ive, usedbr, br, volume, mechanism, doesnt, work, fire, phone, pauseplay, button, worksbr, br, compare, amazon, premium, earphone, amazon, one, well]]","[[constant rustle sound edge hearing use earphone feel fall problem havent earphone ive usedbr br volume mechanism doesnt work fire phone pauseplay button worksbr br compare amazon premium earphone amazon one well, 0.4019, 2]]"
B011IUHJ18,"[0.8834, 0.5719]","[5, 5]","[[get, wife, love, phone, fit, love, color, come, condition], [get, mother, love]]","[[get wife love phone fit love color come condition, 0.8834, 5], [get mother love, 0.5719, 5]]"
B011KHT4BW,[0.9794],[5],"[[case, seem, find, case, case, build, phone, need, say, im, cardinal, fan, case, snap, fit, drop, oops, nothing, happen, case, feel, phone, beautiful, protect]]","[[case seem find case case build phone need say im cardinal fan case snap fit drop oops nothing happen case feel phone beautiful protect, 0.9794, 5]]"
B011PK6FJI,[0.2617],[4],"[[quality, case, excellent, flip, case, phone, lg, g, samsung, galaxy, quality, far, case, soft, textured, material, mimic, phone, inside, part, phone, snap, flip, part, cover, screen, soft, rubber, rubber, help, keep, screen, phone, get, scratch, close, leave, rub, mark, wipe, cloth, shirt, case, idol, logo, display, chrome, alcatel, portion, phone, phone, snap, case, fitment, issue, port, button, minus, power, button, ill, address, laterbr, br, reason, case, receive, star, reason, case, touch, flip, case, use, control, function, flip, close, window, case, display, window, nothing, bum, find, information, display, lack, youll, see, time, date, alarm, time, text, youll, see, email, youll, see, white, envelope, thats, message, preview, anything, apps, instance, logo, shown, window, case, cover, lead, front, phone, there, way, know, snapchat, window, phone, music, open, power, button, hide, flap, flap, power, button, design, power, button, flap, material, hope, press, power, button, underneathth]]","[[quality case excellent flip case phone lg g samsung galaxy quality far case soft textured material mimic phone inside part phone snap flip part cover screen soft rubber rubber help keep screen phone get scratch close leave rub mark wipe cloth shirt case idol logo display chrome alcatel portion phone phone snap case fitment issue port button minus power button ill address laterbr br reason case receive star reason case touch flip case use control function flip close window case display window nothing bum find information display lack youll see time date alarm time text youll see email youll see white envelope thats message preview anything apps instance logo shown window case cover lead front phone there way know snapchat window phone music open power button hide flap flap power button design power button flap material hope press power button underneathth, 0.2617, 4]]"
B011R73UX8,[0.1901],[2],"[[order, case, csgo, case, fit, phone, thing, part, case, cover, button, push, button, cant, use, phone, case]]","[[order case csgo case fit phone thing part case cover button push button cant use phone case, 0.1901, 2]]"
B0126KKBBE,"[0.0, 0.765, 0.8004, 0.3182]","[5, 4, 5, 1]","[[direction, write, use, idea, seem], [order, work, work, sent, get, refund, work, charge, phone, juice, set, window, sill, go, get, emergency, camp, sure, come, handy, chalk, happens], [item, arrive, describe], [nice, amaze]]","[[direction write use idea seem, 0.0, 5], [order work work sent get refund work charge phone juice set window sill go get emergency camp sure come handy chalk happens, 0.765, 4], [item arrive describe, 0.8004, 5], [nice amaze, 0.3182, 1]]"
B012WTIH92,[-0.7476],[1],"[[item, suck, phone, ten, minute, go, slide, finger, screen, whole, screen, protector, move, finger, screen, doesnt, stay, stuck, phone, pointless, useless, product, waste, money]]","[[item suck phone ten minute go slide finger screen whole screen protector move finger screen doesnt stay stuck phone pointless useless product waste money, -0.7476, 1]]"
B01404S4WC,[0.6249],[5],"[[work, great]]","[[work great, 0.6249, 5]]"
