B011NR0BY8,"[-0.4019, 0.7264, 0.917, 0.5106]","[1, 5, 4, 4]","[[update, hisgadget, seller, reach, review, offer, support, product, give, troubleshoot, tip, offer, refund, product, meantime, ground, loop, isolator, order, come, mail, plugging, hb, aux, port, vehicle, honda, odyssey, work, hb, sound, performs, bluetooth, adapter, ground, loop, isolator, port, charge, adapter, nice, repurposed, vehicle, service, hisgadget, prompt, stand, product, satisfy, customer, youre, situation, want, use, third, party, cigarette, lighter, adapter, hb, good, choice, order, test, vehicle, prepare, order, ground, loop, isolator, httpwwwamazoncomgpproductbeaqtri, review, listen, smartphone, hate, radio, commercial, kinovo, btc, work, upgrade, smartphone, allow, quick, charging, btcs, charge, cigarette, adapter, buy, charge, adapter, port, himbox, unit, use, include, hardware, install, honda, odyssey, power, port, mm, aux, input, front, cabin, uninstalled, btc, instal, himbox, dare, stick, console, power, vehicle, plugin, dread, buzzwhine, begin, pair, phone, medium, stream, himbox, sound, performs, pause, unpaired, buzz, reinstall, btc, sound, improvements, sound, quality, btc, pro, vs, btc, usb, power, use, party, charger, port, come, unit, youll, need, qualcomm, quickcharge, base, plate, allow, take, vehicle, aux, port, fwd, rev, button, press, v, btc, observation, unit, day, update, review, clip, useless, imagine, clip, anything, car, clip, shirt, tie, microphone, youre, call, unit, power, pair, phone, unit, buzz, whine, medium, stream, ill, keep, value, use, party, charger, guess, ill, suck, pay, ground, loop, isolator, pain, cant, recommend, solution, add, bluetooth, capability, vehicle, id, recommend, kinovo, btc, cheaper, doesnt, require, purchase, get, perform, update, ground, loop, isolator, instal], [require, order, ground, loop, isolator, product, work, perfect, auto, connects, phone, device, turn, come, car, turn], [install, connection, better, sound, quality, bluetooth, adapter, use], [wish, go, star, echo, customer, support, item, return, amazon]]","[[update hisgadget seller reach review offer support product give troubleshoot tip offer refund product meantime ground loop isolator order come mail plugging hb aux port vehicle honda odyssey work hb sound performs bluetooth adapter ground loop isolator port charge adapter nice repurposed vehicle service hisgadget prompt stand product satisfy customer youre situation want use third party cigarette lighter adapter hb good choice order test vehicle prepare order ground loop isolator httpwwwamazoncomgpproductbeaqtri review listen smartphone hate radio commercial kinovo btc work upgrade smartphone allow quick charging btcs charge cigarette adapter buy charge adapter port himbox unit use include hardware install honda odyssey power port mm aux input front cabin uninstalled btc instal himbox dare stick console power vehicle plugin dread buzzwhine begin pair phone medium stream himbox sound performs pause unpaired buzz reinstall btc sound improvements sound quality btc pro vs btc usb power use party charger port come unit youll need qualcomm quickcharge base plate allow take vehicle aux port fwd rev button press v btc observation unit day update review clip useless imagine clip anything car clip shirt tie microphone youre call unit power pair phone unit buzz whine medium stream ill keep value use party charger guess ill suck pay ground loop isolator pain cant recommend solution add bluetooth capability vehicle id recommend kinovo btc cheaper doesnt require purchase get perform update ground loop isolator instal, -0.4019, 1], [require order ground loop isolator product work perfect auto connects phone device turn come car turn, 0.7264, 5], [install connection better sound quality bluetooth adapter use, 0.917, 4], [wish go star echo customer support item return amazon, 0.5106, 4]]"
B012A76DX8,[0.8316],[5],"[[seller, top, thing, initiate, communicating, seller, appreciate, check, purchase, addition, sell, nice, case, firm, texture, tight, fit, price, day, ship, cant, ask]]","[[seller top thing initiate communicating seller appreciate check purchase addition sell nice case firm texture tight fit price day ship cant ask, 0.8316, 5]]"
B012CB6ZA8,[0.9255],[5],"[[case, look, nice, protects, phone, use, feel, doesnt, get, dirty, rubber, case]]","[[case look nice protects phone use feel doesnt get dirty rubber case, 0.9255, 5]]"
B012YXW3ZU,[0.0],[1],"[[junk, work, week]]","[[junk work week, 0.0, 1]]"
B0136BDCYA,[-0.7018],[1],"[[cartoon, cute, case, fit, iphone, im, disappoint]]","[[cartoon cute case fit iphone im disappoint, -0.7018, 1]]"
B013D8WXG4,[0.7814],[5],"[[line, work, handle, share, case, type, phone, become, tell, case, sturdy, make, haul, drop, case, purchase, take, fall, ruining, phone, hold, case, look, color, pop, smooth, feel, sacrifice, grip, case, feel, fine, press, problem, use, camera, press, button, make, call, please, case]]","[[line work handle share case type phone become tell case sturdy make haul drop case purchase take fall ruining phone hold case look color pop smooth feel sacrifice grip case feel fine press problem use camera press button make call please case, 0.7814, 5]]"
B013F9T6SO,[0.6597],[5],"[[fit, phone]]","[[fit phone, 0.6597, 5]]"
