B00YAKRDA6,"[0.9412, 0.7392]","[5, 5]","[[stop, decide, smartphone, order, take, breath, read, review, blu, life, xl, sorry, read, review, research, phone, find, spec, took, hr, know, caught, eye, spec, get, gb, memory, problem, phone, gb, mem, use, lot, apps, didnt, take, fill, storage, think, use, sd, expansion, take, apps, couldnt, fit, mem, disappointment, sd, card, didnt, accept, apps, reason, gb, sd, mem, blu, life, let, transfer, lot, apps, keep, mem, use, love, core, cpu, gb, ram, joke, lead, hd, screen, quality, view, video, g, support, im, get, hotspot, let, get, wifi, tablet, need, seems, improvement, voice, speaker, phone, blu, studio, short, fast, brilliant, hd, screen, plenty, storage, g, let, forget, mp, front, camera, capacity, battery, whats, question, wait, order, blu, life, xl], [enjoy, phone, display, crystal, clear, resolution, function, problem, power, user, put, phone, thru, ringer, vacation, think, get, use, dual, sim, capability, phone, didnt, work, korea, guess, market, didnt, buy, purpose, learn, way, im, sure, great, need, put, gb, card, load, movie, watch, screen, wonderful, watch, use, gps, function, mapsawesome, take, picture, shoot, lot, video, download, different, camera, app, light, photo, suffer, bit, phone, camera, love, come, case, screen, protector, phone, thin, fit, pocket, want, androidgoogle, base, phone, wont, break, bank, blu]]","[[stop decide smartphone order take breath read review blu life xl sorry read review research phone find spec took hr know caught eye spec get gb memory problem phone gb mem use lot apps didnt take fill storage think use sd expansion take apps couldnt fit mem disappointment sd card didnt accept apps reason gb sd mem blu life let transfer lot apps keep mem use love core cpu gb ram joke lead hd screen quality view video g support im get hotspot let get wifi tablet need seems improvement voice speaker phone blu studio short fast brilliant hd screen plenty storage g let forget mp front camera capacity battery whats question wait order blu life xl, 0.9412, 5], [enjoy phone display crystal clear resolution function problem power user put phone thru ringer vacation think get use dual sim capability phone didnt work korea guess market didnt buy purpose learn way im sure great need put gb card load movie watch screen wonderful watch use gps function mapsawesome take picture shoot lot video download different camera app light photo suffer bit phone camera love come case screen protector phone thin fit pocket want androidgoogle base phone wont break bank blu, 0.7392, 5]]"
B00YGMXH44,[0.204],[3],"[[time, stick, touchscreen, watch, less]]","[[time stick touchscreen watch less, 0.204, 3]]"
B00YK8K9G8,[0.7501],[5],"[[quality, screen, film, glitter]]","[[quality screen film glitter, 0.7501, 5]]"
B00YQNBWRW,[0.4939],[4],"[[color, purpose, phone, slippery]]","[[color purpose phone slippery, 0.4939, 4]]"
B00ZCGVKVK,[0.7574],[5],"[[snug, fit, cost, happy]]","[[snug fit cost happy, 0.7574, 5]]"
B00ZKKT8A8,[0.9042],[5],"[[case, fit, love, texture, case, leather, love, complaint]]","[[case fit love texture case leather love complaint, 0.9042, 5]]"
B01090JQ9G,[0.2023],[1],"[[piece, hold, phone, top, bottom, crack, week]]","[[piece hold phone top bottom crack week, 0.2023, 1]]"
B010D8ULT8,[0.8769],[5],"[[love, battery, case, job, im, please]]","[[love battery case job im please, 0.8769, 5]]"
B010FLGVPG,[0.7184],[3],"[[jewel, fell]]","[[jewel fell, 0.7184, 3]]"
B010G0ENCE,"[0.4404, 0.4983, 0.5859]","[3, 2, 5]","[[couple, week, use, im, feel, result], [charge, night, cant, use, bedside, bright, blink, light, charge], [didnt, work, send, go, take, case, night, order, phone, charge, wouldnt, work, case, phone, shouldnt, matter, case, charge]]","[[couple week use im feel result, 0.4404, 3], [charge night cant use bedside bright blink light charge, 0.4983, 2], [didnt work send go take case night order phone charge wouldnt work case phone shouldnt matter case charge, 0.5859, 5]]"
B010NU4ZI4,[-0.2106],[4],"[[case, color, plastic, doesnt, stick, good, there, lot, bubble, get]]","[[case color plastic doesnt stick good there lot bubble get, -0.2106, 4]]"
B010R8LP3A,"[0.6115, 0.8957, -0.5586]","[4, 5, 2]","[[nice, case, sturdy, protective, ive, give, star, product, description, incomplete, mislead, doesnt, say, show, way, phone, case, click, tab, pull, put, direction, make, need, remove, replace, phone, belt, clip, turn, degree, case, horizontal, waste, money, purchase, buy, description, accurate, update, use, case, get, replacement, couple, week, find, thing, didnt, work, edge, case, protrude, edge, device, interfere, press, power, home, key, part, case, didnt, fit, phone, cause, slip, hand, bit, whole, assemblage, bulky, kickstand, didnt, something, sharp, get, case, nice, design, didnt, work], [case, kick, stand, great, slim, profile], [order, case, phone, happy, productwill, order, company, ]]","[[nice case sturdy protective ive give star product description incomplete mislead doesnt say show way phone case click tab pull put direction make need remove replace phone belt clip turn degree case horizontal waste money purchase buy description accurate update use case get replacement couple week find thing didnt work edge case protrude edge device interfere press power home key part case didnt fit phone cause slip hand bit whole assemblage bulky kickstand didnt something sharp get case nice design didnt work, 0.6115, 4], [case kick stand great slim profile, 0.8957, 5], [order case phone happy productwill order company , -0.5586, 2]]"
B0119GQ62E,[0.9595],[5],"[[excellent, product, way, cover, iphone, edgetoedge, curve, edge, installation, breeze, cover, curve, surface, iphone, blend, case, alignment, installation, breeze, vantage, side, concern, formation, kind, gap, corner, display, screen, disappear, time, otherwise, excellent, product, easy, installation, appeal, look, durability, post, update, accordinglybr, br, enjoybr, raj]]","[[excellent product way cover iphone edgetoedge curve edge installation breeze cover curve surface iphone blend case alignment installation breeze vantage side concern formation kind gap corner display screen disappear time otherwise excellent product easy installation appeal look durability post update accordinglybr br enjoybr raj, 0.9595, 5]]"
B011MLWQ8Y,[0.9732],[5],"[[work, excellent, price, signal, strength, well, name, brand, device, br, setup, easy, speed, excellent, happy, item]]","[[work excellent price signal strength well name brand device br setup easy speed excellent happy item, 0.9732, 5]]"
B011Z0O07M,[-0.8573],[5],"[[use, screen, protector, phone, temper, glass, always, dread, try, get, flimsy, plastic, one, bubble, spot, bubble, expect, thing, product, fit, device, bubble, course, took, couple, time, get, place, go, suck, phone, problems, say, im, satisfy]]","[[use screen protector phone temper glass always dread try get flimsy plastic one bubble spot bubble expect thing product fit device bubble course took couple time get place go suck phone problems say im satisfy, -0.8573, 5]]"
B012A3GYMC,"[0.8537, 0.6124]","[2, 5]","[[power, bank, star, capacity, guess, capacity, mention, description, number, say, nothing, expect, decent, power, bank, charge, cell, phone, moto, g, gen, great, battery, twice, recharging, power, bank, last, charge, phone, choose, power, bank, lightweight, carry, noticing, capacity, dont, need, worry, weight, tie, wall, socketbtw, charge, take, account, capacity, need, charge, thats, course, dont, want, buy, power, bank, charge, onebr, mention, description, need, tap, bank, see, charge, fact, need, hit, feel, weirdbr, design, good, yeah, im, worry, bit, usb, feeling, wont, longbr, recommend, friend], [work, great, ship, quick, say, ill, use, power, bank, time]]","[[power bank star capacity guess capacity mention description number say nothing expect decent power bank charge cell phone moto g gen great battery twice recharging power bank last charge phone choose power bank lightweight carry noticing capacity dont need worry weight tie wall socketbtw charge take account capacity need charge thats course dont want buy power bank charge onebr mention description need tap bank see charge fact need hit feel weirdbr design good yeah im worry bit usb feeling wont longbr recommend friend, 0.8537, 2], [work great ship quick say ill use power bank time, 0.6124, 5]]"
B012B9RTXS,"[0.0, 0.0]","[4, 1]","[[work], [take, charge, phone, phone, get, charging]]","[[work, 0.0, 4], [take charge phone phone get charging, 0.0, 1]]"
B012JQLNFI,"[0.0, 0.0]","[1, 1]","[[charger, fast, charger], [cheap, doesnt, change]]","[[charger fast charger, 0.0, 1], [cheap doesnt change, 0.0, 1]]"
B013FK8QQQ,[0.7083],[5],"[[case, kickstand, plus, recommend]]","[[case kickstand plus recommend, 0.7083, 5]]"
B013QXJZ0I,"[0.7717, 0.9798]","[5, 5]","[[buy, price, hop, job, find, something, like, think, find, charge, port, headphone, jack, open, stylus, open, fit, grip, add, thickness, opinion, button, function, please, order], [product, see, want, help, show, phone]]","[[buy price hop job find something like think find charge port headphone jack open stylus open fit grip add thickness opinion button function please order, 0.7717, 5], [product see want help show phone, 0.9798, 5]]"
B013XNILME,"[-0.3291, 0.631, -0.5284, -0.2755]","[2, 1, 2, 1]","[[quality, suffers, issue, note, temper, glass, screen, protector, try, effect, edge, screen, protector, display, lift, create, halo, effect], [buy, samsung, galaxy, note, read, review, say, work, came, glass, match, phone, line, front, camera, slot, camera, short, wont, go, way, top], [picture, note, ], [get, screen, protector, todayit, cover, screen, inch, cover, front, displease, consider, seller, picture, show, cover, entire, front]]","[[quality suffers issue note temper glass screen protector try effect edge screen protector display lift create halo effect, -0.3291, 2], [buy samsung galaxy note read review say work came glass match phone line front camera slot camera short wont go way top, 0.631, 1], [picture note , -0.5284, 2], [get screen protector todayit cover screen inch cover front displease consider seller picture show cover entire front, -0.2755, 1]]"
