B00Z0ME68A,"[0.765, -0.0387, 0.8617, 0.7906, 0.4215, 0.0, 0.7832, 0.5719, 0.128, 0.9444, 0.6249, 0.0, 0.296, 0.4404, 0.8561, -0.3182, 0.3515, 0.4215, 0.0, 0.0, -0.205, 0.8814, 0.7003, -0.6705, 0.8953, -0.5423, 0.1531, 0.8979, -0.7351]","[5, 5, 4, 5, 4, 2, 5, 5, 1, 2, 5, 1, 2, 3, 4, 2, 5, 4, 1, 1, 2, 4, 4, 1, 4, 1, 1, 5, 1]","[[dont, wear, people, think, hear, aid, guy, week, people, notice, start, speak, louder, side, note, work, phone, sound, distant, audio, work, fine, use, nice, listen, music, hear, people], [hurt, ear], [nevermind, picture, device, mean, pointy, end, fit, position, stay, put, sound, pairing, downside, learn, trial, error, hope, someone, give, tip, review, user, dont, know, someone, problem, insert, upside, picture], [product, main, issue, connect, phone, try, connect, phone, work, instruction, write, someone, speak, proper, english, bit, confuse, understand, go, mass, produce, product, atleast, pay, someone, write, instruction, sell, customer, item, packaging, feel, cheap, chance, use, product, something, tell, like, consider, make, reason, give, star, look, nice, fit, go, try, sell, product, cant, explain, use, instruction], [bottom, fell, dayit, loose, take, box], [itworks, music, gym, work, bluetooth, drawback, lose, purse, car, etc, gotta, get, carry, case, charger, unique, losthow, replace], [garbage, threw, trash], [sent, hurt, ear, cut], [happy, product, pair, use, sound, quality, good, fit, ear, left, ear, hearing, loss, issue], [work, ears, work], [work, day, cant, pair, anymore, follow, tip, help, try, find, contact, info], [poor, microphone, quality, wouldnt, connect, bluetooth, day, use, hurt], [im, like, thing, play, music, skip, gotta, get, use, ear], [ok, dont, use, car, kind, booger, pair, instruction, give, need, read, comment, instruction, fit, upside, picture, shown, leave, pretty, use, volume, phone], [hand, onebr, u, talk, understand, person, phone, listen, music, cmvery, nicee, adjusts, ur, b, happier, recieving, brand], [get, school, listen, music, notice, life, spand, minute, inconvinent, th, sound, quality, good], [cant, connect, head, set, phone, samsung, note, follow, direction, time, charge, head, set], [need, cushion, ok], [awesome, fit, perfectdiscreet, quality, audio], [nice], [ok, charging, take, switch, language, wouldnt, phone, lg, volt, name, come, dexcomrx, wouldnt, connect, give, minus, star], [couldnt, get, sync, cell, phone, lg, samsung, cost, decide, throw, chalk, experience, dont, think, deserves, star], [ok, cant, walk, device, go, sound, loud, talk, phone], [fit, decent, audio, picture, incorrect, earbud, use], [iphone, electronics, get, pair, minute, fit, ear, fall, problem, sound, quality, price, well], [work, boxi, like, go, pain, send], [product, hearing, aid, size], [bluetooth, work], [tiny]]","[[dont wear people think hear aid guy week people notice start speak louder side note work phone sound distant audio work fine use nice listen music hear people, 0.765, 5], [hurt ear, -0.0387, 5], [nevermind picture device mean pointy end fit position stay put sound pairing downside learn trial error hope someone give tip review user dont know someone problem insert upside picture, 0.8617, 4], [product main issue connect phone try connect phone work instruction write someone speak proper english bit confuse understand go mass produce product atleast pay someone write instruction sell customer item packaging feel cheap chance use product something tell like consider make reason give star look nice fit go try sell product cant explain use instruction, 0.7906, 5], [bottom fell dayit loose take box, 0.4215, 4], [itworks music gym work bluetooth drawback lose purse car etc gotta get carry case charger unique losthow replace, 0.0, 2], [garbage threw trash, 0.7832, 5], [sent hurt ear cut, 0.5719, 5], [happy product pair use sound quality good fit ear left ear hearing loss issue, 0.128, 1], [work ears work, 0.9444, 2], [work day cant pair anymore follow tip help try find contact info, 0.6249, 5], [poor microphone quality wouldnt connect bluetooth day use hurt, 0.0, 1], [im like thing play music skip gotta get use ear, 0.296, 2], [ok dont use car kind booger pair instruction give need read comment instruction fit upside picture shown leave pretty use volume phone, 0.4404, 3], [hand onebr u talk understand person phone listen music cmvery nicee adjusts ur b happier recieving brand, 0.8561, 4], [get school listen music notice life spand minute inconvinent th sound quality good, -0.3182, 2], [cant connect head set phone samsung note follow direction time charge head set, 0.3515, 5], [need cushion ok, 0.4215, 4], [awesome fit perfectdiscreet quality audio, 0.0, 1], [nice, 0.0, 1], [ok charging take switch language wouldnt phone lg volt name come dexcomrx wouldnt connect give minus star, -0.205, 2], [couldnt get sync cell phone lg samsung cost decide throw chalk experience dont think deserves star, 0.8814, 4], [ok cant walk device go sound loud talk phone, 0.7003, 4], [fit decent audio picture incorrect earbud use, -0.6705, 1], [iphone electronics get pair minute fit ear fall problem sound quality price well, 0.8953, 4], [work boxi like go pain send, -0.5423, 1], [product hearing aid size, 0.1531, 1], [bluetooth work, 0.8979, 5], [tiny, -0.7351, 1]]"
B00Z9ESV0S,[0.9917],[2],"[[want, rate, star, set, pay, review, product, nice, feature, stand, stickbr, br, prosbr, smalllove, camera, clamp, fold, nice, use, spacebr, handlefeels, solid, rubber, grip, fit, hand, wellbr, camera, clampi, think, place, iphone, clamp, tightbr, wrist, tetherjust, nice, thing, havebr, br, consbr, didnt, worki, try, use, couple, time, luck, plug, computer, usb, light, go, second, turn, try, cable, power, source, outcome, think, havent, get, light, come, think, dud, return, cant, get, work, tomorrowbr, cant, take, charge, dead, something, electronics, shotbr, br, base, review, price, reading, seem, half, reviewer, get, product, review, write, review, doesnt, mean, cant, item, thats, receive]]","[[want rate star set pay review product nice feature stand stickbr br prosbr smalllove camera clamp fold nice use spacebr handlefeels solid rubber grip fit hand wellbr camera clampi think place iphone clamp tightbr wrist tetherjust nice thing havebr br consbr didnt worki try use couple time luck plug computer usb light go second turn try cable power source outcome think havent get light come think dud return cant get work tomorrowbr cant take charge dead something electronics shotbr br base review price reading seem half reviewer get product review write review doesnt mean cant item thats receive, 0.9917, 2]]"
B00Z9VA1HC,"[0.2263, 0.9565]","[2, 5]","[[awesome, inexpensive, car, charger, charge, qi, phone, mount, tablet, galaxy, note, edge, get, charge, product, either, fit, mid, section, truck, port, place, supply, power, passenger, front, satisfy, work], [look, nice, charge, cell]]","[[awesome inexpensive car charger charge qi phone mount tablet galaxy note edge get charge product either fit mid section truck port place supply power passenger front satisfy work, 0.2263, 2], [look nice charge cell, 0.9565, 5]]"
B00ZD8BC10,[0.25],[3],"[[item, shipping]]","[[item shipping, 0.25, 3]]"
B00ZHZ1X3Q,[0.836],[5],"[[work, came, nook, great, price]]","[[work came nook great price, 0.836, 5]]"
B00ZW63DEW,[0.4404],[4],"[[headphone, price, thing, volume, button, didnt, work, iphone]]","[[headphone price thing volume button didnt work iphone, 0.4404, 4]]"
B0107QPOFC,"[-0.3818, 0.4215, 0.5775]","[2, 4, 3]","[[nice], [band, nice, look, apple, buckle, bluebr, problem, clip, fit, watch, reason, slide, didnt, want, force, less, risk, get, stuck, remove, wasnt, bid, deal, order, black, clip, change, space, black, link, black, clip, look, nicerbr, band], [videoidadcdcedaaccc, quick, review, apple, watch, strap, band, e, lv, apple, watch, mm, dark, bluebr, band, im, upset, adapter, anything]]","[[nice, -0.3818, 2], [band nice look apple buckle bluebr problem clip fit watch reason slide didnt want force less risk get stuck remove wasnt bid deal order black clip change space black link black clip look nicerbr band, 0.4215, 4], [videoidadcdcedaaccc quick review apple watch strap band e lv apple watch mm dark bluebr band im upset adapter anything, 0.5775, 3]]"
B010CIN66O,"[0.6705, 0.895]","[5, 1]","[[love, product, excite, find, product, online, clever, idea, way, product, design, flaw, prevents, use, case, iphone, im, sure, people, phone, charger, wont, fit, phone, case, know, case, meant, protect, phone, drop, water, difficult, case, remove, dread, think, remove, case, time, order, charge, phone, wish, use, entire, case, bottle, opener, wish, make, universal, version, use, phone, case, dont, purchase, use, durable, phone, case], [novelty, item, work, hubbie, us, trip]]","[[love product excite find product online clever idea way product design flaw prevents use case iphone im sure people phone charger wont fit phone case know case meant protect phone drop water difficult case remove dread think remove case time order charge phone wish use entire case bottle opener wish make universal version use phone case dont purchase use durable phone case, 0.6705, 5], [novelty item work hubbie us trip, 0.895, 1]]"
B010MWEOCU,"[0.0503, 0.487, 0.748, 0.1531, 0.0]","[3, 3, 3, 3, 5]","[[lot, review, mine, fit, phone, minimalist, design, come, knock, phone, desk, floor, protect, foot, drop, offer, protection, look, hold, find, something], [ok, nothing, mine, fit, something, buy, time, well, product, come, case, simple, silicon, case, phone, protect, take, fall, foot], [case, hardcore, case, u, want, put, phone, u, drop, lot, isnt, case, u, expect, give, comment, didnt, seem, look, tho, money, worth], [fit, smooth], [doesnt, add, grip, phone, outer]]","[[lot review mine fit phone minimalist design come knock phone desk floor protect foot drop offer protection look hold find something, 0.0503, 3], [ok nothing mine fit something buy time well product come case simple silicon case phone protect take fall foot, 0.487, 3], [case hardcore case u want put phone u drop lot isnt case u expect give comment didnt seem look tho money worth, 0.748, 3], [fit smooth, 0.1531, 3], [doesnt add grip phone outer, 0.0, 5]]"
B010PSC7ZM,[0.2732],[2],"[[product, doesnt, review, decide, try, anyway, put, glass, protector, decide, put, case, see, look, heard, crackle, sound, adamant, wasnt, screen, protector, claim, screen, protector, cracking, fault, attempt, add, case, top, wish, product, description, measurement, avoid, misunderstandingsbr, br, p, look, bit, realize, apple, screen, protector, misalign, glass, head]]","[[product doesnt review decide try anyway put glass protector decide put case see look heard crackle sound adamant wasnt screen protector claim screen protector cracking fault attempt add case top wish product description measurement avoid misunderstandingsbr br p look bit realize apple screen protector misalign glass head, 0.2732, 2]]"
B010WHLESC,[-0.8079],[1],"[[get, didnt, fit, phone, get]]","[[get didnt fit phone get, -0.8079, 1]]"
B0116RAJYC,[0.6249],[4],"[[use, yetbut, look, ultra, thinwill, update, review]]","[[use yetbut look ultra thinwill update review, 0.6249, 4]]"
B01177T4V0,[0.4201],[5],"[[happy, find, holster, case, belt, loop, husband, put, phone, pocket]]","[[happy find holster case belt loop husband put phone pocket, 0.4201, 5]]"
B011981J2O,[0.6463],[5],"[[case, clipbr, buy, screen, saver, take, film, build, case, come, fact, pay, lot, money, otter, box, quality, case, money, ring, work, stand, work, work, youre, miss, anything]]","[[case clipbr buy screen saver take film build case come fact pay lot money otter box quality case money ring work stand work work youre miss anything, 0.6463, 5]]"
B012HS2E56,[0.4754],[4],[[look]],"[[look, 0.4754, 4]]"
B012KEEZO0,[0.93],[5],"[[screen, protector, thick, filmy, one, find, fit, move, air, bubble, buy, recommend, anyone, look, screen, protector]]","[[screen protector thick filmy one find fit move air bubble buy recommend anyone look screen protector, 0.93, 5]]"
B013CJND4A,[0.4678],[4],"[[quality, case, compare, otterboxs, cost, x, time, purchase, color, add, collection, shipping, take, week, quicker, guess, color, wasnt, yet]]","[[quality case compare otterboxs cost x time purchase color add collection shipping take week quicker guess color wasnt yet, 0.4678, 4]]"
B013DN90EM,[0.4019],[5],"[[item, great, quality, slide, telescope, lens, get, non, blurry, image, moon, find, issue, use, elbow, telescope, take, elbow, get, decent, photo, limit, telescope]]","[[item great quality slide telescope lens get non blurry image moon find issue use elbow telescope take elbow get decent photo limit telescope, 0.4019, 5]]"
B013DW7CFW,[-0.298],[3],"[[case, nice, go, water, good, everyday, want, use, everyday, equip]]","[[case nice go water good everyday want use everyday equip, -0.298, 3]]"
B013HCJY0O,[0.9259],[4],"[[receive, skinomi, tech, glass, moto, g, mail, today, put, look, feel, well, see, hold]]","[[receive skinomi tech glass moto g mail today put look feel well see hold, 0.9259, 4]]"
